id,incident_number,incident_code,category,descript,day_of_the_week,date,time,police_dept_district,resolution,address,location_x_axis,location_y_axis
12100004868020,121000048,68020,OtherOffenses,Miscellaneous Investigation,Wednesday,2012-12-12,08:17,Bayview,None,1100 Block Of Oakdale Avenue,-122.382192583973,37.7298874272325
9088882216621,90888822,16621,Drug/narcotic,Possession Of Base/rock Cocaine,Saturday,2009-08-29,18:15,Central,"Arrest, Booked",900 Block Of Post St,-122.417634160005,37.787063186215
10004129763010,100041297,63010,Warrants,Warrant Arrest,Wednesday,2010-01-13,12:51,Richmond,None,500 Block Of Johnfkennedy Dr,-122.466204667893,37.7725405391593
7127256510045,71272565,10045,Embezzlement,"Embezzlement, Grand Theft By Employee",Wednesday,2007-12-12,17:38,Northern,None,700 Block Of Marina Bl,-122.446469886798,37.8051790435445
11034697471024,110346974,71024,Non-criminal,"Stay Away Or Court Order, Non-dv Related",Friday,2011-04-29,09:43,Mission,"Arrest, Booked",1000 Block Of Shotwell St,-122.415022828589,37.7516272270745
5126372265015,51263722,65015,OtherOffenses,Traffic Violation,Tuesday,2005-11-08,17:01,Northern,"Arrest, Cited","Laguna St, Page St",-122.425701357734,37.7736650049856
13059302016623,130593020,16623,Drug/narcotic,Possession Of Base/rock Cocaine For Sale,Friday,2013-07-19,00:01,Bayview,"Arrest, Booked",1700 Block Of Newcomb Avenue,-122.392643753605,37.7367848800513
11040796830190,110407968,30190,OtherOffenses,Violation Of Municipal Police Code,Saturday,2011-05-21,18:20,Southern,"Arrest, Booked",200 Block Of King St,-122.393110640713,37.7773103219698
13021150164070,130211501,64070,SuspiciousOcc,Suspicious Occurrence,Tuesday,2013-02-26,12:00,Northern,None,3600 Block Of Fillmore St,-122.436634731484,37.803135683639
3109523865016,31095238,65016,OtherOffenses,"Drivers License, Suspended Or Revoked",Tuesday,2003-09-16,18:34,Taraval,"Arrest, Booked",500 Block Of Lakeview Avenue,-122.455609239258,37.7181811654699
10036164706304,100361647,6304,Larceny/theft,Grand Theft From A Building,Thursday,2010-04-15,21:00,Central,None,400 Block Of Mason St,-122.409925328419,37.7877640990096
7098781406242,70987814,6242,Larceny/theft,Petty Theft From Locked Auto,Wednesday,2007-09-26,07:00,Southern,None,"15th St, Rhodeisland St",-122.402810851415,37.7673727128849
7078857106244,70788571,6244,Larceny/theft,Grand Theft From Locked Auto,Friday,2007-08-03,21:15,Southern,None,"8th St, Mission St",-122.41316085097,37.7774566611807
9102945916660,91029459,16660,Drug/narcotic,Possession Of Controlled Substance,Monday,2009-10-05,18:07,Bayview,"Arrest, Booked",200 Block Of Missouri St,-122.396653544153,37.763198917407
4056519964070,40565199,64070,SuspiciousOcc,Suspicious Occurrence,Monday,2004-05-17,15:30,Richmond,None,1000 Block Of Anza St,-122.459310721104,37.7793622489494
11045165863010,110451658,63010,Warrants,Warrant Arrest,Saturday,2011-06-04,14:08,Park,"Arrest, Booked","Oak St, Pierce St",-122.434111123725,37.7735493014892
13073980426030,130739804,26030,Arson,Arson,Wednesday,2013-09-04,19:00,Southern,None,1200 Block Of Folsom St,-122.410802477808,37.7743299153836
10024421904134,100244219,4134,Assault,Battery,Sunday,2010-03-14,18:30,Tenderloin,"Arrest, Booked",200 Block Of Turk St,-122.413237516676,37.7828430233213
6037567709120,60375677,9120,Forgery/counterfeiting,"Forgery, Drivers License Or Id-card",Monday,2006-01-09,00:01,Southern,Not Prosecuted,800 Block Of Bryant St,-122.403404791479,37.775420706711
11038898263010,110388982,63010,Warrants,Warrant Arrest,Saturday,2011-05-14,11:45,Tenderloin,"Arrest, Booked","Eddy St, Taylor St",-122.410955248906,37.7841399509594
9039610465015,90396104,65015,OtherOffenses,Traffic Violation,Wednesday,2009-04-15,23:30,Ingleside,"Arrest, Cited","Mission St, Valencia St",-122.420021755228,37.7453901680777
12029645065015,120296450,65015,OtherOffenses,Traffic Violation,Saturday,2012-04-14,14:40,Bayview,"Arrest, Cited",2000 Block Of Bay Shore Bl,-122.399766787626,37.7141809476816
3018309613070,30183096,13070,Prostitution,Solicits To Visit House Of Prostitution,Friday,2003-02-14,05:37,Northern,"Arrest, Cited","Hemlock St, Larkin St",-122.418368839172,37.7874861572042
13064034205141,130640342,5141,Burglary,"Burglary,residence Under Constrt, Forcible Entry",Friday,2013-08-02,19:30,Park,None,200 Block Of Broderick St,-122.439063978723,37.7724563813413
6054707063010,60547070,63010,Warrants,Warrant Arrest,Tuesday,2006-05-23,15:14,Southern,"Arrest, Booked","7th St, Market St",-122.412515341356,37.7804777480508
13078081326142,130780813,26142,Kidnapping,False Imprisonment,Monday,2013-09-16,23:50,Tenderloin,"Arrest, Booked",300 Block Of Turk St,-122.414900544562,37.7827419623926
6019706706240,60197067,6240,Larceny/theft,Attempted Theft From Locked Vehicle,Tuesday,2006-02-21,02:20,Richmond,Located,"Fulton St, 28th Avenue",-122.487399068269,37.7724212205123
10022740319057,100227403,19057,Assault,Threats Against Life,Tuesday,2010-03-09,19:00,Mission,None,2700 Block Of 21st St,-122.409125012393,37.7576778102612
7102477005042,71024770,5042,Burglary,"Burglary Of Residence, Attempted Forcible Entry",Tuesday,2007-10-02,20:30,Taraval,None,1700 Block Of 21st Avenue,-122.478609720461,37.7550647951126
5088902028150,50889020,28150,Vandalism,"Malicious Mischief, Vandalism",Monday,2005-08-08,00:25,Southern,"Arrest, Booked",0 Block Of Mary St,-122.378234380571,37.7331074057574
6031639205013,60316392,5013,Burglary,"Burglary Of Apartment House, Unlawful Entry",Thursday,2006-03-23,12:00,Ingleside,None,100 Block Of Tiffany Avenue,-122.421113318205,37.7451988038002
12030281965016,120302819,65016,OtherOffenses,"Drivers License, Suspended Or Revoked",Monday,2012-04-16,23:05,Mission,"Arrest, Booked",1800 Block Of Mission St,-122.419832890144,37.7674625261825
10092215806372,100922158,6372,Larceny/theft,Petty Theft Of Property,Friday,2010-10-01,18:37,Southern,None,900 Block Of Mission St,-122.406892170029,37.7824831658141
9034417562050,90344175,62050,Warrants,Enroute To Outside Jurisdiction,Thursday,2009-04-02,11:07,Northern,"Arrest, Booked","Fillmore St, Golden Gate Avenue",-122.431952436364,37.7795647498663
11029477174000,110294771,74000,MissingPerson,Missing Adult,Tuesday,2009-12-01,12:00,Southern,None,800 Block Of Bryant St,-122.403404791479,37.775420706711
12003941065016,120039410,65016,OtherOffenses,"Drivers License, Suspended Or Revoked",Saturday,2012-01-14,20:31,Mission,"Arrest, Cited","24th St, South Van Ness Avenue",-122.416268632715,37.7523735149599
13058028704012,130580287,4012,Assault,Aggravated Assault With A Knife,Sunday,2013-07-14,23:40,Tenderloin,None,"Fulton St, Hyde St",-122.415127837608,37.7797870676495
13044423515095,130444235,15095,Non-criminal,Tarasoff Report,Wednesday,2013-05-29,22:20,Mission,None,1000 Block Of Potrero Avenue,-122.406539115148,37.7564864109309
5108336012026,51083360,12026,WeaponLaws,Discharge Firearm At An Inhabited Dwelling,Monday,2005-09-26,15:48,Ingleside,None,"Persia Av, Sunnydale Avenue",-122.425836398256,37.7182791280543
6000180027300,60001800,27300,OtherOffenses,Miscellaneous State Misdemeanor,Sunday,2006-01-01,13:05,Bayview,"Arrest, Cited",600 Block Of Jamestown Avenue,-122.387833652325,37.7131072321423
8033232806303,80332328,6303,Larceny/theft,Petty Theft From A Building,Saturday,2008-03-29,16:00,Taraval,None,300 Block Of Eucalyptus Dr,-122.476383904851,37.7310536423783
12054766775000,120547667,75000,MissingPerson,Found Person,Wednesday,2012-07-11,12:00,Mission,None,1400 Block Of Guerrero St,-122.422415578627,37.74840056927
12005944606242,120059446,6242,Larceny/theft,Petty Theft From Locked Auto,Sunday,2012-01-22,10:00,Tenderloin,None,"Golden Gate Av, Hyde St",-122.415508242782,37.7816542806076
11034521163010,110345211,63010,Warrants,Warrant Arrest,Saturday,2011-04-23,16:03,Southern,"Arrest, Booked",500 Block Of Natoma St,-122.408298620023,37.7797671147527
10026930816410,100269308,16410,Drug/narcotic,Possession Of Hallucinogenic,Monday,2010-03-22,09:49,Southern,"Arrest, Booked",800 Block Of Bryant St,-122.403404791479,37.775420706711
6095209371000,60952093,71000,Non-criminal,Lost Property,Sunday,2006-09-03,19:00,Mission,None,0 Block Of Capp St,-122.418613686714,37.766202876914
5075677005151,50756770,5151,Burglary,"Burglary,store Under Construction, Forcible Entry",Thursday,2005-07-07,07:03,Southern,None,1000 Block Of Howard St,-122.409158691757,37.7782352182811
4109107264070,41091072,64070,SuspiciousOcc,Suspicious Occurrence,Thursday,2004-09-23,14:00,Park,None,1500 Block Of Haight St,-122.447783070559,37.7699549503465
9083431465015,90834314,65015,OtherOffenses,Traffic Violation,Saturday,2009-08-15,20:45,Mission,"Arrest, Cited","Mission St, 15th St",-122.419827929961,37.7666737551835
7115469064015,71154690,64015,Non-criminal,"Aided Case, Injured Person",Saturday,2007-11-10,03:30,Central,None,1300 Block Of Pine St,-122.418028132982,37.7898812870744
8038497106233,80384971,6233,Larceny/theft,Petty Theft Auto Strip,Saturday,2008-04-12,23:30,Mission,None,3900 Block Of 20th St,-122.429175374343,37.7579656087872
7035740500000,70357405,0,OtherOffenses,Unknown Complaint,Saturday,2007-04-07,16:30,Central,None,"Powell St, Sutter St",-122.408597386677,37.789224205873
3144635264070,31446352,64070,SuspiciousOcc,Suspicious Occurrence,Friday,2003-12-12,01:00,Southern,None,900 Block Of Folsom St,-122.403860419019,37.7798137203933
8031664504134,80316645,4134,Assault,Battery,Wednesday,2008-03-26,07:45,Tenderloin,None,500 Block Of Ofarrell St,-122.413820070176,37.7857382950322
12093069206244,120930692,6244,Larceny/theft,Grand Theft From Locked Auto,Friday,2012-11-16,22:30,Central,"Arrest, Booked",700 Block Of Vallejo St,-122.409791662293,37.7985083480435
5079015405012,50790154,5012,Burglary,"Burglary Of Apartment House, Att Forcible Entry",Friday,2005-07-15,08:30,Park,None,500 Block Of Duboce Avenue,-122.43301268519,37.7691592647351
5029325507021,50293255,7021,VehicleTheft,Stolen Automobile,Tuesday,2005-03-15,17:00,Richmond,None,600 Block Of 9th Avenue,-122.467082973809,37.776140584815
10059318519090,100593185,19090,Drunkenness,Under Influence Of Alcohol In A Public Place,Sunday,2010-06-27,20:40,Tenderloin,None,100 Block Of Mason St,-122.409336821846,37.7848337315521
5001776063010,50017760,63010,Warrants,Warrant Arrest,Wednesday,2005-01-05,20:30,Northern,"Arrest, Booked",100 Block Of Church St,-122.429018189436,37.7675072901238
10027205004082,100272050,4082,Assault,"Firearm, Discharging At Occupied Bldg, Vehicle, Or Aircraft",Monday,2010-03-22,23:30,Taraval,"Arrest, Booked",4200 Block Of Moraga St,-122.50818228621,37.7546587655126
9024639916110,90246399,16110,Drug/narcotic,Possession Of Heroin For Sales,Sunday,2009-03-08,16:56,Tenderloin,"Arrest, Booked",500 Block Of Ofarrell St,-122.413820070176,37.7857382950322
12003482419015,120034824,19015,OtherOffenses,Disrupts School Activities,Monday,2012-01-09,00:01,Mission,None,400 Block Of Church St,-122.4286109134,37.7632288973036
4061197463010,40611974,63010,Warrants,Warrant Arrest,Friday,2004-05-28,09:39,Mission,"Arrest, Booked",300 Block Of Division St,-122.409528901583,37.7690697135105
9119620204012,91196202,4012,Assault,Aggravated Assault With A Knife,Friday,2009-11-20,17:00,Southern,None,900 Block Of Market St,-122.408421116922,37.7835699386918
7005464506244,70054645,6244,Larceny/theft,Grand Theft From Locked Auto,Monday,2007-01-15,20:00,Northern,None,900 Block Of Fulton St,-122.432423434485,37.777647369969
9062400226029,90624002,26029,Arson,Attempted Arson,Wednesday,2009-06-17,17:00,Ingleside,None,200 Block Of Desmond St,-122.406478914823,37.7087762178548
11013059506302,110130595,6302,Larceny/theft,Petty Theft From A Building,Wednesday,2010-12-01,09:00,Taraval,None,600 Block Of Lakeview Avenue,-122.456626551821,37.7182892132914
10095798916621,100957989,16621,Drug/narcotic,Possession Of Base/rock Cocaine,Thursday,2010-10-14,18:23,Tenderloin,"Arrest, Booked",300 Block Of Turk St,-122.41487855905,37.7826335031541
4142471864070,41424718,64070,SuspiciousOcc,Suspicious Occurrence,Monday,2004-12-13,09:00,Park,None,2200 Block Of Ofarrell St,-122.441324830173,37.7822914617391
7131967816621,71319678,16621,Drug/narcotic,Possession Of Base/rock Cocaine,Wednesday,2007-12-26,21:17,Northern,"Arrest, Booked",1000 Block Of Geary St,-122.420592674438,37.785841624062
9121132765050,91211327,65050,DrivingUnderTheInfluence,Driving While Under The Influence Of Alcohol,Wednesday,2009-11-25,02:56,Taraval,"Arrest, Cited","18th Av, Irving St",-122.476052572509,37.7636074551324
3044811304134,30448113,4134,Assault,Battery,Wednesday,2003-04-16,16:00,Northern,None,"Van Ness Av, Clay St",-122.422695629372,37.7921733284299
9105547627170,91055476,27170,OtherOffenses,Resisting Arrest,Monday,2009-10-12,20:55,Richmond,"Arrest, Booked",4000 Block Of Balboa St,-122.502140716111,37.7754399568058
12098722351040,120987223,51040,Non-criminal,Aided Case,Friday,2012-12-07,14:00,Taraval,None,1800 Block Of 22nd Avenue,-122.47969022609,37.7531457102925
4031919012100,40319190,12100,WeaponLaws,Poss Of Loaded Firearm,Friday,2004-03-19,20:00,Southern,"Arrest, Booked",500 Block Of Minna St,-122.408673540372,37.7800574377607
5138570206364,51385702,6364,Larceny/theft,Grand Theft Shoplifting,Friday,2005-12-09,18:01,Tenderloin,"Arrest, Booked",100 Block Of Stockton St,-122.40642786236,37.78710945429
5118705307026,51187053,7026,VehicleTheft,Stolen Miscellaneous Vehicle,Wednesday,2005-10-19,18:00,Ingleside,None,600 Block Of Cambridge St,-122.417224139302,37.72339209003
10094322306112,100943223,6112,Larceny/theft,Grand Theft Pickpocket,Sunday,2010-10-10,15:10,Central,None,1600 Block Of The Embarcaderonorth St,-122.410774214375,37.8084350175869
4037785327065,40377853,27065,Fraud,False Id To Peace Officer,Friday,2004-04-02,09:40,Northern,"Arrest, Cited","Van Ness Av, Mcallister St",-122.42025048261,37.7800745746105
9058108228160,90581082,28160,Vandalism,"Malicious Mischief, Vandalism Of Vehicles",Friday,2009-06-05,21:15,Northern,None,"Larkin St, Turk St",-122.417340533228,37.7823798970477
9032847006304,90328470,6304,Larceny/theft,Grand Theft From A Building,Sunday,2009-03-29,13:00,Central,None,200 Block Of Post St,-122.406000218489,37.7885406192723
12094606906301,120946069,6301,Larceny/theft,Petty Theft From A Building,Friday,2012-10-19,08:31,Richmond,None,400 Block Of 26th Avenue,-122.485806034088,37.7809908061782
10071300406343,100713004,6343,Larceny/theft,Petty Theft Coin Operated Machine,Wednesday,2010-08-04,18:55,Mission,"Arrest, Cited",1000 Block Of Potrero Avenue,-122.406539115148,37.7564864109309
6037246306303,60372463,6303,Larceny/theft,Petty Theft From A Building,Thursday,2006-04-06,18:00,Southern,None,200 Block Of King St,-122.393110640713,37.7773103219698
7044879765010,70448797,65010,OtherOffenses,Traffic Violation Arrest,Wednesday,2007-05-02,15:51,Richmond,"Arrest, Cited","Clement St, 8th Avenue",-122.466565488599,37.782849155153
6117621207021,61176212,7021,VehicleTheft,Stolen Automobile,Tuesday,2006-10-31,03:00,Ingleside,None,200 Block Of Teresita Bl,-122.450768418978,37.7424581903774
9078888026150,90788880,26150,OtherOffenses,Parole Violation,Monday,2009-08-03,21:21,Tenderloin,"Arrest, Booked","Golden Gate Av, Larkin St",-122.417146843836,37.781446350134
12072092616780,120720926,16780,WeaponLaws,"Firearm, Armed While Possessing Controlled Substance",Saturday,2012-09-08,20:51,Southern,"Arrest, Booked","5th St, Market St",-122.408068345148,37.7839916768161
8604901428150,86049014,28150,Vandalism,"Malicious Mischief, Vandalism",Thursday,2008-07-03,23:30,Taraval,None,1600 Block Of 39th Avenue,-122.498026059204,37.7560726372194
5046209604134,50462096,4134,Assault,Battery,Tuesday,2005-04-26,11:34,Mission,"Arrest, Cited",1800 Block Of Folsom St,-122.415605496237,37.7677177520665
9040284219090,90402842,19090,Drunkenness,Under Influence Of Alcohol In A Public Place,Friday,2009-04-17,20:43,Bayview,"Arrest, Booked",1800 Block Of Palou Avenue,-122.396072849654,37.7369730787307
6044316104013,60443161,4013,Assault,Aggravated Assault With A Deadly Weapon,Wednesday,2006-04-26,07:31,Richmond,"Arrest, Booked",1800 Block Of Clement St,-122.478985986075,37.7822292745003
7132060365010,71320603,65010,OtherOffenses,Traffic Violation Arrest,Thursday,2007-12-27,06:29,Mission,District Attorney Refuses To Prosecute,"17th St, Valencia St",-122.421733767763,37.7632996945938
10616518471000,106165184,71000,Non-criminal,Lost Property,Monday,2010-12-20,17:00,Southern,None,"Market St, 5th St",-122.408068345148,37.7839916768161
6029378405013,60293784,5013,Burglary,"Burglary Of Apartment House, Unlawful Entry",Friday,2006-03-17,17:00,Northern,None,3000 Block Of Broderick St,-122.444161855212,37.7983620658279
3075204928160,30752049,28160,Vandalism,"Malicious Mischief, Vandalism Of Vehicles",Monday,2003-06-23,07:00,Northern,None,"Eddy St, Polk St",-122.419183096369,37.7830998244363
13086713207021,130867132,7021,VehicleTheft,Stolen Automobile,Friday,2013-10-11,15:30,Ingleside,None,"Ney St, Congdon St",-122.426084863135,37.7301363675982
8043269964020,80432699,64020,Non-criminal,"Aided Case, Mental Disturbed",Friday,2008-04-25,14:20,Ingleside,Psychopathic Case,500 Block Of Visitacion Avenue,-122.404749828002,37.7104968099079
6069224913070,60692249,13070,Prostitution,Solicits To Visit House Of Prostitution,Friday,2006-06-30,08:35,Northern,"Arrest, Cited","Larkin St, Post St",-122.41827417166,37.7870372043685
6138257263010,61382572,63010,Warrants,Warrant Arrest,Sunday,2006-12-31,16:39,Bayview,"Arrest, Booked",1200 Block Of Newhall St,-122.391429065321,37.7366235255732
10099630706361,100996307,6361,Larceny/theft,Petty Theft Shoplifting,Tuesday,2010-10-26,16:40,Mission,"Arrest, Booked",2300 Block Of 16th St,-122.409529913278,37.7657184395282
11014978430000,110149784,30000,OtherOffenses,"Permit Violation, Police (general)",Saturday,2011-02-19,22:47,Central,"Arrest, Cited","The Embarcaderonorth St, Sansome St",-122.403591933967,37.8054129166837
10087499104138,100874991,4138,Assault,"Battery, Former Spouse Or Dating Relationship",Tuesday,2010-09-21,02:50,Richmond,"Arrest, Booked",800 Block Of 46th Avenue,-122.506821062061,37.7724536866236
3069932202002,30699322,2002,"SexOffenses,Forcible","Forcible Rape, Armed With A Sharp Instrument",Tuesday,2003-06-10,03:00,Northern,None,"Sutter St, Van Ness Avenue",-122.421762501799,37.7875490094886
10096201304134,100962013,4134,Assault,Battery,Saturday,2010-10-16,00:50,Tenderloin,None,400 Block Of Eddy St,-122.41506687647,37.7835634796332
7121285616645,71212856,16645,Drug/narcotic,"Controlled Substance Violation, Loitering For",Monday,2007-11-26,22:48,Tenderloin,"Arrest, Booked","Jones St, Ofarrell St",-122.412970537591,37.7857883766888
4133400406244,41334004,6244,Larceny/theft,Grand Theft From Locked Auto,Sunday,2004-11-21,21:30,Southern,None,"9th St, Harrison St",-122.41007854485,37.7725264934306
3025194471010,30251944,71010,OtherOffenses,Lost/stolen License Plate,Friday,2003-02-28,22:00,Bayview,None,"3rd St, Gilman Avenue",-122.395622324596,37.7224336237004
4042253306234,40422533,6234,Larceny/theft,Grand Theft Auto Strip,Saturday,2004-04-10,12:00,Park,None,"Warren Dr, Locksley Avenue",-122.463227244961,37.7585613680114
4051663104012,40516631,4012,Assault,Aggravated Assault With A Knife,Wednesday,2004-05-05,13:10,Tenderloin,"Arrest, Booked",700 Block Of Ofarrell St,-122.417085357424,37.7852153590471
6010699906374,60106999,6374,Larceny/theft,Grand Theft Of Property,Friday,2006-01-27,18:30,Southern,None,100 Block Of Steuart St,-122.392349764257,37.7926450897756
6130773016625,61307730,16625,Drug/narcotic,Sale Of Base/rock Cocaine,Saturday,2006-12-09,15:20,Tenderloin,"Arrest, Booked","Eddy St, Larkin St",-122.41753069698,37.7833107539969
3074207865016,30742078,65016,OtherOffenses,"Drivers License, Suspended Or Revoked",Friday,2003-06-20,14:22,Bayview,"Arrest, Cited","Shafter Av, Ingalls St",-122.38512249167,37.727859716919
5041529962050,50415299,62050,Warrants,Enroute To Outside Jurisdiction,Thursday,2005-04-14,18:17,Southern,"Arrest, Booked",1100 Block Of Market St,-122.41371122073,37.7796660426062
6014371964015,60143719,64015,Non-criminal,"Aided Case, Injured Person",Tuesday,2006-02-07,13:20,Bayview,"Arrest, Booked",1300 Block Of Revere Avenue,-122.385545453301,37.728979731984
7110525128090,71105251,28090,Vandalism,Malicious Mischief,Sunday,2007-10-28,09:30,Ingleside,None,700 Block Of Rockdale Dr,-122.452020344629,37.7413116550616
9021744765016,90217447,65016,OtherOffenses,"Drivers License, Suspended Or Revoked",Saturday,2009-02-28,16:30,Bayview,"Arrest, Booked","3rd St, Paul Avenue",-122.395622324587,37.7224336236684
4132284905153,41322849,5153,Burglary,"Burglary,store Under Construction, Unlawful Entry",Friday,2004-11-19,08:00,Southern,None,500 Block Of Market St,-122.400194768944,37.7900527936016
13092210606243,130922106,6243,Larceny/theft,Petty Theft From Locked Auto,Tuesday,2013-10-29,18:00,Central,None,"Jones St, Washington St",-122.414652600787,37.7941089194366
3122921168000,31229211,68000,Non-criminal,Fire Report,Sunday,2003-10-19,13:00,Richmond,None,100 Block Of 5th Avenue,-122.463628372092,37.7859062974194
10612124906372,106121249,6372,Larceny/theft,Petty Theft Of Property,Friday,2010-09-24,07:00,Richmond,None,1400 Block Of Lyon St,-122.444807337208,37.784151955804
9069921516623,90699215,16623,Drug/narcotic,Possession Of Base/rock Cocaine For Sale,Thursday,2009-07-09,20:32,Tenderloin,"Arrest, Booked",500 Block Of Ellis St,-122.414615262229,37.784689282473
5091350006244,50913500,6244,Larceny/theft,Grand Theft From Locked Auto,Thursday,2005-08-11,19:00,Southern,None,400 Block Of 10th St,-122.410541166987,37.7709130566165
10070284716705,100702847,16705,Drug/narcotic,Maintaining Premise Where Narcotics Are Sold/used,Sunday,2010-08-01,18:23,Park,"Arrest, Booked",0 Block Of Glenview Dr,-122.447708916641,37.74751697405
5002964671010,50029646,71010,OtherOffenses,Lost/stolen License Plate,Thursday,2005-01-06,12:00,Southern,None,"7th St, Harrison St",-122.40630013874,37.7755131129708
5003060907025,50030609,7025,VehicleTheft,Stolen Truck,Sunday,2005-01-09,07:00,Mission,None,"14th St, Trainor St",-122.414541886179,37.7686029130671
11061224203073,110612242,3073,Robbery,"Robbery, Armed With A Dangerous Weapon",Sunday,2011-07-31,02:30,Ingleside,None,3800 Block Of San Bruno Avenue,-122.401689976899,37.7144291854658
6071825964020,60718259,64020,Non-criminal,"Aided Case, Mental Disturbed",Friday,2006-07-07,09:59,Bayview,Psychopathic Case,4800 Block Of 3rd St,-122.390705516025,37.734368010663
13058971205112,130589712,5112,Burglary,"Burglary,apt Under Construction, Att. Forcible",Wednesday,2013-07-17,03:30,Northern,None,900 Block Of Hayes St,-122.432018826546,37.7756739897587
7094586265016,70945862,65016,OtherOffenses,"Drivers License, Suspended Or Revoked",Saturday,2007-09-15,06:03,Southern,"Arrest, Cited","Market St, Fell St",-122.417504703145,37.7765400380328
8017649905083,80176499,5083,Burglary,"Burglary, Hot Prowl, Unlawful Entry",Tuesday,2008-02-19,08:15,Northern,None,3700 Block Of Webster St,-122.435521453522,37.8052232913562
7103052310110,71030523,10110,Fraud,"Trick And Device, Petty Theft",Friday,2007-10-05,15:00,Richmond,"Arrest, Booked",700 Block Of Arguello Bl,-122.45861172195,37.7767190507974
12023793716623,120237937,16623,Drug/narcotic,Possession Of Base/rock Cocaine For Sale,Friday,2012-03-23,22:19,Ingleside,"Arrest, Booked",5000 Block Of Mission St,-122.440388229194,37.7174580136719
5026751764070,50267517,64070,SuspiciousOcc,Suspicious Occurrence,Wednesday,2005-03-09,11:00,Mission,"Arrest, Booked",1300 Block Of Potrero Avenue,-122.40613399452,37.7515505329921
11038221312120,110382213,12120,WeaponLaws,Poss Of Prohibited Weapon,Wednesday,2011-05-11,20:30,Mission,"Arrest, Booked","Mission St, 20th St",-122.419052694349,37.7586324051562
8067750028160,80677500,28160,Vandalism,"Malicious Mischief, Vandalism Of Vehicles",Saturday,2008-06-28,20:57,Northern,None,2200 Block Of Vanness Avenue,-122.423682814338,37.7962046209564
7608554506244,76085545,6244,Larceny/theft,Grand Theft From Locked Auto,Saturday,2007-11-17,18:30,Mission,None,"20th St, Mission St",-122.419052694349,37.7586324051562
13042468515151,130424685,15151,OtherOffenses,"Stay Away Order Violation, Dv Related",Thursday,2013-05-23,10:17,Mission,None,2200 Block Of Market St,-122.431957685196,37.7649357189679
6124316204134,61243162,4134,Assault,Battery,Wednesday,2006-11-22,18:00,Central,"Arrest, Booked",0 Block Of Drumm St,-122.396556426173,37.7941169057941
13083633128135,130836331,28135,OtherOffenses,Harassing Phone Calls,Friday,2013-09-13,16:22,Central,None,600 Block Of Taylor St,-122.411718822926,37.7883334255527
10077283416662,100772834,16662,Drug/narcotic,Possession Of Controlled Substance For Sale,Sunday,2010-08-22,21:20,Southern,"Arrest, Booked",1000 Block Of Mission St,-122.40989282029,37.7801134973164
7075408330155,70754083,30155,LiquorLaws,Consuming Alcohol In Public View,Thursday,2007-07-26,07:30,Southern,"Arrest, Booked",400 Block Of Jessie St,-122.408437135288,37.7819543949998
13023984826150,130239848,26150,OtherOffenses,Parole Violation,Saturday,2013-03-23,00:50,Bayview,"Arrest, Booked","Newcomb Av, 3rd St",-122.390416955474,37.7355926105862
4067254007041,40672540,7041,VehicleTheft,"Vehicle, Recovered, Auto",Monday,2004-06-07,10:00,Park,None,"Fell St, Baker St",-122.440923876406,37.7736351065244
4034820271000,40348202,71000,Non-criminal,Lost Property,Thursday,2004-03-25,15:30,Bayview,None,5000 Block Of 3rd St,-122.391517460482,37.7328509353031
5121322272000,51213222,72000,Non-criminal,Found Property,Thursday,2005-10-27,10:00,Ingleside,None,"Argonaut Av, Mccarthy Avenue",-122.41390288807,37.710631110334
13037289619057,130372896,19057,Assault,Threats Against Life,Tuesday,2013-05-07,08:30,Bayview,None,600 Block Of Deharo St,-122.401191922623,37.7616428225519
7044786803074,70447868,3074,Robbery,"Robbery, Bodily Force",Tuesday,2007-05-01,19:00,Tenderloin,None,300 Block Of Eddy St,-122.412930522059,37.7838344374141
