id,incident_number,incident_code,category,descript,day_of_the_week,date,time,police_dept_district,resolution,address,location_x_axis,location_y_axis
12057792128160,120577921,28160,Vandalism,"Malicious Mischief, Vandalism Of Vehicles",Sunday,2012-07-22,04:00,Bayview,None,1500 Block Of Indiana St,-122.390566006127,37.7507377457056
8115751512050,81157515,12050,WeaponLaws,Loitering While Carrying Concealed Weapon,Wednesday,2008-10-29,10:10,Tenderloin,"Arrest, Booked",100 Block Of Leavenworth St,-122.413893155951,37.782346520673
8040898505013,80408985,5013,Burglary,"Burglary Of Apartment House, Unlawful Entry",Friday,2008-04-11,12:00,Northern,None,0 Block Of Sanchez St,-122.43120329125,37.7684456939511
4019264571000,40192645,71000,Non-criminal,Lost Property,Tuesday,2004-02-17,17:00,Southern,None,800 Block Of Bryant St,-122.403404791479,37.775420706711
12003667605073,120036676,5073,Burglary,"Burglary, Unlawful Entry",Friday,2012-01-13,19:41,Mission,"Arrest, Booked",300 Block Of Sanchez St,-122.430871936382,37.7635433745815
3105559926080,31055599,26080,OtherOffenses,Conspiracy,Sunday,2003-09-07,01:18,Southern,"Arrest, Booked",800 Block Of Harrison St,-122.400799947914,37.7799338672319
11078389365050,110783893,65050,DrivingUnderTheInfluence,Driving While Under The Influence Of Alcohol,Wednesday,2011-09-28,19:45,Ingleside,"Arrest, Booked",700 Block Of Moscow St,-122.431809203579,37.7158291631877
10084462127300,100844621,27300,OtherOffenses,Miscellaneous State Misdemeanor,Sunday,2010-09-12,13:39,Tenderloin,"Arrest, Booked",400 Block Of Jones St,-122.412944969085,37.7853224073204
13051828804134,130518288,4134,Assault,Battery,Monday,2013-06-24,12:15,Tenderloin,None,"Ofarrell St, Stockton St",-122.406401668335,37.7866144613366
7115870568020,71158705,68020,OtherOffenses,Miscellaneous Investigation,Sunday,2007-11-11,16:27,Mission,None,"24th St, Church St",-122.427439726983,37.7517051328882
9102787327195,91027873,27195,Trespass,Trespassing,Monday,2009-10-05,00:30,Southern,None,800 Block Of Bryant St,-122.403404791479,37.775420706711
6033898228160,60338982,28160,Vandalism,"Malicious Mischief, Vandalism Of Vehicles",Wednesday,2006-03-29,18:00,Central,None,100 Block Of Clay St,-122.397373740066,37.7953338267436
7129900807055,71299008,7055,RecoveredVehicle,Recovered Vehicle - Stolen Outside Sf,Thursday,2007-12-20,08:00,Ingleside,None,700 Block Of Athens St,-122.43261172424,37.7162133317028
6063387316740,60633873,16740,Drug/narcotic,Under The Influence Of Controlled Substances,Thursday,2006-06-15,08:20,Tenderloin,"Arrest, Cited",0 Block Of Turk St,-122.409853729941,37.7833862379382
13085228006244,130852280,6244,Larceny/theft,Grand Theft From Locked Auto,Tuesday,2013-10-08,20:45,Northern,None,"Post St, Laguna St",-122.428151140162,37.7857828233879
8004248651040,80042486,51040,Non-criminal,Aided Case,Saturday,2008-01-12,22:50,Southern,None,"Mission St, Washburn St",-122.415131149807,37.7758891459127
3015697404154,30156974,4154,Assault,Battery Of A Police Officer,Friday,2003-02-07,09:25,Bayview,"Arrest, Booked",0 Block Of Dedman Ct,-122.384907106098,37.7368469604958
4130731803414,41307318,3414,Robbery,Attempted Robbery On The Street With Bodily Force,Tuesday,2004-11-16,01:51,Ingleside,None,0 Block Of Cotter St,-122.433906686698,37.7277213848716
13017046875030,130170468,75030,Non-criminal,Case Closure,Wednesday,2013-02-27,18:15,Southern,Complainant Refuses To Prosecute,800 Block Of Bryant St,-122.403404791479,37.775420706711
12605895106244,126058951,6244,Larceny/theft,Grand Theft From Locked Auto,Monday,2012-04-30,21:00,Mission,None,"16th St, Church St",-122.4286681077,37.7645077029947
9056847204022,90568472,4022,Assault,Attempted Homicide With A Knife,Tuesday,2009-06-02,16:05,Tenderloin,"Arrest, Booked",300 Block Of Hyde St,-122.41604728066,37.7839824654149
5076291561030,50762915,61030,Non-criminal,"Death Report, Cause Unknown",Tuesday,2005-07-05,12:00,Northern,None,2500 Block Of Sacramento St,-122.4348551071,37.7896768793545
11049079705011,110490797,5011,Burglary,"Burglary Of Apartment House, Forcible Entry",Saturday,2011-06-18,16:35,Bayview,"Arrest, Booked",0 Block Of Nichols Wy,-122.38724435334,37.7195130001474
8069872265016,80698722,65016,OtherOffenses,"Drivers License, Suspended Or Revoked",Friday,2008-07-04,10:55,Southern,"Arrest, Cited","Market St, Mason St",-122.408953598279,37.783287873572
6102496272000,61024962,72000,Non-criminal,Found Property,Saturday,2006-09-23,19:00,Southern,None,1000 Block Of Market St,-122.411071423064,37.7817511307229
3026767806222,30267678,6222,Larceny/theft,Petty Theft From Unlocked Auto,Wednesday,2003-03-05,17:05,Richmond,None,"Funston Av, Balboa St",-122.471505489955,37.776890935071
9058768228165,90587682,28165,Vandalism,"Malicious Mischief, Graffiti",Monday,2009-06-08,02:55,Richmond,"Arrest, Booked",900 Block Of Clement St,-122.469251458373,37.7827807755947
9602448206244,96024482,6244,Larceny/theft,Grand Theft From Locked Auto,Monday,2009-04-06,00:01,Park,None,"Roosevelt Wy, 14th St",-122.437299386069,37.7672202159564
10028086574000,100280865,74000,MissingPerson,Missing Adult,Thursday,2010-03-25,14:00,Southern,Located,"9th St, Mission St",-122.414714295579,37.7762310404758
3040457968000,30404579,68000,Non-criminal,Fire Report,Sunday,2003-04-06,19:05,Taraval,None,300 Block Of Bright St,-122.463462539252,37.7170502915577
10614184906244,106141849,6244,Larceny/theft,Grand Theft From Locked Auto,Wednesday,2010-11-03,18:00,Central,None,"Polk St, Beach St",-122.42384881373,37.8062214269911
10078155609024,100781556,9024,OtherOffenses,"Fraudulent Game Or Trick, Obtaining Money Or Property",Tuesday,2010-08-24,07:00,Mission,None,2900 Block Of Harrison St,-122.411599088523,37.7502239140329
6052995964070,60529959,64070,SuspiciousOcc,Suspicious Occurrence,Thursday,2006-05-18,22:01,Southern,Not Prosecuted,800 Block Of Bryant St,-122.403404791479,37.775420706711
10005831128160,100058311,28160,Vandalism,"Malicious Mischief, Vandalism Of Vehicles",Sunday,2010-01-17,22:30,Ingleside,None,500 Block Of Naples St,-122.431747193424,37.7200338366591
10079766605063,100797666,5063,Burglary,"Burglary Of Warehouse, Unlawful Entry",Monday,2010-08-30,05:05,Bayview,None,1400 Block Of Illinois St,-122.386804989293,37.7535211594106
9018913106244,90189131,6244,Larceny/theft,Grand Theft From Locked Auto,Friday,2009-02-20,17:00,Southern,None,800 Block Of Mission St,-122.405395493939,37.7835100715421
5140878004134,51408780,4134,Assault,Battery,Thursday,2005-12-15,17:10,Ingleside,None,300 Block Of Leland Avenue,-122.40986019431,37.7131678519502
6067502965015,60675029,65015,OtherOffenses,Traffic Violation,Monday,2006-06-26,07:05,Bayview,"Arrest, Cited","Oakdale Av, Quint St",-122.395948175202,37.7377836782445
11089860209029,110898602,9029,OtherOffenses,False Personation To Receive Money Or Property,Monday,2011-11-07,06:00,Ingleside,None,500 Block Of Campbell Avenue,-122.407293153167,37.7154937188555
3059616062050,30596160,62050,Warrants,Enroute To Outside Jurisdiction,Thursday,2003-05-15,17:00,Northern,"Arrest, Booked",1200 Block Of Mcallister St,-122.432612021991,37.7785794811344
6133255515150,61332555,15150,OtherOffenses,Violation Of Restraining Order,Saturday,2006-12-16,10:16,Mission,"Arrest, Booked",2000 Block Of Mission St,-122.419520367886,37.764228935718
13109309904136,131093099,4136,Assault,Battery With Serious Injuries,Sunday,2013-12-29,17:57,Mission,"Arrest, Booked",2200 Block Of Mission St,-122.419350173229,37.7610160912056
4117739371010,41177393,71010,OtherOffenses,Lost/stolen License Plate,Tuesday,2004-08-10,00:01,Mission,None,400 Block Of Potrero Avenue,-122.407430209185,37.7638215023633
4022980651040,40229806,51040,Non-criminal,Aided Case,Thursday,2004-02-26,16:45,Ingleside,None,0 Block Of Tucker Avenue,-122.404500268176,37.7155319865115
10007675564020,100076755,64020,Non-criminal,"Aided Case, Mental Disturbed",Sunday,2010-01-24,02:25,Mission,Psychopathic Case,400 Block Of Valencia St,-122.42207304894,37.7661259454801
9078260027195,90782600,27195,Trespass,Trespassing,Sunday,2009-08-02,07:00,Tenderloin,"Arrest, Cited",400 Block Of Eddy St,-122.415088721046,37.7836719564372
11073621264020,110736212,64020,Non-criminal,"Aided Case, Mental Disturbed",Tuesday,2011-09-13,09:00,Southern,Located,0 Block Of Dore St,-122.413045971966,37.7738617771611
7023215805043,70232158,5043,Burglary,"Burglary Of Residence, Unlawful Entry",Monday,2007-03-05,13:30,Northern,None,3700 Block Of Fillmore St,-122.437194850873,37.8058863085184
13065652107021,130656521,7021,VehicleTheft,Stolen Automobile,Thursday,2013-08-08,12:30,Ingleside,None,600 Block Of London St,-122.438390419681,37.7185113327185
11606866971000,116068669,71000,Non-criminal,Lost Property,Saturday,2011-05-21,22:30,Central,None,"Pacific Av, Hyde St",-122.418294571493,37.795464383508
12016008707020,120160087,7020,VehicleTheft,Stolen And Recovered Vehicle,Sunday,2012-02-26,04:25,Bayview,None,500 Block Of Sweeny St,-122.414726539702,37.7310313386047
4006685207021,40066852,7021,VehicleTheft,Stolen Automobile,Saturday,2004-01-17,17:00,Northern,None,"Gough St, Green St",-122.427083705844,37.7971999610454
13071319306365,130713193,6365,Larceny/theft,Petty Theft With Prior,Tuesday,2013-08-27,01:13,Central,"Arrest, Booked",200 Block Of Clay St,-122.398562388573,37.7951824972273
14017548610045,140175486,10045,Embezzlement,"Embezzlement, Grand Theft By Employee",Thursday,2013-08-22,19:53,Southern,None,800 Block Of Market St,-122.407633520742,37.7841893501425
12019776730000,120197767,30000,OtherOffenses,"Permit Violation, Police (general)",Friday,2012-03-09,23:50,Mission,"Arrest, Cited","Mission St, 20th St",-122.419052694349,37.7586324051562
14076457864070,140764578,64070,SuspiciousOcc,Suspicious Occurrence,Saturday,2010-05-29,00:01,Central,None,100 Block Of Trenton St,-122.409233536646,37.7961591607704
6082738361030,60827383,61030,Non-criminal,"Death Report, Cause Unknown",Friday,2006-08-04,22:00,Northern,None,1200 Block Of Polk St,-122.420094921042,37.7879983893852
12618175606244,126181756,6244,Larceny/theft,Grand Theft From Locked Auto,Tuesday,2012-11-13,23:30,Northern,None,"Franklin St, Mcallister St",-122.421893134467,37.779891233614
3039424306244,30394243,6244,Larceny/theft,Grand Theft From Locked Auto,Thursday,2003-04-03,19:30,Mission,None,100 Block Of Guerrero St,-122.424582398809,37.768544340731
10101092628160,101010926,28160,Vandalism,"Malicious Mischief, Vandalism Of Vehicles",Sunday,2010-10-31,04:50,Bayview,None,400 Block Of Blanken Avenue,-122.397745989575,37.7113524796743
12073406810010,120734068,10010,Embezzlement,"Embezzlement, Petty Theft",Thursday,2012-04-26,00:01,Mission,None,4000 Block Of 24th St,-122.43300956477,37.7514239412017
11085155306361,110851553,6361,Larceny/theft,Petty Theft Shoplifting,Friday,2011-10-21,19:26,Central,"Arrest, Cited",1000 Block Of Hyde St,-122.417368206741,37.7905094151595
8019606106303,80196061,6303,Larceny/theft,Petty Theft From A Building,Saturday,2008-02-23,18:30,Mission,None,3100 Block Of 16th St,-122.423622537404,37.7647573853335
3109429606301,31094296,6301,Larceny/theft,Petty Theft From A Building,Thursday,2003-09-11,16:45,Bayview,None,400 Block Of Missouri St,-122.396274357968,37.7606549517992
11061079128100,110610791,28100,Vandalism,"Malicious Mischief, Breaking Windows",Sunday,2011-07-31,02:04,Northern,"Arrest, Booked",1600 Block Of Jackson St,-122.422253299565,37.7940917260344
6009357828135,60093578,28135,OtherOffenses,Harassing Phone Calls,Thursday,2005-07-21,14:52,Northern,None,300 Block Of Franklin St,-122.421541714261,37.7777813703773
9101457906304,91014579,6304,Larceny/theft,Grand Theft From A Building,Thursday,2009-10-01,14:05,Ingleside,None,0 Block Of Phelan Avenue,-122.452289660492,37.7256933575703
6120885904013,61208859,4013,Assault,Aggravated Assault With A Deadly Weapon,Sunday,2006-11-12,19:10,Northern,None,"Scott St, Union St",-122.440423144507,37.7964592972223
7018056319010,70180563,19010,DisorderlyConduct,Committing Public Nuisance,Monday,2007-02-19,08:30,Mission,"Arrest, Booked",3300 Block Of 17th St,-122.421087244049,37.763392442414
5098172304013,50981723,4013,Assault,Aggravated Assault With A Deadly Weapon,Wednesday,2005-08-31,15:25,Park,None,600 Block Of Stanyan St,-122.453563238036,37.7696403896003
7607075606244,76070756,6244,Larceny/theft,Grand Theft From Locked Auto,Monday,2007-09-24,02:30,Mission,None,"Grandview Av, Alvarado St",-122.441885478916,37.7533661184643
11087850709320,110878507,9320,Fraud,"Credit Card, Theft By Use Of",Friday,2011-10-28,20:00,Northern,None,700 Block Of Golden Gate Avenue,-122.42291369529,37.7806600950548
6128046506244,61280465,6244,Larceny/theft,Grand Theft From Locked Auto,Friday,2006-12-01,19:00,Northern,None,"Avila St, Marina Bl",-122.44000281007,37.8060749225147
12037193365010,120371933,65010,OtherOffenses,Traffic Violation Arrest,Thursday,2012-05-10,14:43,Southern,None,1100 Block Of Market St,-122.413564091744,37.779514030063
11098977819090,110989778,19090,Drunkenness,Under Influence Of Alcohol In A Public Place,Sunday,2011-12-11,01:29,Southern,"Arrest, Booked","Harrison St, 3rd St",-122.397388784826,37.7825543452426
13006559672000,130065596,72000,Non-criminal,Found Property,Wednesday,2013-01-23,22:58,Central,None,1300 Block Of Leavenworth St,-122.416272405484,37.7934525181047
10015135705013,100151357,5013,Burglary,"Burglary Of Apartment House, Unlawful Entry",Sunday,2010-02-14,13:30,Mission,None,3100 Block Of 21st St,-122.417260520587,37.7570790190504
9063724319057,90637243,19057,Assault,Threats Against Life,Saturday,2009-06-20,22:00,Northern,None,2200 Block Of Greenwich St,-122.436695193264,37.7987907858178
8079646765010,80796467,65010,OtherOffenses,Traffic Violation Arrest,Tuesday,2008-07-29,11:20,Mission,"Arrest, Cited","Shotwell St, 17th St",-122.416230392543,37.7636337702985
10113767728150,101137677,28150,Vandalism,"Malicious Mischief, Vandalism",Friday,2010-12-10,15:35,Park,None,1700 Block Of Mcallister St,-122.440879521853,37.7775321935218
8047328965016,80473289,65016,OtherOffenses,"Drivers License, Suspended Or Revoked",Tuesday,2008-05-06,07:45,Mission,"Arrest, Cited","Hoff St, 17th St",-122.420434724553,37.7633758058059
13062808106373,130628081,6373,Larceny/theft,Petty Theft Of Property,Saturday,2013-05-18,18:00,Tenderloin,None,400 Block Of Turk St,-122.416349428183,37.7825569563078
3085218826150,30852188,26150,OtherOffenses,Parole Violation,Thursday,2003-07-17,22:18,Mission,"Arrest, Booked",2000 Block Of Mission St,-122.41965834371,37.7642205603745
10084545326170,100845453,26170,OtherOffenses,Probation Violation,Sunday,2010-09-12,18:47,Central,"Arrest, Booked",300 Block Of Powell St,-122.408384275542,37.7878271137225
4047758806303,40477588,6303,Larceny/theft,Petty Theft From A Building,Thursday,2004-04-22,14:00,Richmond,None,2300 Block Of Sutter St,-122.439066426641,37.7854056405781
3115470906244,31154709,6244,Larceny/theft,Grand Theft From Locked Auto,Tuesday,2003-09-30,20:48,Bayview,"Arrest, Booked",3200 Block Of Jennings St,-122.395210826879,37.719897700646
8061531204144,80615312,4144,"SexOffenses,Forcible",Sexual Battery,Wednesday,2008-06-11,18:00,Mission,"Arrest, Booked",2600 Block Of 24th St,-122.405838144649,37.7529785864877
5006727606363,50067276,6363,Larceny/theft,Petty Theft Shoplifting,Tuesday,2005-01-18,11:30,Taraval,None,1500 Block Of Sloat Bl,-122.489713969124,37.7339497680852
12017469606303,120174696,6303,Larceny/theft,Petty Theft From A Building,Thursday,2012-03-01,23:30,Richmond,None,4100 Block Of Geary Bl,-122.463764261964,37.7811749336778
8059799265015,80597992,65015,OtherOffenses,Traffic Violation,Saturday,2008-06-07,18:30,Southern,"Arrest, Cited","Mission St, 11th St",-122.417104895556,37.7743242867908
7029270428100,70292704,28100,Vandalism,"Malicious Mischief, Breaking Windows",Wednesday,2007-02-21,03:00,Ingleside,None,0 Block Of Navajo Avenue,-122.443971583062,37.720018536675
13108192561030,131081925,61030,Non-criminal,"Death Report, Cause Unknown",Wednesday,2013-12-25,14:30,Richmond,None,700 Block Of 16th Avenue,-122.474686297304,37.7739228047017
99103914666010,991039146,66010,Gambling,Gambling,Saturday,2004-02-07,22:23,Central,"Arrest, Booked",500 Block Of Broadway St,-122.405862214655,37.7979117105028
3039880304134,30398803,4134,Assault,Battery,Friday,2003-04-04,23:00,Taraval,None,"Sloat Bl, 21st Avenue",-122.477080312282,37.7346179976959
8042771964020,80427719,64020,Non-criminal,"Aided Case, Mental Disturbed",Thursday,2008-04-24,10:15,Richmond,None,5400 Block Of Geary Bl,-122.47777209017,37.7802849097527
5007470405143,50074704,5143,Burglary,"Burglary,residence Under Constrt, Unlawful Entry",Sunday,2004-12-26,17:00,Park,None,400 Block Of Belvedere St,-122.448123347765,37.7637902314054
12052111662060,120521116,62060,Warrants,Enroute To Adult Authority,Monday,2012-07-02,15:23,Park,"Arrest, Booked","Stanyan St, Haight St",-122.45353456066,37.7691662978052
8138878206244,81388782,6244,Larceny/theft,Grand Theft From Locked Auto,Wednesday,2008-12-31,03:00,Southern,None,"Harrison St, 11th St",-122.41248326348,37.7706305910776
5113176571000,51131765,71000,Non-criminal,Lost Property,Friday,2005-10-07,14:00,Northern,None,"Post St, Webster St",-122.431369772406,37.7853730435249
12102229662050,121022296,62050,Warrants,Enroute To Outside Jurisdiction,Wednesday,2012-12-19,19:39,Tenderloin,"Arrest, Booked",400 Block Of Eddy St,-122.415088721046,37.7836719564372
12038355264070,120383552,64070,SuspiciousOcc,Suspicious Occurrence,Monday,2012-05-14,18:22,Northern,None,2400 Block Of Sacramento St,-122.433800051784,37.7898100005704
11062878819057,110628788,19057,Assault,Threats Against Life,Wednesday,2011-08-03,16:00,Central,None,600 Block Of Clay St,-122.403994862674,37.794611817992
12094641762050,120946417,62050,Warrants,Enroute To Outside Jurisdiction,Thursday,2012-11-22,13:15,Park,"Arrest, Booked","Haight St, Belvedere St",-122.449647662955,37.7696619195846
12604528771000,126045287,71000,Non-criminal,Lost Property,Sunday,2012-04-01,10:15,Central,None,1100 Block Of California St,-122.413310900175,37.7915739862746
3102656205013,31026562,5013,Burglary,"Burglary Of Apartment House, Unlawful Entry",Sunday,2003-08-24,12:00,Richmond,None,2500 Block Of Post St,-122.443842924589,37.7838441255105
6063578806153,60635788,6153,Larceny/theft,Grand Theft From Person,Tuesday,2006-06-13,16:30,Tenderloin,None,400 Block Of Eddy St,-122.415088721046,37.7836719564372
3098027805033,30980278,5033,Burglary,"Burglary Of Hotel Room, Unlawful Entry",Monday,2003-08-18,19:00,Central,None,600 Block Of Sutter St,-122.411068869703,37.7888557042697
9034536174000,90345361,74000,MissingPerson,Missing Adult,Monday,2009-03-30,16:00,Mission,None,3000 Block Of 26th St,-122.41023195455,37.749571116991
5004612319075,50046123,19075,Loitering,Loitering,Thursday,2005-01-13,01:00,Mission,"Arrest, Booked","South Van Ness Av, 16th St",-122.417488323647,37.7651818039951
9132324564020,91323245,64020,Non-criminal,"Aided Case, Mental Disturbed",Tuesday,2009-12-29,20:15,Park,Psychopathic Case,"Market St, Castro St",-122.435187699349,37.7626702770872
5087685104134,50876851,4134,Assault,Battery,Friday,2005-08-05,19:09,Southern,None,0 Block Of 6th St,-122.40950430935,37.781526271747
5071450206244,50714502,6244,Larceny/theft,Grand Theft From Locked Auto,Monday,2005-06-27,03:08,Richmond,"Arrest, Booked",3600 Block Of Clement St,-122.497736707073,37.781371940294
13009610904014,130096109,4014,Assault,Aggravated Assault With Bodily Force,Sunday,2013-02-03,01:20,Mission,"Arrest, Booked",600 Block Of Valencia St,-122.421550176461,37.7621307247611
3005398865015,30053988,65015,OtherOffenses,Traffic Violation,Tuesday,2003-01-14,10:48,Ingleside,"Arrest, Cited",1600 Block Of Valencia St,-122.420272135283,37.7473316298785
13012133616710,130121336,16710,Drug/narcotic,Possession Of Narcotics Paraphernalia,Monday,2013-02-11,15:36,Northern,"Arrest, Booked","Polk St, Cedar St",-122.419834938618,37.7863580362743
12101537664010,121015376,64010,Non-criminal,"Aided Case, Dog Bite",Monday,2012-12-17,11:15,Southern,None,800 Block Of Bryant St,-122.403404791479,37.775420706711
8101551509310,81015515,9310,Fraud,"Credit Card, Theft Of",Monday,2008-06-23,00:01,Northern,None,1900 Block Of Jefferson St,-122.444652555042,37.8045839875005
4037556228100,40375562,28100,Vandalism,"Malicious Mischief, Breaking Windows",Thursday,2004-04-01,07:00,Bayview,None,900 Block Of Connecticut St,-122.397089183868,37.7535987880327
9109437716626,91094377,16626,Drug/narcotic,Transportation Of Cocaine,Friday,2009-10-23,19:42,Park,"Arrest, Booked","Page St, Divisadero St",-122.437235589841,37.7722041939719
8065155465015,80651554,65015,OtherOffenses,Traffic Violation,Sunday,2008-06-22,08:00,Ingleside,"Arrest, Cited","France Av, Vienna St",-122.432752823079,37.7173609910494
8097485106243,80974851,6243,Larceny/theft,Petty Theft From Locked Auto,Saturday,2008-09-13,18:00,Richmond,None,3400 Block Of Jackson St,-122.451660873506,37.7902378037234
4001223164072,40012231,64072,SuspiciousOcc,"Suspicious Occurrence, Possible Shots Fired",Sunday,2004-01-04,20:20,Bayview,None,0 Block Of Bertha Ln,-122.380990356551,37.7331435009212
5131685471000,51316854,71000,Non-criminal,Lost Property,Monday,2005-11-21,17:20,Southern,None,800 Block Of Bryant St,-122.403404791479,37.775420706711
9115221026170,91152210,26170,OtherOffenses,Probation Violation,Sunday,2009-11-08,14:30,Bayview,"Arrest, Booked",600 Block Of Jamestown Avenue,-122.387833652325,37.7131072321423
3072704214020,30727042,14020,OtherOffenses,Failure To Register As Sex Offender,Monday,2003-06-16,22:45,Southern,"Arrest, Booked","16th St, Vermont St",-122.404625868241,37.7659589563633
8088705005013,80887050,5013,Burglary,"Burglary Of Apartment House, Unlawful Entry",Friday,2008-08-22,14:00,Northern,None,2200 Block Of Sacramento St,-122.429919457431,37.7902995486283
8123634163010,81236341,63010,Warrants,Warrant Arrest,Tuesday,2008-11-18,16:00,Central,"Arrest, Booked",900 Block Of Mason St,-122.410845624227,37.7923158747647
10048243116110,100482431,16110,Drug/narcotic,Possession Of Heroin For Sales,Monday,2010-05-24,18:00,Tenderloin,"Arrest, Booked",300 Block Of Turk St,-122.41487855905,37.7826335031541
6023970013060,60239700,13060,Prostitution,Solicits For Act Of Prostitution,Saturday,2006-03-04,17:25,Mission,"Arrest, Cited","18th St, Folsom St",-122.415000536786,37.7620990020681
11079642619060,110796426,19060,Loitering,Obstructing Public Thoroughfare,Monday,2011-10-03,06:50,Tenderloin,"Arrest, Cited",200 Block Of Hyde St,-122.415858343095,37.7830505366842
11001045819057,110010458,19057,Assault,Threats Against Life,Monday,2010-02-01,00:01,Central,None,2900 Block Of Hyde St,-122.420905124092,37.8080569802618
6025199216620,60251992,16620,Drug/narcotic,Possession Of Cocaine,Tuesday,2006-03-07,08:46,Southern,"Arrest, Booked",500 Block Of Jessie St,-122.409776479312,37.7810558831366
4025307107043,40253071,7043,VehicleTheft,"Vehicle, Recovered, Motorcycle",Wednesday,2004-03-03,13:10,Mission,None,1200 Block Of Alabama St,-122.410954209205,37.7518688604658
4080119716642,40801197,16642,Drug/narcotic,Possession Of Amphetamine For Sales,Wednesday,2004-07-14,09:15,Mission,"Arrest, Booked",2100 Block Of Market St,-122.430018655242,37.7668305229582
12042146904134,120421469,4134,Assault,Battery,Monday,2012-05-28,01:24,Park,None,"Castro St, Market St",-122.435187699349,37.7626702770872
6051819027300,60518190,27300,OtherOffenses,Miscellaneous State Misdemeanor,Tuesday,2006-05-16,02:52,Tenderloin,"Arrest, Booked",100 Block Of Eddy St,-122.410157073911,37.7842973843312
8124700306224,81247003,6224,Larceny/theft,Grand Theft From Unlocked Auto,Friday,2008-11-21,14:30,Northern,None,800 Block Of Turk St,-122.423127788491,37.781691873286
7092412319090,70924123,19090,Drunkenness,Under Influence Of Alcohol In A Public Place,Sunday,2007-09-09,15:15,Southern,"Arrest, Booked",800 Block Of 3rd St,-122.391425069857,37.7778727797586
12049489215200,120494892,15200,SecondaryCodes,Domestic Violence,Sunday,2012-06-24,00:10,Bayview,"Arrest, Booked",2900 Block Of Griffith St,-122.389702894788,37.7165829970973
7099861705011,70998617,5011,Burglary,"Burglary Of Apartment House, Forcible Entry",Friday,2007-09-28,12:00,Southern,None,100 Block Of 6th St,-122.407877117352,37.7803875013555
6005211015150,60052110,15150,OtherOffenses,Violation Of Restraining Order,Saturday,2006-01-14,02:00,Ingleside,None,100 Block Of Holladay Avenue,-122.404869009565,37.7479073004814
10070920706362,100709207,6362,Larceny/theft,Petty Theft Shoplifting,Tuesday,2010-08-03,16:13,Southern,None,800 Block Of Market St,-122.407633520742,37.7841893501425
12092810809027,120928108,9027,OtherOffenses,False Personation,Monday,2012-09-24,10:32,Mission,None,"16th St, Potrero Avenue",-122.407538332319,37.7657827544276
6088256926142,60882569,26142,Kidnapping,False Imprisonment,Saturday,2006-08-19,15:30,Mission,None,800 Block Of York St,-122.408796349216,37.7584522474061
3034171164020,30341711,64020,Non-criminal,"Aided Case, Mental Disturbed",Sunday,2003-03-23,03:13,Taraval,Psychopathic Case,"32nd Av, Taraval St",-122.489620429384,37.7424363113895
4010021226060,40100212,26060,Bribery,Bribery Of Witnesses,Monday,2004-01-26,03:55,Mission,"Arrest, Booked",0 Block Of Landers St,-122.427857167076,37.7669871098804
10072504311012,100725043,11012,StolenProperty,"Stolen Property, Possession With Knowledge, Receiving",Sunday,2010-08-08,13:45,Mission,"Arrest, Booked",2100 Block Of Market St,-122.429788986988,37.7666521474762
5094892719057,50948927,19057,Assault,Threats Against Life,Tuesday,2005-08-23,21:00,Richmond,None,400 Block Of 10th Avenue,-122.468562845833,37.7798381239123
12104171368020,121041713,68020,OtherOffenses,Miscellaneous Investigation,Thursday,2012-12-27,14:35,Mission,None,2200 Block Of Market St,-122.432198022433,37.7651107322703
7040576903081,70405769,3081,Robbery,Carjacking With A Gun,Friday,2007-04-20,16:15,Richmond,None,"Turk St, Parker Avenue",-122.453385137523,37.7778271201144
