id,incident_number,incident_code,category,descript,day_of_the_week,date,time,police_dept_district,resolution,address,location_x_axis,location_y_axis
17004349906302,170043499,6302,Larceny/theft,Petty Theft From A Building,Friday,2017-01-13,15:00,Northern,None,0 Block Of Gough St,-122.42220219348944,37.773393076634086
11034444571024,110344445,71024,Non-criminal,"Stay Away Or Court Order, Non-dv Related",Thursday,2011-04-28,13:12,Tenderloin,None,0 Block Of Turk St,-122.409853729941,37.7833862379382
13066158628100,130661586,28100,Vandalism,"Malicious Mischief, Breaking Windows",Saturday,2013-08-10,18:10,Bayview,None,0 Block Of Turner Tr,-122.395106891925,37.7566305834521
16001154728150,160011547,28150,Vandalism,"Malicious Mischief, Vandalism",Monday,2016-01-04,18:45,Central,None,700 Block Of Northpoint St,-122.4195705165635,37.80587808961938
5049791874000,50497918,74000,MissingPerson,Missing Adult,Wednesday,2005-05-04,13:00,Taraval,None,1900 Block Of 23rd Avenue,-122.480631328488,37.7512332838357
13026366571000,130263665,71000,Non-criminal,Lost Property,Sunday,2013-03-31,02:00,Northern,None,"Fillmore St, Greenwich St",-122.435870220186,37.7989514142851
13053943805143,130539438,5143,Burglary,"Burglary,residence Under Constrt, Unlawful Entry",Friday,2013-06-28,16:00,Richmond,None,500 Block Of 47th Avenue,-122.508160181225,37.7780379262238
12062092862050,120620928,62050,Warrants,Enroute To Outside Jurisdiction,Sunday,2012-08-05,10:38,Ingleside,"Arrest, Booked",300 Block Of Crescent Avenue,-122.418407537757,37.7350224531807
16091739361030,160917393,61030,Non-criminal,"Death Report, Cause Unknown",Thursday,2016-11-10,21:35,Taraval,None,500 Block Of Johnmuir Dr,-122.4920680173396,37.71436154987557
3075958407025,30759584,7025,VehicleTheft,Stolen Truck,Tuesday,2003-06-24,22:30,Southern,None,"Stillman St, 2nd St",-122.394152747243,37.7835046149546
16007045205083,160070452,5083,Burglary,"Burglary, Hot Prowl, Unlawful Entry",Monday,2016-01-25,07:30,Ingleside,"Arrest, Booked",1700 Block Of Alabama St,-122.41038702801455,37.74509545890792
13093375506363,130933755,6363,Larceny/theft,Petty Theft Shoplifting,Sunday,2013-11-03,15:05,Tenderloin,None,0 Block Of Grant Avenue,-122.404997416043,37.7871963336348
12046984571000,120469845,71000,Non-criminal,Lost Property,Thursday,2012-06-14,23:30,Bayview,None,200 Block Of Williams Avenue,-122.397744427103,37.7299346936044
9127766411010,91277664,11010,StolenProperty,Receiving Stolen Property,Tuesday,2009-12-15,14:30,Tenderloin,"Arrest, Booked",0 Block Of Mason St,-122.409129633669,37.7838066631424
18033467004013,180334670,4013,Assault,Aggravated Assault With A Deadly Weapon,Saturday,2018-05-05,17:51,Central,"Arrest, Booked",700 Block Of Kearny St,-122.40484784786696,37.79510065280524
17600978871000,176009788,71000,Non-criminal,Lost Property,Friday,2016-12-16,22:15,Southern,None,600 Block Of Howard St,-122.39998852114957,37.78548734122924
7073663319050,70736633,19050,OtherOffenses,Obscene Phone Calls(s),Thursday,2006-03-30,20:00,Tenderloin,None,500 Block Of Hyde St,-122.416459785313,37.7860170554787
5040634571010,50406345,71010,OtherOffenses,Lost/stolen License Plate,Monday,2005-04-11,15:00,Bayview,None,0 Block Of Young Ct,-122.386051860295,37.7362465179188
13105428964085,131054289,64085,SuspiciousOcc,Investigative Detention,Sunday,2013-12-15,20:07,Ingleside,None,"Mission St, Italy Avenue",-122.439500592068,37.7184669808291
11071761064060,110717610,64060,SuspiciousOcc,Suspicious Act Towards Female,Tuesday,2011-09-06,22:33,Mission,None,400 Block Of Shotwell St,-122.416070932811,37.7612142236627
13023657164020,130236571,64020,Non-criminal,"Aided Case, Mental Disturbed",Friday,2013-03-22,00:55,Northern,Psychopathic Case,800 Block Of Turk St,-122.423105855786,37.7815834072995
10000450216030,100004502,16030,Drug/narcotic,Possession Of Marijuana For Sales,Saturday,2010-01-02,14:00,Park,"Arrest, Booked",1700 Block Of Haight St,-122.451314447797,37.7695046066162
17069281427130,170692814,27130,OtherOffenses,Possession Of Burglary Tools,Friday,2017-08-25,06:56,Bayview,"Arrest, Booked",1600 Block Of Underwood Avenue,-122.39206517713676,37.72997359872419
7057061306363,70570613,6363,Larceny/theft,Petty Theft Shoplifting,Tuesday,2007-06-05,19:35,Southern,"Arrest, Cited",800 Block Of Market St,-122.406520987144,37.7850629421661
13056995204134,130569952,4134,Assault,Battery,Thursday,2013-07-11,12:20,Taraval,None,"Broad St, Plymouth Avenue",-122.456050465866,37.7131938450626
13096640516625,130966405,16625,Drug/narcotic,Sale Of Base/rock Cocaine,Thursday,2013-11-14,15:47,Tenderloin,"Arrest, Booked","Ofarrell St, Jones St",-122.412970537591,37.7857883766888
4043783303413,40437833,3413,Robbery,Attempted Robbery On The Street W/deadly Weapon,Saturday,2004-04-17,00:45,Central,None,"Post St, Leavenworth St",-122.414996719999,37.7874530734235
18031474104013,180314741,4013,Assault,Aggravated Assault With A Deadly Weapon,Saturday,2018-04-28,13:30,Mission,None,"24th St, Capp St",-122.41736013947738,37.75230631701808
7068511507025,70685115,7025,VehicleTheft,Stolen Truck,Saturday,2007-07-07,18:30,Park,None,100 Block Of Terravista Avenue,-122.44430529296,37.7812803537782
10072363374000,100723633,74000,MissingPerson,Missing Adult,Saturday,2010-08-07,12:00,Ingleside,None,0 Block Of Anderson St,-122.414974821368,37.7418768608865
16004343712080,160043437,12080,WeaponLaws,Poss Of Firearm By Convicted Felon/addict/alien,Saturday,2016-01-16,03:50,Ingleside,"Arrest, Booked","Cesar Chavez St, Potrero Avenue",-122.40509687191648,37.7491100050973
16621819306372,166218193,6372,Larceny/theft,Petty Theft Of Property,Tuesday,2016-09-13,12:30,Southern,None,800 Block Of Bryant St,-122.40340479147903,37.775420706711
11054077875000,110540778,75000,MissingPerson,Found Person,Tuesday,2011-07-05,21:27,Park,None,1000 Block Of Pierce St,-122.435312601584,37.7798647928492
11060777607020,110607776,7020,VehicleTheft,Stolen And Recovered Vehicle,Friday,2011-07-29,22:35,Bayview,None,1200 Block Of Newhall St,-122.391429065321,37.7366235255732
8106822927195,81068229,27195,Trespass,Trespassing,Tuesday,2008-10-07,09:00,Northern,"Arrest, Cited",100 Block Of Polk St,-122.418161507408,37.7777435982521
18601523606374,186015236,6374,Larceny/theft,Grand Theft Of Property,Friday,2018-01-12,21:00,Southern,None,800 Block Of Bryant St,-122.40340479147903,37.775420706711
10063811763010,100638117,63010,Warrants,Warrant Arrest,Monday,2010-07-12,13:00,Southern,"Arrest, Booked",800 Block Of Bryant St,-122.403404791479,37.775420706711
16055834506244,160558345,6244,Larceny/theft,Grand Theft From Locked Auto,Sunday,2016-07-10,19:30,Central,None,2300 Block Of Stockton St,-122.41052474222884,37.80744511623551
12619324006372,126193240,6372,Larceny/theft,Petty Theft Of Property,Friday,2012-11-30,22:00,Northern,None,"Geary Bl, Webster St",-122.431206932079,37.7845681170336
17038200912168,170382009,12168,WeaponLaws,"Firearm, Loaded, In Vehicle, Possession Or Use",Tuesday,2017-05-09,23:03,Bayview,"Arrest, Booked","Silver Av, Palou Avenue",-122.39651672691298,37.73715647133373
4026084419050,40260844,19050,OtherOffenses,Obscene Phone Calls(s),Thursday,2004-03-04,22:00,Park,None,700 Block Of Haight St,-122.434580561451,37.7716361114909
16033932763010,160339327,63010,Warrants,Warrant Arrest,Monday,2016-04-25,13:04,Tenderloin,"Arrest, Booked",0 Block Of Ofarrell St,-122.40589536988726,37.78673421849833
16076812409024,160768124,9024,OtherOffenses,"Fraudulent Game Or Trick, Obtaining Money Or Property",Wednesday,2016-09-21,15:30,Ingleside,None,500 Block Of Vienna St,-122.4309503524848,37.71965383609815
13083227663010,130832276,63010,Warrants,Warrant Arrest,Wednesday,2013-10-02,17:16,Northern,"Arrest, Booked","Larkin St, Hayes St",-122.416293820935,37.777493677735
5043049171000,50430491,71000,Non-criminal,Lost Property,Monday,2005-04-18,17:00,Taraval,None,"30th Av, Irving St",-122.488909374555,37.763042342487
7096357964020,70963579,64020,Non-criminal,"Aided Case, Mental Disturbed",Wednesday,2007-09-19,17:50,Ingleside,None,200 Block Of Addison St,-122.432398313711,37.7378218134824
4119375304134,41193753,4134,Assault,Battery,Tuesday,2004-10-19,01:53,Northern,District Attorney Refuses To Prosecute,"Scott St, Chestnut St",-122.441178352509,37.800188169029
6607714806244,66077148,6244,Larceny/theft,Grand Theft From Locked Auto,Monday,2006-10-23,01:45,Taraval,None,100 Block Of Stratford Dr,-122.473490320735,37.7221732631197
17055008061030,170550080,61030,Non-criminal,"Death Report, Cause Unknown",Tuesday,2017-07-04,19:30,Northern,None,1300 Block Of Eddy St,-122.42982887155932,37.78169035865059
7092630165016,70926301,65016,OtherOffenses,"Drivers License, Suspended Or Revoked",Monday,2007-09-10,09:30,Ingleside,"Arrest, Cited","Sunnydale Av, Rey St",-122.412280369992,37.7108662317571
16057297565016,160572975,65016,OtherOffenses,"Drivers License, Suspended Or Revoked",Saturday,2016-07-16,00:30,Mission,"Arrest, Booked","20th St, Alabama St",-122.41158050778006,37.75908346456335
13015500664020,130155006,64020,Non-criminal,"Aided Case, Mental Disturbed",Friday,2013-02-22,13:38,Park,Psychopathic Case,1300 Block Of Haight St,-122.444524277297,37.7703704336439
10615667206244,106156672,6244,Larceny/theft,Grand Theft From Locked Auto,Monday,2010-11-15,19:00,Central,None,"Jones St, Pine St",-122.413918209236,37.7904619656257
17067495316110,170674953,16110,Drug/narcotic,Possession Of Heroin For Sales,Friday,2017-08-18,23:18,Southern,"Arrest, Booked","Mission St, 8th St",-122.41316085096972,37.77745666118072
5031907706304,50319077,6304,Larceny/theft,Grand Theft From A Building,Monday,2005-03-21,11:00,Northern,None,900 Block Of Franklin St,-122.422442530821,37.7829271006902
6005071665015,60050716,65015,OtherOffenses,Traffic Violation,Friday,2006-01-13,18:20,Taraval,"Arrest, Booked","Taraval St, 24th Avenue",-122.481048196583,37.7428142354227
16057034928160,160570349,28160,Vandalism,"Malicious Mischief, Vandalism Of Vehicles",Thursday,2016-07-14,08:00,Park,None,300 Block Of Castro St,-122.43515246481076,37.7630612660862
5128016816420,51280168,16420,Drug/narcotic,Possession Of Hallucinogenic For Sales,Saturday,2005-11-12,13:11,Park,"Arrest, Booked",700 Block Of Stanyan St,-122.453512911126,37.7686969786551
16055398107021,160553981,7021,VehicleTheft,Stolen Automobile,Friday,2016-07-08,22:00,Mission,None,"Valencia St, Cesar Chavez St",-122.42027922768006,37.7481246616016
11604120128150,116041201,28150,Vandalism,"Malicious Mischief, Vandalism",Saturday,2011-03-26,01:00,Ingleside,None,"Precita Av, Coso Avenue",-122.418284301,37.7466957867633
18606466928150,186064669,28150,Vandalism,"Malicious Mischief, Vandalism",Friday,2018-01-19,23:00,Central,None,"Chestnut St, Hyde St",-122.4197994311332,37.80292520641478
17001772371012,170017723,71012,Non-criminal,"License Plate, Recovered",Saturday,2017-01-07,00:30,Ingleside,None,"Franconia St, Massosoit St",-122.40760377364944,37.74488588894371
17048579406242,170485794,6242,Larceny/theft,Petty Theft From Locked Auto,Tuesday,2017-06-13,15:30,Southern,None,800 Block Of Bryant St,-122.40340479147903,37.775420706711
10101724564020,101017245,64020,Non-criminal,"Aided Case, Mental Disturbed",Tuesday,2010-11-02,05:40,Central,Psychopathic Case,1000 Block Of Sutter St,-122.417672923626,37.7881242734432
17054951665030,170549516,65030,OtherOffenses,Speeding,Thursday,2017-07-06,19:03,Mission,"Arrest, Booked","22nd St, Bryant St",-122.40943561710608,37.75599773398556
8120048707055,81200487,7055,RecoveredVehicle,Recovered Vehicle - Stolen Outside Sf,Sunday,2008-11-09,19:30,Ingleside,None,0 Block Of Lyell St,-122.431604221964,37.7313118275068
9073320504134,90733205,4134,Assault,Battery,Sunday,2009-07-19,01:23,Mission,None,"22nd St, Bartlett St",-122.419860961947,37.7553668828503
4074920206242,40749202,6242,Larceny/theft,Petty Theft From Locked Auto,Tuesday,2004-06-29,22:00,Southern,None,1000 Block Of Market St,-122.411339562557,37.7812707434494
16615269806244,166152698,6244,Larceny/theft,Grand Theft From Locked Auto,Saturday,2016-07-09,19:00,Central,None,2100 Block Of Stockton St,-122.41015065262948,37.80558052713118
7039153875000,70391538,75000,MissingPerson,Found Person,Tuesday,2007-04-17,13:13,Richmond,None,100 Block Of Pointlobos Avenue,-122.504613910148,37.7796987940753
15077081604134,150770816,4134,Assault,Battery,Wednesday,2015-09-02,15:00,Ingleside,None,"Sawyer St, Visitacion Avenue",-122.414371339423,37.7132468268485
16625472706244,166254727,6244,Larceny/theft,Grand Theft From Locked Auto,Friday,2016-11-04,10:40,Park,None,100 Block Of Twinpeaks Bl,-122.44779660261446,37.75921881573685
18606813871000,186068138,71000,Non-criminal,Lost Property,Saturday,2018-03-24,17:00,Northern,None,"Steiner St, Hayes St",-122.43283279920502,37.775624967277246
11078875227130,110788752,27130,OtherOffenses,Possession Of Burglary Tools,Friday,2011-09-30,13:15,Southern,"Arrest, Booked",800 Block Of Bryant St,-122.403404791479,37.775420706711
13104299964001,131042999,64001,Non-criminal,"Civil Sidewalks, Warning",Wednesday,2013-12-11,17:25,Park,None,"Belvedere St, Haight St",-122.449647662955,37.7696619195846
6088051306242,60880513,6242,Larceny/theft,Petty Theft From Locked Auto,Friday,2006-08-18,23:00,Southern,None,"10th St, Harrison St",-122.411279189969,37.7715785765043
11072285775000,110722857,75000,MissingPerson,Found Person,Thursday,2011-09-08,12:30,Park,Located,0 Block Of Shrader St,-122.452839772389,37.7745145380854
6110385106304,61103851,6304,Larceny/theft,Grand Theft From A Building,Saturday,2006-09-30,10:00,Central,None,0 Block Of Nobhill Cr,-122.410973853956,37.7914478545467
8116442916624,81164429,16624,Drug/narcotic,Sale Of Cocaine,Thursday,2008-10-30,00:01,Southern,"Arrest, Booked",1000 Block Of Mission St,-122.40989282029,37.7801134973164
9105749426170,91057494,26170,OtherOffenses,Probation Violation,Tuesday,2009-10-13,21:50,Tenderloin,"Arrest, Booked","Eddy St, Larkin St",-122.41753069698,37.7833107539969
8023928572000,80239285,72000,Non-criminal,Found Property,Thursday,2008-03-06,07:00,Bayview,Unfounded,"Oakdale Av, Lane St",-122.388483091972,37.7335359662276
16006144516650,160061445,16650,Drug/narcotic,Possession Of Meth-amphetamine,Friday,2016-01-22,05:45,Central,"Arrest, Booked",900 Block Of Clay St,-122.40832278818522,37.79406255571054
6112771007052,61127710,7052,Embezzlement,Embezzled Vehicle,Friday,2006-10-20,17:00,Mission,None,400 Block Of Diamond St,-122.436601323123,37.7551507308836
6176185719050,61761857,19050,OtherOffenses,Obscene Phone Calls(s),Monday,2006-10-02,06:27,Southern,None,200 Block Of Interstate80 Hy,-122.365565425353,37.8096707013239
17614065506224,176140655,6224,Larceny/theft,Grand Theft From Unlocked Auto,Sunday,2017-05-14,09:30,Central,None,"Lombard St, Hyde St",-122.41961610967128,37.80199424380493
13036872604033,130368726,4033,Assault,Assault With Caustic Chemicals,Sunday,2013-05-05,20:23,Taraval,None,"Irving St, 8th Avenue",-122.46524512187,37.764082071585
10056034413075,100560344,13075,Prostitution,Loitering For Purpose Of Prostitution,Wednesday,2010-06-23,22:40,Northern,"Arrest, Cited","Bush St, Polk St",-122.420307355721,37.7886989511647
16033699704104,160336997,4104,Assault,Assault,Sunday,2016-04-24,15:03,Central,None,1300 Block Of Stockton St,-122.408646942187,37.79811712669654
7038949213060,70389492,13060,Prostitution,Solicits For Act Of Prostitution,Monday,2007-04-16,22:55,Tenderloin,"Arrest, Cited",600 Block Of Ellis St,-122.416916142188,37.7843944492068
16003662065016,160036620,65016,OtherOffenses,"Drivers License, Suspended Or Revoked",Wednesday,2016-01-13,23:08,Ingleside,"Arrest, Booked","Alemany Bl, Folsom St",-122.41382551772054,37.73327811709781
17088543905013,170885439,5013,Burglary,"Burglary Of Apartment House, Unlawful Entry",Wednesday,2017-10-25,11:30,Central,None,700 Block Of Bush St,-122.40963635717192,37.79010771242142
11045615364020,110456153,64020,Non-criminal,"Aided Case, Mental Disturbed",Monday,2011-06-06,05:16,Central,Psychopathic Case,1000 Block Of Northpoint St,-122.424503546569,37.8052346738166
17013479768020,170134797,68020,OtherOffenses,Miscellaneous Investigation,Thursday,2017-02-16,16:07,Tenderloin,None,"Ellis St, Powell St",-122.40785423453768,37.78549220446016
4114230205143,41142302,5143,Burglary,"Burglary,residence Under Constrt, Unlawful Entry",Tuesday,2004-10-05,16:30,Northern,None,2600 Block Of Filbert St,-122.443141607032,37.7971270879125
18600397406244,186003974,6244,Larceny/theft,Grand Theft From Locked Auto,Saturday,2018-01-06,18:30,Southern,None,800 Block Of Bryant St,-122.40340479147903,37.775420706711
18604885106314,186048851,6314,Larceny/theft,Grand Theft Bicycle,Saturday,2018-02-24,04:15,Central,None,500 Block Of Post St,-122.41090484640644,37.78802939228506
17055581406244,170555814,6244,Larceny/theft,Grand Theft From Locked Auto,Saturday,2017-07-08,22:45,Southern,None,"Howard St, 5th St",-122.40493441333854,37.7814987213218
11092147904138,110921479,4138,Assault,"Battery, Former Spouse Or Dating Relationship",Tuesday,2011-11-15,05:50,Northern,"Arrest, Booked",700 Block Of Webster St,-122.429608565501,37.7774708209745
17052737419057,170527374,19057,Assault,Threats Against Life,Wednesday,2017-06-28,16:18,Ingleside,"Arrest, Booked",600 Block Of Andover St,-122.41672353622428,37.73523172193735
17068018268020,170680182,68020,OtherOffenses,Miscellaneous Investigation,Sunday,2017-08-20,17:00,Ingleside,None,0 Block Of Sgtjohnvyoung Ln,-122.44470706345524,37.72493072679362
18610131806244,186101318,6244,Larceny/theft,Grand Theft From Locked Auto,Monday,2018-04-30,19:30,Central,None,"Francisco St, Montgomery St",-122.40536136812408,37.80569474173927
17087862205052,170878622,5052,Burglary,"Burglary Of Store, Attempted Forcible Entry",Thursday,2017-10-26,19:00,Northern,None,400 Block Of Octavia St,-122.42457908237996,37.77592613356383
7039696416623,70396964,16623,Drug/narcotic,Possession Of Base/rock Cocaine For Sale,Wednesday,2007-04-18,15:00,Southern,"Arrest, Booked","Market St, Mason St",-122.408953598279,37.783287873572
10080452865016,100804528,65016,OtherOffenses,"Drivers License, Suspended Or Revoked",Wednesday,2010-09-01,02:12,Bayview,"Arrest, Cited","San Bruno Av, Woolsey St",-122.402603565418,37.7252355695069
16006905716030,160069057,16030,Drug/narcotic,Possession Of Marijuana For Sales,Sunday,2016-01-24,17:00,Park,"Arrest, Booked",1400 Block Of Haight St,-122.4461656179778,37.77016118133929
3064744006241,30647440,6241,Larceny/theft,Petty Theft From Locked Auto,Wednesday,2003-05-28,08:00,Bayview,None,500 Block Of Mendell St,-122.385620177088,37.7399498365693
8034446474000,80344464,74000,MissingPerson,Missing Adult,Tuesday,2008-04-01,14:00,Taraval,Located,0 Block Of Kempton Avenue,-122.468503969767,37.7114566429989
18610561106224,186105611,6224,Larceny/theft,Grand Theft From Unlocked Auto,Friday,2018-05-04,23:59,Mission,None,1400 Block Of San Bruno Avenue,-122.40390842060734,37.74972490292504
18606583306372,186065833,6372,Larceny/theft,Petty Theft Of Property,Thursday,2018-03-15,13:00,Central,None,400 Block Of Geary St,-122.41072162586975,37.78709664956634
5043133604013,50431336,4013,Assault,Aggravated Assault With A Deadly Weapon,Monday,2005-04-18,19:20,Southern,None,1400 Block Of Market St,-122.418480564808,37.775898446204
11900665427090,119006654,27090,Larceny/theft,"Lost Property, Petty Theft",Friday,2011-11-04,23:30,Southern,None,800 Block Of Bryant St,-122.403404791479,37.775420706711
16042244903014,160422449,3014,Robbery,"Robbery On The Street, Strongarm",Monday,2016-05-23,21:45,Southern,None,"Market St, 7th St",-122.4125153413556,37.78047774805081
12616280371000,126162803,71000,Non-criminal,Lost Property,Saturday,2012-10-20,23:30,Southern,None,800 Block Of Bryant St,-122.403404791479,37.775420706711
16002277602104,160022776,2104,"SexOffenses,Forcible",Assault To Rape With Bodily Force,Saturday,2016-01-09,05:00,Southern,"Arrest, Booked","Berry St, 5th St",-122.39557919997108,37.77403235421572
8070205027170,80702050,27170,OtherOffenses,Resisting Arrest,Saturday,2008-07-05,08:25,Park,"Arrest, Cited",1600 Block Of Haight St,-122.450452600564,37.7695032629887
3065722306242,30657223,6242,Larceny/theft,Petty Theft From Locked Auto,Thursday,2003-05-29,16:00,Mission,None,"Duboce Av, Guerrero St",-122.424582054943,37.7697332124367
18608632806224,186086328,6224,Larceny/theft,Grand Theft From Unlocked Auto,Wednesday,2018-04-11,23:00,Mission,None,"17th St, Noe St",-122.4329511321977,37.76261907533998
5015600105073,50156001,5073,Burglary,"Burglary, Unlawful Entry",Monday,2005-02-07,23:00,Richmond,None,100 Block Of 6th Avenue,-122.46456254985,37.7858192726967
16045373906241,160453739,6241,Larceny/theft,Petty Theft From Locked Auto,Friday,2016-06-03,14:00,Central,None,"Greenwich St, Leavenworth St",-122.41780061524568,37.80126838394398
17086977868020,170869778,68020,OtherOffenses,Miscellaneous Investigation,Tuesday,2017-10-24,15:15,Central,None,900 Block Of Hyde St,-122.41704429261388,37.78959527743222
10088111228150,100881112,28150,Vandalism,"Malicious Mischief, Vandalism",Wednesday,2010-09-22,08:00,Ingleside,None,0 Block Of Cotter St,-122.433998219387,37.7276370036007
13011754526135,130117545,26135,Assault,Unlawful Dissuading/threatening Of A Witness,Sunday,2013-02-10,00:30,Tenderloin,"Arrest, Booked",300 Block Of Ellis St,-122.411987643595,37.7850226622786
17052968764020,170529687,64020,Non-criminal,"Aided Case, Mental Disturbed",Thursday,2017-06-29,13:05,Southern,None,"4th St, Minna St",-122.403715607574,37.78404281157316
18602647106372,186026471,6372,Larceny/theft,Petty Theft Of Property,Tuesday,2018-01-30,16:30,Bayview,None,"San Bruno Av, Felton St",-122.40459414063396,37.73003799951284
13055161464001,130551614,64001,Non-criminal,"Civil Sidewalks, Warning",Friday,2013-07-05,09:14,Mission,None,300 Block Of Treat Avenue,-122.413445535807,37.7646370171813
18602680706244,186026807,6244,Larceny/theft,Grand Theft From Locked Auto,Saturday,2018-01-27,19:00,Mission,None,1400 Block Of Valencia St,-122.4204978639358,37.74968667099199
16005856119089,160058561,19089,OtherOffenses,Incident On School Grounds,Friday,2016-01-15,20:30,Ingleside,None,500 Block Of Portola Dr,-122.45116398971945,37.74556400629886
12017856303074,120178563,3074,Robbery,"Robbery, Bodily Force",Saturday,2012-03-03,15:00,Ingleside,None,200 Block Of Craut St,-122.428366667857,37.7296419427887
13604793806244,136047938,6244,Larceny/theft,Grand Theft From Locked Auto,Friday,2013-03-08,20:45,Southern,None,"The Embarcaderosouth St, Harrison St",-122.388485562387,37.789572762563
11606615206244,116066152,6244,Larceny/theft,Grand Theft From Locked Auto,Saturday,2011-05-21,16:00,Mission,None,"Folsom St, 26th St",-122.413771304802,37.7493045778658
13622358606244,136223586,6244,Larceny/theft,Grand Theft From Locked Auto,Wednesday,2013-11-27,09:15,Mission,None,"Mission St, 18th St",-122.419360352761,37.7618358012376
18600168371000,186001683,71000,Non-criminal,Lost Property,Wednesday,2018-01-03,10:30,Southern,None,"Brannan St, 4th St",-122.39653324845612,37.77832689787853
11043271163010,110432711,63010,Warrants,Warrant Arrest,Saturday,2011-05-28,20:00,Tenderloin,"Arrest, Booked","Eddy St, Mason St",-122.409313111431,37.7843478513151
17069220664020,170692206,64020,Non-criminal,"Aided Case, Mental Disturbed",Thursday,2017-08-24,21:30,Taraval,None,2000 Block Of 32nd Avenue,-122.490141599322,37.74894208357762
16615156506244,166151565,6244,Larceny/theft,Grand Theft From Locked Auto,Monday,2016-06-13,19:00,Northern,None,"Laguna St, Sutter St",-122.42833791705534,37.78671097316046
5042600804134,50426008,4134,Assault,Battery,Sunday,2005-04-17,02:00,Park,"Arrest, Booked",1100 Block Of Scott St,-122.43709942832,37.7803522156893
18603997906244,186039979,6244,Larceny/theft,Grand Theft From Locked Auto,Saturday,2018-02-17,12:00,Northern,None,1600 Block Of Laguna St,-122.42822021786556,37.78648830751688
17004540161030,170045401,61030,Non-criminal,"Death Report, Cause Unknown",Tuesday,2017-01-17,13:09,Central,None,500 Block Of Bush St,-122.4059414691472,37.79046317797714
5095481112026,50954811,12026,WeaponLaws,Discharge Firearm At An Inhabited Dwelling,Wednesday,2005-08-24,22:30,Bayview,None,1500 Block Of Quesada Avenue,-122.388642824121,37.731815774366
16102566404134,161025664,4134,Assault,Battery,Sunday,2016-12-18,10:26,Mission,"Arrest, Booked","16th St, Harrison St",-122.4131076226929,37.76544801802659
7053940965010,70539409,65010,OtherOffenses,Traffic Violation Arrest,Sunday,2007-05-27,21:50,Southern,"Arrest, Booked","Harrison St, 9th St",-122.410078544842,37.7725264934261
16079672709320,160796727,9320,Fraud,"Credit Card, Theft By Use Of",Saturday,2016-10-01,01:00,Mission,None,2700 Block Of Mission St,-122.41844919178006,37.75302675158759
17600239006244,176002390,6244,Larceny/theft,Grand Theft From Locked Auto,Saturday,2016-12-31,22:00,Northern,None,"Webster St, Sutter St",-122.43155320019568,37.78630399071657
16043482004170,160434820,4170,Assault,False Imprisonment,Friday,2016-05-27,17:09,Tenderloin,"Arrest, Booked",300 Block Of Ellis St,-122.41198764359528,37.78502266227863
4055618203074,40556182,3074,Robbery,"Robbery, Bodily Force",Saturday,2004-05-15,06:15,Richmond,"Arrest, Booked",2000 Block Of Divisadero St,-122.440649216896,37.7885267945405
12024097406243,120240974,6243,Larceny/theft,Petty Theft From Locked Auto,Saturday,2012-03-24,22:30,Southern,None,"Perry St, 3rd St",-122.396844646399,37.7821181034463
16614855628150,166148556,28150,Vandalism,"Malicious Mischief, Vandalism",Tuesday,2016-07-05,08:55,Northern,None,600 Block Of Steiner St,-122.43266921713068,37.77517736136884
5077013406374,50770134,6374,Larceny/theft,Grand Theft Of Property,Sunday,2005-07-10,16:50,Central,"Arrest, Booked",200 Block Of Grant Avenue,-122.405363808928,37.78909143163
16608631006372,166086310,6372,Larceny/theft,Petty Theft Of Property,Saturday,2016-04-09,18:50,Ingleside,None,100 Block Of Ellington Avenue,-122.44380020992466,37.71457791642527
