id,incident_number,incident_code,category,descript,day_of_the_week,date,time,police_dept_district,resolution,address,location_x_axis,location_y_axis
10014945965016,100149459,65016,OtherOffenses,"Drivers License, Suspended Or Revoked",Sunday,2010-02-14,11:20,Northern,"Arrest, Cited","Gough St, Eddy St",-122.424109315499,37.7824756422772
11069493306153,110694933,6153,Larceny/theft,Grand Theft From Person,Monday,2011-08-29,00:20,Southern,None,1000 Block Of Howard St,-122.408625030829,37.7786579385852
12039031927130,120390319,27130,OtherOffenses,Possession Of Burglary Tools,Tuesday,2012-05-15,20:03,Southern,"Arrest, Booked",700 Block Of Market St,-122.405359371753,37.7859774761625
11026499027195,110264990,27195,Trespass,Trespassing,Friday,2011-04-01,10:27,Mission,"Arrest, Booked",1000 Block Of Shotwell St,-122.415022828589,37.7516272270745
7013880716010,70138807,16010,Drug/narcotic,Possession Of Marijuana,Wednesday,2007-02-07,15:27,Ingleside,None,0 Block Of Phelan Avenue,-122.452289660492,37.7256933575703
7003190016710,70031900,16710,Drug/narcotic,Possession Of Narcotics Paraphernalia,Tuesday,2007-01-09,17:15,Tenderloin,"Arrest, Booked",200 Block Of Golden Gate Avenue,-122.414302052544,37.781863316866
11600869306374,116008693,6374,Larceny/theft,Grand Theft Of Property,Tuesday,2011-01-18,14:00,Southern,None,1700 Block Of Market St,-122.423098219736,37.7722683129989
5005758474000,50057584,74000,MissingPerson,Missing Adult,Saturday,2005-01-15,10:00,Central,Located,1600 Block Of Powell St,-122.410809120215,37.7997712835467
6100029116410,61000291,16410,Drug/narcotic,Possession Of Hallucinogenic,Tuesday,2006-09-19,08:02,Park,"Arrest, Booked",700 Block Of Stanyan St,-122.453512911126,37.7686969786551
9113415510115,91134155,10115,Fraud,"Trick And Device, Grand Theft",Wednesday,2009-10-21,01:00,Richmond,None,300 Block Of 30th Avenue,-122.490227406847,37.7826929166086
13072913464030,130729134,64030,Non-criminal,"Aided Case, Sick Person",Sunday,2013-09-01,11:55,Park,None,1200 Block Of Masonic Avenue,-122.445181952651,37.7697359624151
8064852316710,80648523,16710,Drug/narcotic,Possession Of Narcotics Paraphernalia,Saturday,2008-06-21,11:15,Southern,"Arrest, Cited","Jones St, Mcallister St",-122.411979487494,37.7809039696758
11092182771024,110921827,71024,Non-criminal,"Stay Away Or Court Order, Non-dv Related",Tuesday,2011-11-15,16:17,Park,"Arrest, Booked","Haight St, Stanyan St",-122.45353456066,37.7691662978052
8024773310010,80247733,10010,Embezzlement,"Embezzlement, Petty Theft",Friday,2006-09-01,07:00,Bayview,None,1100 Block Of Hollister Avenue,-122.39333133787,37.7203256859376
11026487105153,110264871,5153,Burglary,"Burglary,store Under Construction, Unlawful Entry",Thursday,2011-03-31,05:40,Northern,None,100 Block Of Vanness Avenue,-122.419456894393,37.7768617186718
4003224516664,40032245,16664,Drug/narcotic,Sale Of Controlled Substance,Friday,2004-01-09,11:25,Tenderloin,"Arrest, Booked",100 Block Of Jones St,-122.412386379783,37.7825386747303
4105486075000,41054860,75000,MissingPerson,Found Person,Tuesday,2004-09-14,18:30,Richmond,None,100 Block Of 4th Avenue,-122.462424895232,37.7860201332806
3135951765016,31359517,65016,OtherOffenses,"Drivers License, Suspended Or Revoked",Wednesday,2003-11-19,18:16,Southern,"Arrest, Cited","Market St, Powell St",-122.407545855938,37.7844011794631
12056135007025,120561350,7025,VehicleTheft,Stolen Truck,Monday,2012-07-16,22:10,Mission,None,1800 Block Of Folsom St,-122.415605496237,37.7677177520665
7606550328150,76065503,28150,Vandalism,"Malicious Mischief, Vandalism",Thursday,2007-08-30,14:00,Southern,None,"8th St, Harrison St",-122.408518394535,37.773760403167
14000522504013,140005225,4013,Assault,Aggravated Assault With A Deadly Weapon,Tuesday,2013-12-31,19:00,Northern,"Arrest, Booked",700 Block Of Ellis St,-122.418562097105,37.7841847091303
9058947809130,90589478,9130,Forgery/counterfeiting,"Forgery, False Entries In Records Or Returns",Friday,2008-11-07,11:00,Southern,None,1600 Block Of Mission St,-122.419794421077,37.7703629020559
6018205271000,60182052,71000,Non-criminal,Lost Property,Thursday,2006-02-16,17:30,Mission,None,"Mission St, 16th St",-122.419671780296,37.7650501214668
4014969606313,40149696,6313,Larceny/theft,Petty Theft Bicycle,Friday,2004-02-06,19:30,Southern,None,700 Block Of Howard St,-122.401658663476,37.7841666882161
11605008606244,116050086,6244,Larceny/theft,Grand Theft From Locked Auto,Wednesday,2011-04-20,19:30,Southern,None,"6th St, Market St",-122.41029351969,37.7822305870036
8113549265010,81135492,65010,OtherOffenses,Traffic Violation Arrest,Thursday,2008-10-23,18:28,Tenderloin,"Arrest, Cited",100 Block Of Mason St,-122.40947349732,37.784816365102
6005988706244,60059887,6244,Larceny/theft,Grand Theft From Locked Auto,Sunday,2006-01-15,21:00,Taraval,None,100 Block Of Cambon Dr,-122.474170989826,37.7166569724342
13060259663010,130602596,63010,Warrants,Warrant Arrest,Monday,2013-07-22,13:26,Mission,"Arrest, Booked",2000 Block Of Folsom St,-122.415348514404,37.7650058493722
7091365916621,70913659,16621,Drug/narcotic,Possession Of Base/rock Cocaine,Thursday,2007-09-06,17:44,Bayview,"Arrest, Booked",1000 Block Of Bay Shore Bl,-122.403987368489,37.7318036863895
8096920026150,80969200,26150,OtherOffenses,Parole Violation,Friday,2008-09-12,16:20,Northern,"Arrest, Booked",1600 Block Of Pine St,-122.422984865337,37.7893598360149
11092001716650,110920017,16650,Drug/narcotic,Possession Of Meth-amphetamine,Tuesday,2011-11-15,00:30,Southern,"Arrest, Booked",400 Block Of Minna St,-122.407387172098,37.7810688918781
7133145616710,71331456,16710,Drug/narcotic,Possession Of Narcotics Paraphernalia,Sunday,2007-12-30,11:00,Tenderloin,"Arrest, Cited",0 Block Of Turk St,-122.409849441655,37.7832755202567
9037075072000,90370750,72000,Non-criminal,Found Property,Thursday,2009-04-09,06:30,Central,None,"Broadway St, Stockton St",-122.408622974321,37.7976265594608
7070612504134,70706125,4134,Assault,Battery,Friday,2007-07-13,15:20,Ingleside,None,2700 Block Of Alemany Bl,-122.449870934666,37.7135935462186
12030037426080,120300374,26080,OtherOffenses,Conspiracy,Monday,2012-04-16,06:10,Ingleside,"Arrest, Booked","Avalon Av, Athens St",-122.426094255951,37.7247604484748
12072006771000,120720067,71000,Non-criminal,Lost Property,Tuesday,2012-05-29,12:30,Central,Prosecuted By Outside Agency,100 Block Of Drumm St,-122.396612261014,37.7950446763389
10086962906240,100869629,6240,Larceny/theft,Attempted Theft From Locked Vehicle,Friday,2010-09-10,15:30,Northern,None,"Buchanan St, Bush St",-122.430170528945,37.7874391353148
7025727511010,70257275,11010,StolenProperty,Receiving Stolen Property,Monday,2007-03-12,11:45,Mission,"Arrest, Booked","16th St, Dolores St",-122.426384450806,37.764643937262
3014447462030,30144474,62030,Warrants,Enroute To Parole Officer,Tuesday,2003-02-04,13:25,Bayview,"Arrest, Booked",2100 Block Of 22nd St,-122.402331736762,37.7571489079304
11052237816650,110522378,16650,Drug/narcotic,Possession Of Meth-amphetamine,Wednesday,2011-06-29,09:05,Park,"Arrest, Booked",1000 Block Of Pierce St,-122.435220849154,37.7793984136755
8048536906244,80485369,6244,Larceny/theft,Grand Theft From Locked Auto,Thursday,2008-05-08,17:30,Bayview,None,0 Block Of Westpoint Rd,-122.380382266471,37.7353538209895
8081950809320,80819508,9320,Fraud,"Credit Card, Theft By Use Of",Sunday,2008-06-01,00:01,Southern,None,800 Block Of Bryant St,-122.403404791479,37.775420706711
13093668064020,130936680,64020,Non-criminal,"Aided Case, Mental Disturbed",Monday,2013-11-04,16:00,Northern,Psychopathic Case,1100 Block Of Sutter St,-122.41931732407,37.7879136979106
4007978609320,40079786,9320,Fraud,"Credit Card, Theft By Use Of",Friday,2004-01-16,15:00,Southern,None,600 Block Of Mission St,-122.400101750163,37.7876898900758
12078148919020,120781489,19020,DisorderlyConduct,"Disturbing The Peace, Commotion",Saturday,2012-09-29,01:30,Park,None,100 Block Of Midcrest Wy,-122.448508535869,37.7492456506609
12096941928160,120969419,28160,Vandalism,"Malicious Mischief, Vandalism Of Vehicles",Saturday,2012-12-01,03:40,Bayview,None,1500 Block Of Oakdale Avenue,-122.389471535682,37.7340319720999
13078703507021,130787035,7021,VehicleTheft,Stolen Automobile,Wednesday,2013-09-18,13:30,Richmond,None,1000 Block Of Pointlobos Avenue,-122.513642064265,37.7784692199467
6098537362020,60985373,62020,Warrants,Enroute To Department Of Corrections,Friday,2006-09-15,00:30,Southern,"Arrest, Booked",0 Block Of Mary St,-122.378234380571,37.7331074057574
15003408264085,150034082,64085,SuspiciousOcc,Investigative Detention,Saturday,2013-01-12,10:15,Richmond,None,800 Block Of Clement St,-122.468172949405,37.7827212643426
11039870927195,110398709,27195,Trespass,Trespassing,Tuesday,2011-05-17,15:05,Southern,"Arrest, Booked",800 Block Of 3rd St,-122.391425069857,37.7778727797586
7101012704134,71010127,4134,Assault,Battery,Monday,2007-10-01,12:00,Southern,None,100 Block Of 6th St,-122.408466556173,37.7807008318778
11033351762050,110333517,62050,Warrants,Enroute To Outside Jurisdiction,Sunday,2011-04-24,22:04,Mission,"Arrest, Booked",600 Block Of Guerrero St,-122.423836634462,37.7607430785636
7130257605011,71302576,5011,Burglary,"Burglary Of Apartment House, Forcible Entry",Thursday,2007-12-20,19:30,Northern,None,2100 Block Of Beach St,-122.444442164393,37.8035424596885
7091290213070,70912902,13070,Prostitution,Solicits To Visit House Of Prostitution,Saturday,2007-09-08,21:40,Central,"Arrest, Cited","Post St, Larkin St",-122.41827417166,37.7870372043685
3111232164070,31112321,64070,SuspiciousOcc,Suspicious Occurrence,Saturday,2003-09-20,13:50,Central,None,400 Block Of Davis Ct,-122.398187664281,37.7967148853927
3003935807046,30039358,7046,VehicleTheft,"Vehicle, Recovered, Other Vehicle",Friday,2003-01-10,01:58,Bayview,None,1300 Block Of Griffith St,-122.380598750274,37.7267028585173
3125983263010,31259832,63010,Warrants,Warrant Arrest,Sunday,2003-10-26,19:59,Ingleside,"Arrest, Booked",3300 Block Of Mission St,-122.421264331104,37.743584765874
6049786704014,60497867,4014,Assault,Aggravated Assault With Bodily Force,Wednesday,2006-05-10,15:45,Taraval,None,1200 Block Of Ocean Avenue,-122.455615861538,37.7238590120011
8028781426150,80287814,26150,OtherOffenses,Parole Violation,Tuesday,2008-03-18,11:35,Bayview,"Arrest, Booked","Selby St, Galvez Avenue",-122.395175272523,37.7449106281886
13008306504138,130083065,4138,Assault,"Battery, Former Spouse Or Dating Relationship",Tuesday,2013-01-29,19:10,Ingleside,"Arrest, Booked",400 Block Of Detroit St,-122.444366608199,37.7312935965268
10042098604136,100420986,4136,Assault,Battery With Serious Injuries,Thursday,2010-05-06,19:50,Tenderloin,None,"Fulton St, Hyde St",-122.415127837608,37.7797870676495
6003287706301,60032877,6301,Larceny/theft,Petty Theft From A Building,Saturday,2006-01-07,02:15,Northern,None,"Haight St, Fillmore St",-122.430436523474,37.7721069661669
3096268012060,30962680,12060,WeaponLaws,Poss Of Deadly Weapon With Intent To Assault,Thursday,2003-08-14,21:07,Central,"Arrest, Booked","Broadway St, Powell St",-122.41026540737,37.7974186691942
9010917365015,90109173,65015,OtherOffenses,Traffic Violation,Friday,2009-01-30,13:50,Richmond,"Arrest, Cited","Geary Bl, 15th Avenue",-122.473984424285,37.7805743130102
6052435706365,60524357,6365,Larceny/theft,Petty Theft With Prior,Wednesday,2006-05-17,10:44,Ingleside,None,5200 Block Of Diamondheights Bl,-122.439065944959,37.7442774766877
3148649915150,31486499,15150,OtherOffenses,Violation Of Restraining Order,Friday,2003-12-12,18:30,Ingleside,None,0 Block Of Fredson Ct,-122.447056986885,37.7135809006498
9602734506244,96027345,6244,Larceny/theft,Grand Theft From Locked Auto,Thursday,2009-04-09,18:10,Northern,None,1300 Block Of Bush St,-122.419508197521,37.7888565421382
10081906628150,100819066,28150,Vandalism,"Malicious Mischief, Vandalism",Thursday,2010-08-05,02:08,Central,None,400 Block Of Broadway St,-122.405087523335,37.7981219270604
6109125604114,61091256,4114,Assault,Attempted Simple Assault,Thursday,2006-10-12,16:00,Bayview,None,1000 Block Of Fitzgerald Avenue,-122.388416108229,37.7191956969734
13094702903441,130947029,3441,Robbery,Attempted Robbery Chain Store With A Gun,Friday,2013-11-08,05:31,Central,None,0 Block Of Drumm St,-122.396556426173,37.7941169057941
3142966505153,31429665,5153,Burglary,"Burglary,store Under Construction, Unlawful Entry",Saturday,2003-12-06,12:00,Central,None,300 Block Of Clay St,-122.398573051955,37.7952923975164
9029367964070,90293679,64070,SuspiciousOcc,Suspicious Occurrence,Friday,2009-03-20,14:01,Mission,Unfounded,1800 Block Of Mission St,-122.419970859857,37.7674540344176
6029509703014,60295097,3014,Robbery,"Robbery On The Street, Strongarm",Saturday,2006-03-18,10:09,Southern,None,600 Block Of Folsom St,-122.398341686223,37.7841714378594
4116820168020,41168201,68020,OtherOffenses,Miscellaneous Investigation,Tuesday,2004-10-12,16:35,Northern,None,100 Block Of Church St,-122.429159883658,37.7690612353533
7129256315150,71292563,15150,OtherOffenses,Violation Of Restraining Order,Tuesday,2007-12-18,12:15,Central,None,200 Block Of Bush St,-122.401606110584,37.7911229295532
5009373206244,50093732,6244,Larceny/theft,Grand Theft From Locked Auto,Monday,2005-01-24,21:30,Richmond,None,"33rd Av, Balboa St",-122.493043453774,37.7759079618252
11012121568020,110121215,68020,OtherOffenses,Miscellaneous Investigation,Wednesday,2011-02-09,08:30,Southern,None,800 Block Of Bryant St,-122.403404791479,37.775420706711
11014931416621,110149314,16621,Drug/narcotic,Possession Of Base/rock Cocaine,Saturday,2011-02-19,18:32,Southern,"Arrest, Booked",100 Block Of 6th St,-122.407877117352,37.7803875013555
4002855128160,40028551,28160,Vandalism,"Malicious Mischief, Vandalism Of Vehicles",Thursday,2004-01-08,14:00,Mission,None,400 Block Of Castro St,-122.435150099812,37.7617597243598
6030800406114,60308004,6114,Larceny/theft,Grand Theft Pickpocket,Tuesday,2006-03-21,17:25,Central,Not Prosecuted,1600 Block Of The Embarcaderonorth St,-122.410774214375,37.8084350175869
11005283606362,110052836,6362,Larceny/theft,Petty Theft Shoplifting,Monday,2011-01-17,20:40,Tenderloin,"Arrest, Booked",0 Block Of Ofarrell St,-122.405895369887,37.7867342184983
11040930627199,110409306,27199,Trespass,Lodging Without Permission,Saturday,2011-05-21,06:34,Tenderloin,"Arrest, Cited",0 Block Of Golden Gate Avenue,-122.411268613368,37.7822500873167
8136683568020,81366835,68020,OtherOffenses,Miscellaneous Investigation,Wednesday,2008-12-24,05:15,Ingleside,None,"Mission St, Precita Avenue",-122.419123525573,37.7467755179049
6102235804134,61022358,4134,Assault,Battery,Sunday,2006-09-24,19:20,Mission,"Arrest, Cited",2700 Block Of 22nd St,-122.408971392174,37.7560813493229
3018905061030,30189050,61030,Non-criminal,"Death Report, Cause Unknown",Friday,2003-02-14,16:30,Tenderloin,None,200 Block Of Jones St,-122.412436901867,37.7834857455601
3118854871000,31188548,71000,Non-criminal,Lost Property,Tuesday,2003-09-09,07:00,Taraval,None,2300 Block Of 24th Avenue,-122.48118317163,37.7437268170337
9087560316010,90875603,16010,Drug/narcotic,Possession Of Marijuana,Tuesday,2009-08-25,12:00,Bayview,"Arrest, Cited",0 Block Of Latona St,-122.392494990674,37.7315817424486
13098597207055,130985972,7055,RecoveredVehicle,Recovered Vehicle - Stolen Outside Sf,Thursday,2013-11-21,08:02,Tenderloin,None,0 Block Of Mcallister St,-122.412596970637,37.7811192121542
9607574206244,96075742,6244,Larceny/theft,Grand Theft From Locked Auto,Monday,2009-08-24,07:00,Northern,None,"Page St, Buchanan St",-122.42736043763,37.7734538474717
5097145106243,50971451,6243,Larceny/theft,Petty Theft From Locked Auto,Monday,2005-08-29,13:15,Taraval,None,200 Block Of Winston Dr,-122.477976682169,37.7269346350353
4135420607046,41354206,7046,VehicleTheft,"Vehicle, Recovered, Other Vehicle",Friday,2004-11-26,09:00,Taraval,None,"Palmetto Av, Victoria St",-122.465256733509,37.7107661046302
13622504306244,136225043,6244,Larceny/theft,Grand Theft From Locked Auto,Friday,2013-11-29,20:45,Southern,None,"Townsend St, 2nd St",-122.390531404145,37.7806070798477
11612091806372,116120918,6372,Larceny/theft,Petty Theft Of Property,Tuesday,2011-09-13,18:15,Southern,None,0 Block Of 3rd St,-122.402835528142,37.7868009028384
11059918909029,110599189,9029,OtherOffenses,False Personation To Receive Money Or Property,Friday,2011-07-15,13:41,Ingleside,None,0 Block Of Acton St,-122.452569346731,37.7084890025884
9056392706244,90563927,6244,Larceny/theft,Grand Theft From Locked Auto,Sunday,2009-05-31,19:00,Central,None,900 Block Of Sutter St,-122.416032976503,37.7883351248181
13040267526150,130402675,26150,OtherOffenses,Parole Violation,Thursday,2013-05-16,12:44,Taraval,"Arrest, Booked",900 Block Of Holloway Avenue,-122.463131594027,37.7216342131594
12033629406243,120336294,6243,Larceny/theft,Petty Theft From Locked Auto,Friday,2012-04-27,20:39,Ingleside,None,0 Block Of Leland Avenue,-122.404262861765,37.7113387848327
11061888603424,110618886,3424,Robbery,Attempted Robbery Comm. Estab. With Bodily Force,Wednesday,2011-08-03,10:57,Taraval,"Arrest, Booked",1200 Block Of Irving St,-122.47114555295,37.7638796121694
8090563019057,80905630,19057,Assault,Threats Against Life,Wednesday,2008-08-27,13:12,Southern,None,1200 Block Of Market St,-122.415448759562,37.778293520129
7090976116625,70909761,16625,Drug/narcotic,Sale Of Base/rock Cocaine,Wednesday,2007-09-05,19:30,Northern,"Arrest, Booked","Vanness Av, Hemlock St",-122.421663714433,37.787075403993
7102372216010,71023722,16010,Drug/narcotic,Possession Of Marijuana,Friday,2007-10-05,14:04,Bayview,"Arrest, Booked",1700 Block Of Quesada Avenue,-122.392393403915,37.7337451568089
12001981014052,120019810,14052,"SexOffenses,Forcible","Oral Copulation, Unlawful (adult Victim)",Thursday,2012-01-05,09:30,Mission,"Arrest, Booked",1900 Block Of Mission St,-122.41967661615,37.7658510977435
13092534809320,130925348,9320,Fraud,"Credit Card, Theft By Use Of",Thursday,2013-10-31,13:00,Ingleside,None,0 Block Of Schwerin St,-122.410335138973,37.7127263408597
11074306364020,110743063,64020,Non-criminal,"Aided Case, Mental Disturbed",Thursday,2011-09-15,11:28,Bayview,Psychopathic Case,200 Block Of Arkansas St,-122.39845066977,37.7630911623917
7044803209320,70448032,9320,Fraud,"Credit Card, Theft By Use Of",Saturday,2007-03-10,06:00,Northern,Not Prosecuted,1500 Block Of Eddy St,-122.433177816267,37.7813758100318
8131495306244,81314953,6244,Larceny/theft,Grand Theft From Locked Auto,Tuesday,2008-12-09,15:00,Northern,None,1500 Block Of Franklin St,-122.423572929852,37.7885214703257
10031984007021,100319840,7021,VehicleTheft,Stolen Automobile,Tuesday,2010-04-06,00:01,Northern,"Arrest, Booked",1600 Block Of Post St,-122.428992673997,37.7857262026184
10600588171000,106005881,71000,Non-criminal,Lost Property,Monday,2010-01-11,23:40,Southern,None,0 Block Of 1st St,-122.397694321211,37.7899359092419
6121685204064,61216852,4064,Assault,Mayhem With Bodily Force,Sunday,2006-10-29,19:30,Northern,None,3100 Block Of Scott St,-122.440957922572,37.7987682120412
10039923471000,100399234,71000,Non-criminal,Lost Property,Thursday,2010-04-29,13:00,Bayview,Unfounded,"3rd St, Wallace Avenue",-122.392899342709,37.7284904239683
13041950105014,130419501,5014,Burglary,"Burglary, Vehicle (arrest Made)",Tuesday,2013-05-21,19:19,Central,"Arrest, Booked",0 Block Of Francisco St,-122.406167794377,37.8056494557581
5010777528160,50107775,28160,Vandalism,"Malicious Mischief, Vandalism Of Vehicles",Saturday,2005-01-15,11:00,Ingleside,None,1900 Block Of Sunnydale Avenue,-122.417144802399,37.7121502932531
9013225907025,90132259,7025,VehicleTheft,Stolen Truck,Thursday,2009-02-05,08:00,Mission,None,"Hampshire St, 17th St",-122.408427407542,37.7644278689168
5132849575000,51328495,75000,MissingPerson,Found Person,Thursday,2005-11-24,21:27,Richmond,"Arrest, Booked","Geary Bl, 17th Avenue",-122.476169109518,37.7804745331212
11028663706304,110286637,6304,Larceny/theft,Grand Theft From A Building,Wednesday,2011-04-06,11:45,Taraval,None,2100 Block Of 24th Avenue,-122.481305019184,37.7474613181905
5080240806365,50802408,6365,Larceny/theft,Petty Theft With Prior,Monday,2005-07-18,17:00,Park,"Arrest, Booked",600 Block Of Haight St,-122.43294024481,37.7718450016424
8080176565015,80801765,65015,OtherOffenses,Traffic Violation,Wednesday,2008-07-30,16:10,Tenderloin,"Arrest, Cited",300 Block Of Golden Gate Avenue,-122.416351987352,37.7816031438671
5138403303063,51384033,3063,Robbery,Robbery Of A Bank With A Dangerous Weapon,Friday,2005-12-09,11:03,Southern,"Arrest, Booked",1500 Block Of Market St,-122.419666717917,37.7746823329875
13605070906224,136050709,6224,Larceny/theft,Grand Theft From Unlocked Auto,Saturday,2013-03-16,01:30,Northern,None,2200 Block Of Sacramento St,-122.429941186434,37.7904080392459
6037423716710,60374237,16710,Drug/narcotic,Possession Of Narcotics Paraphernalia,Friday,2006-04-07,18:39,Northern,"Arrest, Booked","Willow St, Polk St",-122.419274801449,37.7835680535207
12030084171000,120300841,71000,Non-criminal,Lost Property,Thursday,2012-04-12,05:00,Southern,None,800 Block Of Bryant St,-122.403404791479,37.775420706711
3021935604134,30219356,4134,Assault,Battery,Saturday,2003-02-22,01:20,Park,None,1300 Block Of Haight St,-122.444502333693,37.7702619702403
12089119105151,120891191,5151,Burglary,"Burglary,store Under Construction, Forcible Entry",Sunday,2012-11-04,01:40,Park,"Arrest, Booked",500 Block Of Irving St,-122.463643452439,37.7640990577223
13063994704033,130639947,4033,Assault,Assault With Caustic Chemicals,Saturday,2013-08-03,11:00,Northern,"Arrest, Booked",700 Block Of Ellis St,-122.418562097105,37.7841847091303
10009544864070,100095448,64070,SuspiciousOcc,Suspicious Occurrence,Monday,2010-01-18,08:00,Mission,None,3000 Block Of Mission St,-122.418024880085,37.7485868840572
6093808705013,60938087,5013,Burglary,"Burglary Of Apartment House, Unlawful Entry",Saturday,2006-09-02,13:00,Richmond,None,300 Block Of Arguello Bl,-122.459156870347,37.7844209056208
9040475719057,90404757,19057,Assault,Threats Against Life,Saturday,2009-04-18,10:00,Taraval,"Arrest, Booked",2000 Block Of 43rd Avenue,-122.501931786165,37.7484225785599
13068409916710,130684099,16710,Drug/narcotic,Possession Of Narcotics Paraphernalia,Saturday,2013-08-17,17:35,Central,"Arrest, Booked",800 Block Of Bush St,-122.411259228464,37.7897894219545
9128518416625,91285184,16625,Drug/narcotic,Sale Of Base/rock Cocaine,Thursday,2009-12-17,16:35,Tenderloin,"Arrest, Booked",100 Block Of Eddy St,-122.410157073911,37.7842973843312
8095956815200,80959568,15200,SecondaryCodes,Domestic Violence,Friday,2008-09-05,19:00,Taraval,"Arrest, Booked",1300 Block Of 20th Avenue,-122.478194247055,37.7625630891661
5086474307043,50864743,7043,VehicleTheft,"Vehicle, Recovered, Motorcycle",Tuesday,2005-08-02,19:00,Northern,None,"Union St, Fillmore St",-122.435492746222,37.7970869618559
12007656913060,120076569,13060,Prostitution,Solicits For Act Of Prostitution,Friday,2012-01-27,23:50,Tenderloin,"Arrest, Cited","Hyde St, Ofarrell St",-122.416261836834,37.7853750846376
9111895509320,91118955,9320,Fraud,"Credit Card, Theft By Use Of",Tuesday,2009-10-27,15:00,Mission,None,1200 Block Of Hampshire St,-122.40714465605,37.7520972558707
11027972328150,110279723,28150,Vandalism,"Malicious Mischief, Vandalism",Tuesday,2011-04-05,19:30,Mission,None,400 Block Of Castro St,-122.435150099812,37.7617597243598
9040109826100,90401098,26100,Extortion,Extortion,Friday,2009-04-17,12:55,Richmond,None,800 Block Of 38th Avenue,-122.498111375176,37.7728523140228
7023693468020,70236934,68020,OtherOffenses,Miscellaneous Investigation,Tuesday,2007-03-06,19:15,Northern,"Arrest, Booked",1700 Block Of Filbert St,-122.428306500557,37.7990143347959
12059289409029,120592894,9029,OtherOffenses,False Personation To Receive Money Or Property,Friday,2012-07-13,14:00,Park,None,800 Block Of Buenavistawest Avenue,-122.442597549743,37.7693116425317
12101012206362,121010122,6362,Larceny/theft,Petty Theft Shoplifting,Saturday,2012-12-15,15:16,Tenderloin,"Arrest, Cited",100 Block Of Powell St,-122.40801449292,37.7859507767613
9076886007021,90768860,7021,VehicleTheft,Stolen Automobile,Tuesday,2009-07-28,17:30,Northern,None,1700 Block Of Pacific Avenue,-122.424076295172,37.7947645414038
4070014107041,40700141,7041,VehicleTheft,"Vehicle, Recovered, Auto",Friday,2004-06-18,17:00,Richmond,None,2900 Block Of Clay St,-122.441646229533,37.7897113679197
5113671516621,51136715,16621,Drug/narcotic,Possession Of Base/rock Cocaine,Saturday,2005-10-08,17:11,Northern,None,700 Block Of Polk St,-122.419159190984,37.7833430636234
9027273612120,90272736,12120,WeaponLaws,Poss Of Prohibited Weapon,Sunday,2009-03-15,09:00,Northern,"Arrest, Booked",600 Block Of Larkin St,-122.417594247706,37.7840149232554
6034084610015,60340846,10015,Embezzlement,"Embezzlement, Grand Theft",Tuesday,2006-02-21,09:00,Bayview,None,1200 Block Of Newhall St,-122.391429065321,37.7366235255732
10056804775000,100568047,75000,MissingPerson,Found Person,Sunday,2010-06-20,11:31,Bayview,None,1600 Block Of Ingalls St,-122.384224139925,37.7287608585554
13618185906372,136181859,6372,Larceny/theft,Petty Theft Of Property,Tuesday,2013-09-24,12:00,Taraval,None,2200 Block Of 14th Avenue,-122.470359608661,37.7460753397163
10063699564085,100636995,64085,SuspiciousOcc,Investigative Detention,Monday,2010-07-12,00:42,Central,"Arrest, Cited",400 Block Of Union St,-122.406362541513,37.8007365278513
7126398428160,71263984,28160,Vandalism,"Malicious Mischief, Vandalism Of Vehicles",Monday,2007-12-10,18:01,Tenderloin,"Arrest, Cited",200 Block Of Mcallister St,-122.416577792446,37.780614876154
6004536971000,60045369,71000,Non-criminal,Lost Property,Wednesday,2006-01-11,17:00,Southern,None,"4th St, Howard St",-122.402712593282,37.7832596543979
7023256228150,70232562,28150,Vandalism,"Malicious Mischief, Vandalism",Monday,2007-03-05,17:47,Park,None,1700 Block Of Eddy St,-122.43644305449,37.7808493247624
