id,incident_number,incident_code,category,descript,day_of_the_week,date,time,police_dept_district,resolution,address,location_x_axis,location_y_axis
12094975665015,120949756,65015,OtherOffenses,Traffic Violation,Saturday,2012-11-24,00:10,Ingleside,"Arrest, Booked",0 Block Of Alpha St,-122.402829876963,37.7152256524439
11028604109027,110286041,9027,OtherOffenses,False Personation,Friday,2011-04-08,09:00,Mission,None,2600 Block Of Mission St,-122.41860030589,37.7546255872838
12065823626080,120658236,26080,OtherOffenses,Conspiracy,Saturday,2012-08-18,19:30,Tenderloin,"Arrest, Booked","Larkin St, Grove St",-122.416583456133,37.7786591541508
12074686907021,120746869,7021,VehicleTheft,Stolen Automobile,Saturday,2012-09-15,18:15,Northern,None,"Webster St, Beach St",-122.435360311566,37.8047557684678
6073662106244,60736621,6244,Larceny/theft,Grand Theft From Locked Auto,Thursday,2006-06-29,14:00,Bayview,None,"Bay Shore Bl, Marin St",-122.403538936234,37.7481188207029
12061545207055,120615452,7055,RecoveredVehicle,Recovered Vehicle - Stolen Outside Sf,Saturday,2012-08-04,06:30,Park,None,1100 Block Of Scott St,-122.437236101904,37.7803348745141
8030685606304,80306856,6304,Larceny/theft,Grand Theft From A Building,Sunday,2008-03-23,13:30,Mission,None,1200 Block Of South Van Ness Avenue,-122.416269089153,37.7531590161083
11060189707043,110601897,7043,RecoveredVehicle,"Vehicle, Recovered, Motorcycle",Saturday,2011-08-06,01:25,Southern,"Arrest, Booked",400 Block Of Minna St,-122.407505446721,37.7811304562104
13031350507200,130313505,7200,OtherOffenses,False Evidence Of Vehicle Registration,Wednesday,2013-04-17,13:30,Taraval,None,1300 Block Of 46th Avenue,-122.505923256341,37.761339931633
12093339516623,120933395,16623,Drug/narcotic,Possession Of Base/rock Cocaine For Sale,Sunday,2012-11-18,04:40,Tenderloin,"Arrest, Booked",500 Block Of Ofarrell St,-122.413820070176,37.7857382950322
10110779962050,101107799,62050,Warrants,Enroute To Outside Jurisdiction,Tuesday,2010-11-30,18:50,Northern,"Arrest, Booked",400 Block Of Haight St,-122.429622714719,37.7721558284987
9017559465016,90175594,65016,OtherOffenses,"Drivers License, Suspended Or Revoked",Tuesday,2009-02-17,23:05,Tenderloin,"Arrest, Cited","Ellis St, Jones St",-122.412784096502,37.7848656939526
5013441165016,50134411,65016,OtherOffenses,"Drivers License, Suspended Or Revoked",Thursday,2005-02-03,16:40,Park,"Arrest, Cited","18th St, Danvers St",-122.443444637264,37.7603313771026
11094550416650,110945504,16650,Drug/narcotic,Possession Of Meth-amphetamine,Thursday,2011-11-24,02:39,Northern,"Arrest, Booked",1500 Block Of Vanness Avenue,-122.422062730264,37.7899200014841
9027722515200,90277225,15200,SecondaryCodes,Domestic Violence,Tuesday,2009-02-24,22:00,Southern,None,300 Block Of 9th St,-122.410919016011,37.773130623238
7119067228150,71190672,28150,Vandalism,"Malicious Mischief, Vandalism",Monday,2007-11-19,08:00,Southern,None,"King St, Deharo St",-122.402075831854,37.7698842625949
6105984064070,61059840,64070,SuspiciousOcc,Suspicious Occurrence,Wednesday,2006-10-04,11:30,Taraval,None,1700 Block Of 40th Avenue,-122.498967108288,37.7541607465263
13059600206304,130596002,6304,Larceny/theft,Grand Theft From A Building,Friday,2013-07-19,22:30,Central,"Arrest, Booked",2500 Block Of Taylor St,-122.415270023651,37.8058980113661
10097860663010,100978606,63010,Warrants,Warrant Arrest,Thursday,2010-10-21,11:21,Ingleside,None,200 Block Of Hahn St,-122.416389483879,37.7112123454185
13098774616664,130987746,16664,Drug/narcotic,Sale Of Controlled Substance,Thursday,2013-11-21,17:06,Tenderloin,"Arrest, Booked","Leavenworth St, Golden Gate Avenue",-122.413869632554,37.7818621883021
12099986471000,120999864,71000,Non-criminal,Lost Property,Wednesday,2012-12-12,02:15,Central,None,400 Block Of Geary St,-122.41072162587,37.7870966495663
12017576303011,120175763,3011,Robbery,Robbery On The Street With A Gun,Friday,2012-03-02,15:50,Northern,"Arrest, Booked",1100 Block Of Turk St,-122.428840433603,37.7809727343437
13014951006303,130149510,6303,Larceny/theft,Petty Theft From A Building,Friday,2013-02-08,09:30,Mission,None,200 Block Of Chattanooga St,-122.426472976561,37.7525462209028
5140258806374,51402588,6374,Larceny/theft,Grand Theft Of Property,Tuesday,2005-11-08,17:00,Park,None,0 Block Of Castro St,-122.435637436721,37.7681694346175
11045630764020,110456307,64020,Non-criminal,"Aided Case, Mental Disturbed",Monday,2011-06-06,08:16,Park,None,0 Block Of Encanto Avenue,-122.443514803631,37.7804956564763
3109817904134,31098179,4134,Assault,Battery,Thursday,2003-09-11,15:30,Northern,None,"Van Ness Av, Greenwich St",-122.424363021457,37.8004143219627
8103780419090,81037804,19090,Drunkenness,Under Influence Of Alcohol In A Public Place,Monday,2008-09-29,16:59,Mission,"Arrest, Booked",3200 Block Of 24th St,-122.416551372097,37.7524095591909
3119148806244,31191488,6244,Larceny/theft,Grand Theft From Locked Auto,Thursday,2003-10-09,16:00,Richmond,None,"9th Av, Martin Luther King Jr Dr",-122.466429551461,37.7664741386147
4024214306241,40242143,6241,Larceny/theft,Petty Theft From Locked Auto,Sunday,2004-02-29,22:40,Northern,None,800 Block Of Laguna St,-122.426805156627,37.7787935169228
8088029213070,80880292,13070,Prostitution,Solicits To Visit House Of Prostitution,Thursday,2008-08-21,04:10,Mission,"Arrest, Booked","20th St, Shotwell St",-122.415781281593,37.7588312134679
6006921264020,60069212,64020,Non-criminal,"Aided Case, Mental Disturbed",Wednesday,2006-01-18,21:43,Central,None,900 Block Of Columbus Avenue,-122.414354301151,37.8031089840376
4049897665015,40498976,65015,OtherOffenses,Traffic Violation,Saturday,2004-05-01,10:20,Mission,"Arrest, Cited","Folsom St, 18th St",-122.415000536794,37.7620990020727
8111237174000,81112371,74000,MissingPerson,Missing Adult,Thursday,2008-10-16,07:30,Bayview,None,1700 Block Of Newcomb Avenue,-122.392643753605,37.7367848800513
8088995964070,80889959,64070,SuspiciousOcc,Suspicious Occurrence,Wednesday,2008-07-02,08:00,Central,None,900 Block Of Front St,-122.400091665519,37.8001617207262
9105046006304,91050460,6304,Larceny/theft,Grand Theft From A Building,Sunday,2009-10-11,01:00,Richmond,None,600 Block Of 23rd Avenue,-122.482318904044,37.775446151841
4112941306242,41129413,6242,Larceny/theft,Petty Theft From Locked Auto,Saturday,2004-10-02,18:00,Southern,None,"6th St, Stevenson St",-122.409696355566,37.7817540588482
13612460528160,136124605,28160,Vandalism,"Malicious Mischief, Vandalism Of Vehicles",Thursday,2013-07-18,19:30,Bayview,None,1900 Block Of 18th St,-122.401829938947,37.7622043338055
11072090865016,110720908,65016,OtherOffenses,"Drivers License, Suspended Or Revoked",Thursday,2011-09-08,01:23,Park,"Arrest, Cited","Fell St, Baker St",-122.440923876434,37.7736351065468
11048315628100,110483156,28100,Vandalism,"Malicious Mischief, Breaking Windows",Thursday,2011-06-16,01:08,Central,"Arrest, Cited",800 Block Of Pacific Avenue,-122.409652663162,37.7964914531604
9020052716625,90200527,16625,Drug/narcotic,Sale Of Base/rock Cocaine,Tuesday,2009-02-24,12:57,Tenderloin,"Arrest, Booked",400 Block Of Ellis St,-122.413631253258,37.7848053746211
4001090615150,40010906,15150,OtherOffenses,Violation Of Restraining Order,Sunday,2004-01-04,10:41,Mission,"Arrest, Booked","16th St, Pond St",-122.432281791651,37.76428919558
4120353415150,41203534,15150,OtherOffenses,Violation Of Restraining Order,Thursday,2004-10-21,10:30,Central,"Arrest, Booked",1200 Block Of Grant Avenue,-122.407049542301,37.7983399167576
5093191616650,50931916,16650,Drug/narcotic,Possession Of Meth-amphetamine,Friday,2005-08-19,17:20,Central,"Arrest, Booked",800 Block Of Geary St,-122.417295322526,37.7862578545865
3014409871000,30144098,71000,Non-criminal,Lost Property,Sunday,2003-02-02,01:00,Central,None,"Broadway St, Columbus Avenue",-122.406669739958,37.7978641744165
8020834305041,80208343,5041,Burglary,"Burglary Of Residence, Forcible Entry",Wednesday,2008-02-27,08:00,Ingleside,None,700 Block Of Moscow St,-122.431809203579,37.7158291631877
9068834312080,90688343,12080,WeaponLaws,Poss Of Firearm By Convicted Felon/addict/alien,Monday,2009-07-06,18:14,Ingleside,"Arrest, Booked",900 Block Of Ellsworth St,-122.416446124049,37.7329162539537
9070287464070,90702874,64070,SuspiciousOcc,Suspicious Occurrence,Friday,2009-07-10,11:30,Bayview,None,0 Block Of Baldwin Ct,-122.380715788947,37.7296096317188
7026610706240,70266107,6240,Larceny/theft,Attempted Theft From Locked Vehicle,Thursday,2007-03-01,16:00,Taraval,None,"Font Bl, Serrano Dr",-122.479750928414,37.7195719219714
3044651571000,30446515,71000,Non-criminal,Lost Property,Wednesday,2003-04-16,06:00,Northern,None,600 Block Of Larch St,-122.428129865519,37.7814240041364
3029234616660,30292346,16660,Drug/narcotic,Possession Of Controlled Substance,Tuesday,2003-03-11,12:57,Southern,"Arrest, Booked",1100 Block Of Market St,-122.412320907436,37.7807642254398
4018102404134,40181024,4134,Assault,Battery,Saturday,2004-02-14,11:20,Central,None,1400 Block Of Stockton St,-122.40879208563,37.7988132153058
10066352806301,100663528,6301,Larceny/theft,Petty Theft From A Building,Monday,2010-07-19,08:00,Mission,None,400 Block Of Valencia St,-122.421935077177,37.7661343875141
4025498816625,40254988,16625,Drug/narcotic,Sale Of Base/rock Cocaine,Wednesday,2004-03-03,21:00,Tenderloin,"Arrest, Booked",200 Block Of Eddy St,-122.411800134753,37.7840890366868
4081781565050,40817815,65050,DrivingUnderTheInfluence,Driving While Under The Influence Of Alcohol,Sunday,2004-07-18,06:10,Northern,"Arrest, Booked","Larkin St, Pine St",-122.418844748105,37.7898297669362
5104839206304,51048392,6304,Larceny/theft,Grand Theft From A Building,Sunday,2005-09-18,09:10,Central,None,600 Block Of Bush St,-122.40836738789,37.7901567744673
7086594765010,70865947,65010,OtherOffenses,Traffic Violation Arrest,Saturday,2007-08-25,00:37,Tenderloin,"Arrest, Cited",200 Block Of Eddy St,-122.411778295992,37.7839805592634
4017972807021,40179728,7021,VehicleTheft,Stolen Automobile,Friday,2004-02-13,12:15,Mission,Unfounded,"22nd St, Eureka St",-122.437647387774,37.7542956666562
13038347312030,130383473,12030,WeaponLaws,Exhibiting Deadly Weapon In A Threating Manner,Friday,2013-05-10,10:45,Taraval,District Attorney Refuses To Prosecute,400 Block Of Urbano Dr,-122.470001533555,37.7246514456957
6116504962050,61165049,62050,Warrants,Enroute To Outside Jurisdiction,Wednesday,2006-11-01,01:25,Northern,"Arrest, Booked",300 Block Of Fulton St,-122.422536478306,37.7787958771466
12050755865015,120507558,65015,OtherOffenses,Traffic Violation,Wednesday,2012-06-27,19:20,Central,"Arrest, Cited","Sutter St, Montgomery St",-122.402194030894,37.7900391299667
5053337415150,50533374,15150,OtherOffenses,Violation Of Restraining Order,Friday,2005-05-13,15:45,Southern,None,"Market St, Jones St",-122.411979487501,37.7809039696529
5094551906152,50945519,6152,Larceny/theft,Grand Theft From Person,Tuesday,2005-08-23,03:00,Bayview,None,500 Block Of Dwight St,-122.407543869088,37.722589401968
3052294919057,30522949,19057,Assault,Threats Against Life,Sunday,2003-05-04,21:40,Mission,Not Prosecuted,500 Block Of Capp St,-122.417955821717,37.7578801214437
8122945906314,81229459,6314,Larceny/theft,Grand Theft Bicycle,Sunday,2008-11-16,11:30,Tenderloin,None,200 Block Of Mason St,-122.409523740653,37.7857602954934
8050243005011,80502430,5011,Burglary,"Burglary Of Apartment House, Forcible Entry",Tuesday,2008-05-13,16:15,Taraval,District Attorney Refuses To Prosecute,0 Block Of Cambon Dr,-122.474584301346,37.7183032721698
11082240707025,110822407,7025,VehicleTheft,Stolen Truck,Monday,2011-10-10,18:30,Park,None,"Fell St, Central Avenue",-122.444217653151,37.7732099933428
9123454506221,91234545,6221,Larceny/theft,Petty Theft From Unlocked Auto,Tuesday,2009-12-01,21:00,Southern,None,100 Block Of Brannan St,-122.388951188725,37.7842368700738
10064146105071,100641461,5071,Burglary,"Burglary, Forcible Entry",Tuesday,2010-07-13,02:40,Central,None,1000 Block Of Pine St,-122.413095913657,37.790511704938
8125431565016,81254315,65016,OtherOffenses,"Drivers License, Suspended Or Revoked",Sunday,2008-11-23,13:22,Ingleside,"Arrest, Cited","Gennesee St, Monterey Bl",-122.451144641538,37.7315369999453
5133437311010,51334373,11010,StolenProperty,Receiving Stolen Property,Saturday,2005-11-26,17:50,Southern,"Arrest, Booked",800 Block Of Mission St,-122.405395493939,37.7835100715421
13069035364020,130690353,64020,Non-criminal,"Aided Case, Mental Disturbed",Monday,2013-08-19,16:45,Northern,Psychopathic Case,600 Block Of Eddy St,-122.418382008607,37.7832583770949
4036634506371,40366345,6371,Larceny/theft,Petty Theft Of Property,Tuesday,2004-03-30,14:00,Northern,None,1300 Block Of Webster St,-122.431046366089,37.7830295716044
7073027107023,70730271,7023,VehicleTheft,Stolen Motorcycle,Thursday,2007-07-19,16:00,Northern,None,"Myrtle St, Vanness Avenue",-122.421290401327,37.7852218287352
7098441265015,70984412,65015,OtherOffenses,Traffic Violation,Tuesday,2007-09-25,14:15,Mission,"Arrest, Cited","Folsom St, 23rd St",-122.414233849038,37.7540986882068
6088050706241,60880507,6241,Larceny/theft,Petty Theft From Locked Auto,Friday,2006-08-18,23:00,Southern,None,"10th St, Harrison St",-122.411279189969,37.7715785765043
3095379271000,30953792,71000,Non-criminal,Lost Property,Tuesday,2003-08-12,11:00,Park,None,"Haight St, Ashbury St",-122.446933310948,37.7700061988409
8018151762050,80181517,62050,Warrants,Enroute To Outside Jurisdiction,Wednesday,2008-02-20,15:01,Southern,"Arrest, Booked",100 Block Of 12th St,-122.417628311343,37.7719781799261
8138269363010,81382693,63010,Warrants,Warrant Arrest,Monday,2008-12-29,16:17,Tenderloin,"Arrest, Booked","Turk St, Hyde St",-122.415694922134,37.7825851968467
7122686315150,71226863,15150,OtherOffenses,Violation Of Restraining Order,Friday,2007-11-30,08:40,Bayview,"Arrest, Booked",2100 Block Of Quesada Avenue,-122.399852840312,37.7381735692778
7004057528160,70040575,28160,Vandalism,"Malicious Mischief, Vandalism Of Vehicles",Thursday,2007-01-11,20:43,Mission,"Arrest, Cited",2100 Block Of Market St,-122.430018655242,37.7668305229582
7038975916621,70389759,16621,Drug/narcotic,Possession Of Base/rock Cocaine,Tuesday,2007-04-17,00:42,Tenderloin,"Arrest, Booked",400 Block Of Jones St,-122.412758759499,37.7850960963726
10609885806244,106098858,6244,Larceny/theft,Grand Theft From Locked Auto,Saturday,2010-08-14,01:00,Southern,None,800 Block Of Bryant St,-122.403404791479,37.775420706711
6057625106374,60576251,6374,Larceny/theft,Grand Theft Of Property,Wednesday,2006-05-31,13:14,Mission,None,"15th St, Mission St",-122.419827929961,37.7666737551835
13066633265016,130666332,65016,OtherOffenses,"Drivers License, Suspended Or Revoked",Monday,2013-08-12,11:43,Northern,"Arrest, Cited","Mcallister St, Franklin St",-122.421893134467,37.779891233614
3010430926080,30104309,26080,OtherOffenses,Conspiracy,Sunday,2003-01-26,12:07,Mission,"Arrest, Booked","Mission St, Clarion Al",-122.419478247925,37.7630507677355
9109527816620,91095278,16620,Drug/narcotic,Possession Of Cocaine,Saturday,2009-10-24,02:00,Ingleside,"Arrest, Booked",800 Block Of Ellsworth St,-122.416446124049,37.7329162539537
3129664607041,31296646,7041,VehicleTheft,"Vehicle, Recovered, Auto",Thursday,2003-10-30,18:00,Northern,None,2000 Block Of Pacific Avenue,-122.429008299341,37.7941345374661
4064031527170,40640315,27170,OtherOffenses,Resisting Arrest,Friday,2004-06-04,11:27,Bayview,"Arrest, Booked",1200 Block Of Ingalls St,-122.381867300078,37.7305667976884
3022533107041,30225331,7041,VehicleTheft,"Vehicle, Recovered, Auto",Sunday,2003-02-23,18:00,Bayview,None,1600 Block Of La Salle Avenue,-122.389326010609,37.7367968411733
13026694807023,130266948,7023,VehicleTheft,Stolen Motorcycle,Friday,2013-03-29,18:00,Southern,None,1100 Block Of Harrison St,-122.406294801886,37.7754375717094
8106131471010,81061314,71010,OtherOffenses,Lost/stolen License Plate,Saturday,2008-10-04,15:00,Taraval,None,"Vicente St, Madrone Avenue",-122.467994811064,37.7400058184599
9101859305013,91018593,5013,Burglary,"Burglary Of Apartment House, Unlawful Entry",Friday,2009-10-02,08:45,Northern,None,1500 Block Of Filbert St,-122.425018759006,37.7994323347034
7115657730190,71156577,30190,OtherOffenses,Violation Of Municipal Police Code,Saturday,2007-11-10,23:06,Tenderloin,None,200 Block Of Jones St,-122.412436901867,37.7834857455601
11001002261030,110010022,61030,Non-criminal,"Death Report, Cause Unknown",Tuesday,2011-01-04,09:56,Tenderloin,None,600 Block Of Ofarrell St,-122.41533612902,37.7854364798696
9043917406244,90439174,6244,Larceny/theft,Grand Theft From Locked Auto,Monday,2009-04-27,12:00,Richmond,None,500 Block Of Johnfkennedy Dr,-122.466204667893,37.7725405391593
4140307907021,41403079,7021,VehicleTheft,Stolen Automobile,Friday,2004-12-10,13:30,Park,Unfounded,0 Block Of Museum Wy,-122.440219513694,37.7645174149932
9010057906244,90100579,6244,Larceny/theft,Grand Theft From Locked Auto,Tuesday,2009-01-27,18:00,Central,None,1100 Block Of Jones St,-122.414270420538,37.7918797836523
10035492104136,100354921,4136,Assault,Battery With Serious Injuries,Saturday,2010-04-17,01:00,Central,"Arrest, Booked",900 Block Of Sansome St,-122.402258143298,37.7989237331944
12041817103044,120418171,3044,Robbery,Robbery Of A Chain Store With Bodily Force,Saturday,2012-05-26,18:28,Mission,None,2800 Block Of Mission St,-122.418296094437,37.7514284856786
13052398609029,130523986,9029,OtherOffenses,False Personation To Receive Money Or Property,Thursday,2013-06-06,14:32,Richmond,None,4700 Block Of Geary Bl,-122.470190415901,37.7808757916602
7607510428160,76075104,28160,Vandalism,"Malicious Mischief, Vandalism Of Vehicles",Monday,2007-10-08,18:00,Richmond,None,"Scott St, Bush St",-122.438394869495,37.7863922340602
10015442007021,100154420,7021,VehicleTheft,Stolen Automobile,Monday,2010-02-15,22:30,Ingleside,None,"Geneva Av, Santos St",-122.420084075242,37.7083109744591
5142426906113,51424269,6113,Larceny/theft,Grand Theft Pickpocket,Friday,2005-12-09,23:59,Southern,Not Prosecuted,700 Block Of Harrison St,-122.397814506334,37.7821372491619
12031374768020,120313747,68020,OtherOffenses,Miscellaneous Investigation,Friday,2012-04-20,15:00,Park,None,"Scott St, Duboce Avenue",-122.434895339697,37.7691138797985
13027371161030,130273711,61030,Non-criminal,"Death Report, Cause Unknown",Wednesday,2013-04-03,20:51,Mission,None,1300 Block Of Natoma St,-122.418408871216,37.7675484464646
8070407863010,80704078,63010,Warrants,Warrant Arrest,Saturday,2008-08-16,08:20,Richmond,"Arrest, Booked",2800 Block Of Pine St,-122.44276443675,37.7868478510266
6087092812120,60870928,12120,WeaponLaws,Poss Of Prohibited Weapon,Wednesday,2006-08-16,18:20,Ingleside,"Arrest, Booked",800 Block Of Vienna St,-122.434157340729,37.7154003052762
9040489828165,90404898,28165,Vandalism,"Malicious Mischief, Graffiti",Friday,2009-04-17,21:00,Mission,None,4000 Block Of 25th St,-122.4306244966,37.7498410869216
13104274507023,131042745,7023,VehicleTheft,Stolen Motorcycle,Tuesday,2013-12-10,20:30,Park,None,"Broderick St, Mcallister St",-122.440030415903,37.7775861616294
8076998104144,80769981,4144,"SexOffenses,Forcible",Sexual Battery,Tuesday,2008-07-22,15:28,Park,None,"Geary Bl, Scott St",-122.437850882558,37.7837174333803
12089214972000,120892149,72000,Non-criminal,Found Property,Wednesday,2012-10-31,21:30,Park,None,0 Block Of Beaver St,-122.434303187888,37.7649375061603
9080713905011,90807139,5011,Burglary,"Burglary Of Apartment House, Forcible Entry",Saturday,2009-08-08,12:30,Bayview,None,900 Block Of Connecticut St,-122.397089183868,37.7535987880327
10112078564085,101120785,64085,SuspiciousOcc,Investigative Detention,Saturday,2010-12-04,23:37,Mission,Unfounded,"25th St, Bartlett St",-122.41940150486,37.7505727393139
7609335028150,76093350,28150,Vandalism,"Malicious Mischief, Vandalism",Tuesday,2007-12-18,20:00,Ingleside,None,900 Block Of Goettingen St,-122.403806102049,37.7204296602863
10117009716623,101170097,16623,Drug/narcotic,Possession Of Base/rock Cocaine For Sale,Monday,2010-12-20,19:35,Tenderloin,"Arrest, Booked","Taylor St, Turk St",-122.410768766343,37.7832145190013
8001593816030,80015938,16030,Drug/narcotic,Possession Of Marijuana For Sales,Saturday,2008-01-05,15:50,Tenderloin,"Arrest, Booked",0 Block Of Golden Gate Avenue,-122.411268613368,37.7822500873167
3010467263010,30104672,63010,Warrants,Warrant Arrest,Sunday,2003-01-26,14:02,Mission,"Arrest, Booked","Mission St, Clarion Al",-122.419478247925,37.7630507677355
4086368668020,40863686,68020,OtherOffenses,Miscellaneous Investigation,Thursday,2004-07-29,18:25,Tenderloin,None,"Leavenworth St, Ellis St",-122.41443315507,37.7846576329026
4136229304134,41362293,4134,Assault,Battery,Tuesday,2004-11-30,12:40,Bayview,None,1000 Block Of Griffith St,-122.378920771859,37.7286119710993
11001536762050,110015367,62050,Warrants,Enroute To Outside Jurisdiction,Wednesday,2011-01-05,19:30,Tenderloin,"Arrest, Booked",300 Block Of Ofarrell St,-122.410509258795,37.7860432222992
8104128106243,81041281,6243,Larceny/theft,Petty Theft From Locked Auto,Monday,2008-09-29,22:00,Richmond,None,200 Block Of Cabrillo St,-122.461211402689,37.7755465319382
5046924606241,50469246,6241,Larceny/theft,Petty Theft From Locked Auto,Sunday,2005-04-24,16:30,Northern,None,"Pine St, Polk St",-122.420497288797,37.789618819232
7087154627170,70871546,27170,OtherOffenses,Resisting Arrest,Sunday,2007-08-26,17:45,Richmond,"Arrest, Booked",4600 Block Of Geary Bl,-122.46909677255,37.7806744413446
13075939109029,130759391,9029,OtherOffenses,False Personation To Receive Money Or Property,Thursday,2013-02-14,12:00,Northern,None,1700 Block Of Post St,-122.430600096373,37.7855207172313
6079023565016,60790235,65016,OtherOffenses,"Drivers License, Suspended Or Revoked",Wednesday,2006-07-26,12:30,Mission,"Arrest, Cited",3400 Block Of 19th St,-122.420322490104,37.7602230009949
13044393627170,130443936,27170,OtherOffenses,Resisting Arrest,Wednesday,2013-05-29,19:40,Bayview,"Arrest, Cited","3rd St, Quesada Avenue",-122.391245623019,37.7332252032804
6130379407021,61303794,7021,VehicleTheft,Stolen Automobile,Friday,2006-12-08,07:30,Taraval,None,300 Block Of Capitol Avenue,-122.458960875728,37.713622689179
12618036619050,126180366,19050,OtherOffenses,Obscene Phone Calls(s),Monday,2012-11-12,12:00,Taraval,None,2400 Block Of Taraval St,-122.492308842341,37.7422640426131
13000544505023,130005445,5023,Burglary,"Burglary Of Flat, Unlawful Entry",Tuesday,2013-01-01,18:00,Park,None,1400 Block Of Masonic Avenue,-122.444575195779,37.7669229561406
5110383328160,51103833,28160,Vandalism,"Malicious Mischief, Vandalism Of Vehicles",Friday,2005-09-30,21:24,Central,"Arrest, Booked",600 Block Of Lombard St,-122.41223801742,37.8029830783987
12608920728150,126089207,28150,Vandalism,"Malicious Mischief, Vandalism",Sunday,2012-06-03,13:15,Southern,None,"3rd St, Channel St",-122.389898139551,37.7748981937461
3093799016010,30937990,16010,Drug/narcotic,Possession Of Marijuana,Friday,2003-08-08,19:10,Mission,"Arrest, Cited",3000 Block Of Folsom St,-122.413815960156,37.7490562879444
8026799161030,80267991,61030,Non-criminal,"Death Report, Cause Unknown",Thursday,2008-03-13,06:00,Northern,None,2000 Block Of Sutter St,-122.434099467089,37.7859245785653
13093826628160,130938266,28160,Vandalism,"Malicious Mischief, Vandalism Of Vehicles",Wednesday,2013-06-26,05:20,Bayview,None,2000 Block Of Marin St,-122.395112246474,37.7484992386192
11076368562020,110763685,62020,Warrants,Enroute To Department Of Corrections,Thursday,2011-09-22,09:24,Taraval,"Arrest, Booked",2600 Block Of 47th Avenue,-122.505326526722,37.7375390051116
6114544904134,61145449,4134,Assault,Battery,Thursday,2006-10-26,18:30,Mission,None,"24th St, Potrero Avenue",-122.406338412685,37.7530042877223
12068921915200,120689219,15200,SecondaryCodes,Domestic Violence,Wednesday,2012-08-29,11:00,Southern,"Arrest, Booked",200 Block Of Interstate80 Hy,-122.365565425353,37.8096707013239
5125223606373,51252236,6373,Larceny/theft,Petty Theft Of Property,Saturday,2005-11-05,14:30,Taraval,Unfounded,100 Block Of Cambon Dr,-122.474308079894,37.7166425332691
7129660610125,71296606,10125,Fraud,"False Pretenses, Grand Theft",Thursday,2007-11-29,00:01,Bayview,None,1600 Block Of Shafter Avenue,-122.39123221352,37.7313908777775
11009398706223,110093987,6223,Larceny/theft,Petty Theft From Unlocked Auto,Sunday,2011-01-30,11:30,Park,None,200 Block Of Cole St,-122.450946799274,37.7728240617204
3149820662050,31498206,62050,Warrants,Enroute To Outside Jurisdiction,Saturday,2003-12-27,02:27,Southern,"Arrest, Booked","6th St, Market St",-122.410293519697,37.7822305869807
10611591371000,106115913,71000,Non-criminal,Lost Property,Monday,2010-09-13,12:30,Tenderloin,None,"Mcallister St, Hyde St",-122.415317966992,37.7807179285998
9057198605153,90571986,5153,Burglary,"Burglary,store Under Construction, Unlawful Entry",Wednesday,2009-06-03,13:30,Southern,"Arrest, Booked",800 Block Of Howard St,-122.403793259489,37.7823235897616
5006686413060,50066864,13060,Prostitution,Solicits For Act Of Prostitution,Tuesday,2005-01-18,18:25,Mission,"Arrest, Cited","17th St, Shotwell St",-122.416230392551,37.7636337703031
12038049526080,120380495,26080,OtherOffenses,Conspiracy,Sunday,2012-05-13,16:00,Southern,"Arrest, Booked",100 Block Of 6th St,-122.407975093043,37.7803099082814
6111026071000,61110260,71000,Non-criminal,Lost Property,Saturday,2006-10-14,23:00,Central,None,"Broadway St, Montgomery St",-122.403864541976,37.7982226437427
7030230375000,70302303,75000,MissingPerson,Found Person,Friday,2007-03-23,16:46,Taraval,Located,500 Block Of Holloway Avenue,-122.458703350333,37.7217839385443
5094098906372,50940989,6372,Larceny/theft,Petty Theft Of Property,Saturday,2005-08-20,09:00,Southern,None,1000 Block Of Howard St,-122.408520791815,37.7785853155801
4025764706240,40257647,6240,Larceny/theft,Attempted Theft From Locked Vehicle,Wednesday,2004-03-03,17:00,Taraval,None,600 Block Of Gonzalez Dr,-122.479569649871,37.7166761383442
