id,incident_number,incident_code,category,descript,day_of_the_week,date,time,police_dept_district,resolution,address,location_x_axis,location_y_axis
4013359228160,40133592,28160,Vandalism,"Malicious Mischief, Vandalism Of Vehicles",Tuesday,2004-01-20,00:01,Ingleside,None,0 Block Of Phelan Avenue,-122.452289660492,37.7256933575703
7096130704134,70961307,4134,Assault,Battery,Wednesday,2007-09-19,09:45,Tenderloin,"Arrest, Cited",0 Block Of Unitednations Pz,-122.41431222924,37.7798339183587
4081670465016,40816704,65016,OtherOffenses,"Drivers License, Suspended Or Revoked",Saturday,2004-07-17,21:10,Richmond,"Arrest, Cited","36th Av, Fulton St",-122.495970857242,37.7720291662998
12042005706372,120420057,6372,Larceny/theft,Petty Theft Of Property,Sunday,2012-05-27,14:50,Tenderloin,"Arrest, Cited",200 Block Of Turk St,-122.413259498719,37.7829514828801
6057025306304,60570253,6304,Larceny/theft,Grand Theft From A Building,Monday,2006-05-29,23:08,Northern,None,1800 Block Of Vanness Avenue,-122.42261368279,37.7926430342855
12014632206224,120146322,6224,Larceny/theft,Grand Theft From Unlocked Auto,Monday,2012-02-20,21:30,Taraval,None,1200 Block Of La Playa St,-122.509265276857,37.7630727687234
7061977228150,70619772,28150,Vandalism,"Malicious Mischief, Vandalism",Tuesday,2007-06-19,17:00,Mission,None,2700 Block Of Harrison St,-122.412041125438,37.7534100942238
8011842907025,80118429,7025,VehicleTheft,Stolen Truck,Saturday,2008-02-02,14:30,Northern,None,2300 Block Of Filbert St,-122.438151842824,37.7976507711152
8052633303041,80526333,3041,Robbery,Robbery Of A Chain Store With A Gun,Tuesday,2008-05-20,01:50,Ingleside,None,2200 Block Of Bay Shore Bl,-122.402961324239,37.7121195039057
10612644306233,106126443,6233,Larceny/theft,Petty Theft Auto Strip,Tuesday,2010-10-05,17:00,Ingleside,None,1100 Block Of Russia Avenue,-122.42799952496,37.7171377229625
11042108715200,110421087,15200,SecondaryCodes,Domestic Violence,Wednesday,2011-05-25,01:55,Taraval,None,200 Block Of Plymouth Avenue,-122.456118450392,37.7127646038059
9106278805011,91062788,5011,Burglary,"Burglary Of Apartment House, Forcible Entry",Tuesday,2009-10-13,08:00,Northern,None,1600 Block Of Filbert St,-122.426640231782,37.7991149405556
3092588207055,30925882,7055,VehicleTheft,Recovered Vehicle - Stolen Outside Sf,Wednesday,2003-08-06,20:03,Southern,None,900 Block Of Market St,-122.409708423721,37.7828276498838
5003878806244,50038788,6244,Larceny/theft,Grand Theft From Locked Auto,Monday,2005-01-10,13:15,Central,None,"Clay St, Davis St",-122.397977877054,37.7953124363788
12076913406151,120769134,6151,Larceny/theft,Grand Theft From Person,Wednesday,2012-09-12,22:00,Central,None,"Pine St, Kearny St",-122.404223195649,37.7916902259131
11094662175030,110946621,75030,Non-criminal,Case Closure,Wednesday,2011-11-23,18:00,Ingleside,Located,100 Block Of Persia Avenue,-122.434764286692,37.7226161363136
11038561507021,110385615,7021,VehicleTheft,Stolen Automobile,Wednesday,2011-05-11,19:00,Taraval,None,1400 Block Of Sloat Bl,-122.487466203334,37.7343252101966
4046336171000,40463361,71000,Non-criminal,Lost Property,Friday,2004-04-09,19:00,Southern,None,1100 Block Of Folsom St,-122.409845783196,37.7752407085662
4088628071000,40886280,71000,Non-criminal,Lost Property,Wednesday,2004-08-04,12:00,Southern,None,800 Block Of Bryant St,-122.403404791479,37.775420706711
5005492206244,50054922,6244,Larceny/theft,Grand Theft From Locked Auto,Saturday,2005-01-15,00:30,Southern,None,"6th St, Jessie St",-122.409247675554,37.7813987340663
13097118165015,130971181,65015,OtherOffenses,Traffic Violation,Saturday,2013-11-16,09:25,Central,"Arrest, Cited","California St, Hyde St",-122.417392830334,37.7909741243591
9089041328150,90890413,28150,Vandalism,"Malicious Mischief, Vandalism",Saturday,2009-08-29,22:15,Mission,None,2900 Block Of 20th St,-122.410279093551,37.7592181770051
7053966904134,70539669,4134,Assault,Battery,Sunday,2007-05-27,23:00,Park,None,0 Block Of Crestline Dr,-122.446483988175,37.7501301863303
5063228305012,50632283,5012,Burglary,"Burglary Of Apartment House, Att Forcible Entry",Monday,2005-06-06,12:25,Northern,"Arrest, Booked",300 Block Of Oak St,-122.425018205965,37.774655409686
10094770864085,100947708,64085,SuspiciousOcc,Investigative Detention,Monday,2010-10-11,23:47,Tenderloin,"Arrest, Booked","Leavenworth St, Ellis St",-122.414433155063,37.7846576329256
3106277619057,31062776,19057,Assault,Threats Against Life,Monday,2003-09-08,22:40,Bayview,"Arrest, Booked",1000 Block Of Griffith St,-122.378920771859,37.7286119710993
11025829413075,110258294,13075,Prostitution,Loitering For Purpose Of Prostitution,Wednesday,2011-03-30,03:30,Northern,"Arrest, Booked","Sacramento St, Vanness Avenue",-122.422516966616,37.7912889898479
6027461506244,60274615,6244,Larceny/theft,Grand Theft From Locked Auto,Monday,2006-03-13,09:00,Bayview,None,300 Block Of Peninsula Avenue,-122.399313057866,37.7111410548779
12093286406361,120932864,6361,Larceny/theft,Petty Theft Shoplifting,Saturday,2012-11-17,21:45,Tenderloin,"Arrest, Cited",0 Block Of Ofarrell St,-122.405895369887,37.7867342184983
4089877419090,40898774,19090,Drunkenness,Under Influence Of Alcohol In A Public Place,Saturday,2004-08-07,12:41,Park,"Arrest, Cited","Oak St, Divisadero St",-122.437422446071,37.773132331609
13071521828092,130715218,28092,Vandalism,"Malicious Mischief, Adult Suspect",Tuesday,2013-08-27,11:30,Bayview,None,0 Block Of Connecticut St,-122.397730190804,37.7657125554895
9102302506241,91023025,6241,Larceny/theft,Petty Theft From Locked Auto,Saturday,2009-10-03,22:30,Mission,None,100 Block Of Capp St,-122.418687919804,37.7642753857061
6051235228150,60512352,28150,Vandalism,"Malicious Mischief, Vandalism",Sunday,2006-05-14,13:20,Taraval,None,3000 Block Of San Jose Avenue,-122.457441212767,37.7098427794823
7102644761030,71026447,61030,Non-criminal,"Death Report, Cause Unknown",Tuesday,2007-10-02,00:01,Tenderloin,None,200 Block Of Ofarrell St,-122.409155386902,37.7863245885511
9056493171000,90564931,71000,Non-criminal,Lost Property,Thursday,2009-05-28,18:30,Mission,None,500 Block Of Castro St,-122.434856780211,37.7600777053137
8054158507025,80541585,7025,VehicleTheft,Stolen Truck,Thursday,2008-05-22,04:00,Bayview,None,"Jennings St, Egbert Avenue",-122.392612471936,37.7226578217429
11083028416710,110830284,16710,Drug/narcotic,Possession Of Narcotics Paraphernalia,Friday,2011-10-14,21:57,Tenderloin,"Arrest, Booked","Ofarrell St, Jones St",-122.412970537591,37.7857883766888
7038027472000,70380274,72000,Non-criminal,Found Property,Saturday,2007-04-14,10:00,Northern,Unfounded,"Laguna St, Hayes St",-122.426265334521,37.7764631429143
4102911407023,41029114,7023,VehicleTheft,Stolen Motorcycle,Wednesday,2004-09-08,00:30,Southern,None,200 Block Of Mission St,-122.395336395079,37.7914518970007
10606641319050,106066413,19050,OtherOffenses,Obscene Phone Calls(s),Thursday,2010-06-03,09:00,Richmond,None,3700 Block Of California St,-122.455468425157,37.786210973675
6006330528160,60063305,28160,Vandalism,"Malicious Mischief, Vandalism Of Vehicles",Tuesday,2006-01-17,09:00,Richmond,None,"9th Av, Lincoln Wy",-122.466442684206,37.7659245297691
4053691806242,40536918,6242,Larceny/theft,Petty Theft From Locked Auto,Monday,2004-05-10,00:01,Northern,None,600 Block Of Hayes St,-122.427093375316,37.7763027391045
13067616509015,130676165,9015,Forgery/counterfeiting,"Checks, Forgery (felony)",Thursday,2013-08-15,11:15,Southern,"Arrest, Booked",1200 Block Of Market St,-122.415444159886,37.7780245674641
3109385671010,31093856,71010,OtherOffenses,Lost/stolen License Plate,Wednesday,2003-09-03,10:00,Northern,None,200 Block Of Linden St,-122.422063908477,37.776464538712
9040158716625,90401587,16625,Drug/narcotic,Sale Of Base/rock Cocaine,Friday,2009-04-17,15:30,Tenderloin,"Arrest, Booked",300 Block Of Ellis St,-122.411987643595,37.7850226622786
3007963319057,30079633,19057,Assault,Threats Against Life,Monday,2003-01-20,18:00,Ingleside,"Arrest, Booked",700 Block Of Huron Avenue,-122.450450654907,37.7114481484715
8037843512026,80378435,12026,WeaponLaws,Discharge Firearm At An Inhabited Dwelling,Friday,2008-04-11,16:00,Ingleside,"Arrest, Booked",500 Block Of Precita Avenue,-122.410106428722,37.7472418497075
4104211616010,41042116,16010,Drug/narcotic,Possession Of Marijuana,Sunday,2004-09-12,00:32,Park,"Arrest, Cited","Haight St, Shrader St",-122.451864552609,37.7693505381832
8132158806364,81321588,6364,Larceny/theft,Grand Theft Shoplifting,Thursday,2008-12-11,11:45,Park,None,1500 Block Of Haight St,-122.447783070559,37.7699549503465
4076461451040,40764614,51040,Non-criminal,Aided Case,Monday,2004-07-05,10:00,Taraval,None,0 Block Of Crestlake Dr,-122.481966197212,37.7353747086517
13010770605013,130107706,5013,Burglary,"Burglary Of Apartment House, Unlawful Entry",Wednesday,2013-02-06,14:45,Ingleside,None,0 Block Of Nebraska St,-122.410368304793,37.7405512092776
13023353364070,130233533,64070,SuspiciousOcc,Suspicious Occurrence,Wednesday,2013-03-20,12:00,Central,None,600 Block Of Sacramento St,-122.403475873145,37.793658838097
9094967865050,90949678,65050,DrivingUnderTheInfluence,Driving While Under The Influence Of Alcohol,Tuesday,2009-09-15,01:58,Central,"Arrest, Booked","Taylor St, Clay St",-122.412831700656,37.7934325179771
13615377371000,136153773,71000,Non-criminal,Lost Property,Saturday,2013-08-24,15:00,Southern,None,0 Block Of Newmontgomery St,-122.401817240144,37.788440503956
10010402702004,100104027,2004,"SexOffenses,Forcible","Forcible Rape, Bodily Force",Sunday,2010-01-24,02:30,Southern,Complainant Refuses To Prosecute,800 Block Of Bryant St,-122.403404791479,37.775420706711
6098970115200,60989701,15200,SecondaryCodes,Domestic Violence,Saturday,2006-09-16,06:00,Central,None,1000 Block Of Pine St,-122.413095913657,37.790511704938
4131232307041,41312323,7041,VehicleTheft,"Vehicle, Recovered, Auto",Tuesday,2004-11-16,22:30,Park,None,"Pierce St, Golden Gate Avenue",-122.435243139473,37.7791426902851
9078468404134,90784684,4134,Assault,Battery,Sunday,2009-08-02,17:30,Tenderloin,None,600 Block Of Ellis St,-122.416916142188,37.7843944492068
7604678528160,76046785,28160,Vandalism,"Malicious Mischief, Vandalism Of Vehicles",Monday,2007-07-02,08:30,Southern,None,200 Block Of 3rd St,-122.399899436982,37.7846480308387
8113432506371,81134325,6371,Larceny/theft,Petty Theft Of Property,Saturday,2008-10-04,23:00,Southern,None,100 Block Of 6th St,-122.408368579345,37.7807784253732
8093097265016,80930972,65016,OtherOffenses,"Drivers License, Suspended Or Revoked",Wednesday,2008-09-03,08:45,Southern,"Arrest, Cited","Market St, 6th St",-122.41029351969,37.7822305870036
6129842468020,61298424,68020,OtherOffenses,Miscellaneous Investigation,Wednesday,2006-12-06,12:30,Southern,None,0 Block Of South Van Ness Avenue,-122.418338317697,37.7726641818375
8104017006302,81040170,6302,Larceny/theft,Petty Theft From A Building,Friday,2008-09-26,19:30,Northern,None,100 Block Of Church St,-122.429080297019,37.7681979747465
13057960064020,130579600,64020,Non-criminal,"Aided Case, Mental Disturbed",Sunday,2013-07-14,18:22,Central,None,700 Block Of Lombard St,-122.414281956238,37.8027274038473
11005858365016,110058583,65016,OtherOffenses,"Drivers License, Suspended Or Revoked",Wednesday,2011-01-19,18:15,Southern,"Arrest, Cited",800 Block Of Bryant St,-122.403404791479,37.775420706711
3000633506244,30006335,6244,Larceny/theft,Grand Theft From Locked Auto,Wednesday,2003-01-01,16:00,Southern,None,"5th St, Brannan St",-122.398758596971,37.7765687697201
3043796219057,30437962,19057,Assault,Threats Against Life,Wednesday,2003-06-18,10:15,Southern,District Attorney Refuses To Prosecute,800 Block Of Bryant St,-122.403404791479,37.775420706711
6029405504134,60294055,4134,Assault,Battery,Saturday,2006-03-18,01:58,Central,"Arrest, Cited","Jasper Pl, Green St",-122.408171756664,37.7996006402304
10091926804134,100919268,4134,Assault,Battery,Sunday,2010-10-03,15:46,Northern,None,1000 Block Of Polk St,-122.419858277339,37.786137125238
11068720105071,110687201,5071,Burglary,"Burglary, Forcible Entry",Saturday,2011-08-27,06:08,Southern,None,900 Block Of Brannan St,-122.406277073987,37.7707000250114
5142175406244,51421754,6244,Larceny/theft,Grand Theft From Locked Auto,Friday,2005-12-16,22:00,Northern,None,"Geary Bl, Franklin St",-122.423031175095,37.785481874719
10603054306374,106030543,6374,Larceny/theft,Grand Theft Of Property,Saturday,2010-03-06,23:30,Northern,None,300 Block Of Vanness Avenue,-122.419916164613,37.7791854168673
11086928311016,110869283,11016,StolenProperty,"Stolen Electronics, Possession",Friday,2011-10-28,10:00,Mission,None,600 Block Of Valencia St,-122.421747650463,37.7627436601147
6131415506244,61314155,6244,Larceny/theft,Grand Theft From Locked Auto,Monday,2006-12-11,08:30,Ingleside,None,"Geneva Av, Delano Avenue",-122.44512779465,37.7200882952758
11054334665015,110543346,65015,OtherOffenses,Traffic Violation,Wednesday,2011-07-06,20:00,Ingleside,"Arrest, Cited","Mission St, Onondaga Avenue",-122.437461502349,37.7211650807414
3112308364070,31123083,64070,SuspiciousOcc,Suspicious Occurrence,Tuesday,2003-09-23,13:12,Tenderloin,None,0 Block Of Taylor St,-122.41055128181,37.7825025590102
12073786864001,120737868,64001,Non-criminal,"Civil Sidewalks, Warning",Friday,2012-09-14,14:34,Park,None,500 Block Of Ashbury St,-122.447094754103,37.7704534612349
11077004462030,110770044,62030,Warrants,Enroute To Parole Officer,Saturday,2011-09-24,10:31,Tenderloin,"Arrest, Booked","Turk St, Jones St",-122.412414263581,37.7830037964534
4017421709320,40174217,9320,Fraud,"Credit Card, Theft By Use Of",Wednesday,2003-10-01,12:00,Taraval,None,1200 Block Of 22nd Avenue,-122.480332622274,37.764348152351
8119109612100,81191096,12100,WeaponLaws,Poss Of Loaded Firearm,Friday,2008-11-07,09:31,Bayview,"Arrest, Booked",0 Block Of Hudson Ct,-122.379213826356,37.732368620468
11048758464070,110487584,64070,SuspiciousOcc,Suspicious Occurrence,Wednesday,2011-06-08,11:00,Northern,None,2000 Block Of Sutter St,-122.434099467089,37.7859245785653
9117891565015,91178915,65015,OtherOffenses,Traffic Violation,Monday,2009-11-16,07:20,Southern,None,800 Block Of Mission St,-122.405395493939,37.7835100715421
6059070671000,60590706,71000,Non-criminal,Lost Property,Saturday,2006-06-03,13:00,Taraval,None,0 Block Of Miramar Avenue,-122.458239351566,37.719146228206
9079740565016,90797405,65016,OtherOffenses,"Drivers License, Suspended Or Revoked",Thursday,2009-08-06,00:05,Ingleside,"Arrest, Cited","Persia Av, Ocean Avenue",-122.436447441054,37.7237886108944
9012571565016,90125715,65016,OtherOffenses,"Drivers License, Suspended Or Revoked",Tuesday,2009-02-03,23:10,Park,"Arrest, Cited","Ofarrell St, Broderick St",-122.440965273247,37.782237801679
7046388607055,70463886,7055,RecoveredVehicle,Recovered Vehicle - Stolen Outside Sf,Sunday,2007-05-06,22:45,Southern,None,300 Block Of 5th St,-122.402046531292,37.7792723524232
13010042165016,130100421,65016,OtherOffenses,"Drivers License, Suspended Or Revoked",Monday,2013-02-04,15:45,Southern,"Arrest, Cited",800 Block Of Bryant St,-122.403404791479,37.775420706711
10095542213075,100955422,13075,Prostitution,Loitering For Purpose Of Prostitution,Thursday,2010-10-14,03:48,Northern,"Arrest, Cited","Cedar St, Polk St",-122.419834938618,37.7863580362743
4065324926031,40653249,26031,Arson,Arson Of A Vehicle,Tuesday,2004-06-08,02:40,Richmond,None,500 Block Of John F Kennedy Dr,-122.466204667893,37.7725405391593
12000576206361,120005762,6361,Larceny/theft,Petty Theft Shoplifting,Tuesday,2012-01-03,10:20,Richmond,None,800 Block Of La Playa St,-122.509895418239,37.7723131976814
5000793706304,50007937,6304,Larceny/theft,Grand Theft From A Building,Saturday,2005-01-01,01:30,Northern,None,1600 Block Of Post St,-122.428969462908,37.7856179045546
6600861006374,66008610,6374,Larceny/theft,Grand Theft Of Property,Saturday,2006-01-07,07:50,Northern,None,"Fillmore St, Haight St",-122.430436523474,37.7721069661669
4035834262050,40358342,62050,Warrants,Enroute To Outside Jurisdiction,Sunday,2004-03-28,20:03,Bayview,"Arrest, Booked","22nd St, Illinois St",-122.387316279476,37.7580021664629
12089710504013,120897105,4013,Assault,Aggravated Assault With A Deadly Weapon,Monday,2012-11-05,22:45,Central,None,300 Block Of The Embarcaderonorth St,-122.39670853026,37.7978728855933
3051270228150,30512702,28150,Vandalism,"Malicious Mischief, Vandalism",Friday,2003-05-02,23:49,Park,None,0 Block Of Dellbrook Avenue,-122.454170280228,37.7495984464655
7090782809130,70907828,9130,Forgery/counterfeiting,"Forgery, False Entries In Records Or Returns",Wednesday,2007-08-29,00:01,Southern,None,500 Block Of 7th St,-122.403912950405,37.773693038909
13107077416710,131070774,16710,Drug/narcotic,Possession Of Narcotics Paraphernalia,Friday,2013-12-20,23:03,Mission,"Arrest, Booked",1800 Block Of Mission St,-122.419832890144,37.7674625261825
10014556019060,100145560,19060,Loitering,Obstructing Public Thoroughfare,Saturday,2010-02-13,07:37,Tenderloin,"Arrest, Cited",500 Block Of Jones St,-122.413135715743,37.7862599043196
10084178016100,100841780,16100,Drug/narcotic,Possession Of Heroin,Saturday,2010-09-11,15:45,Tenderloin,None,"Turk St, Leavenworth St",-122.414056291891,37.7827931071006
4057448513060,40574485,13060,Prostitution,Solicits For Act Of Prostitution,Wednesday,2004-05-19,21:55,Northern,"Arrest, Cited","Larkin St, Frank Norris St",-122.418753392735,37.7893752668397
5135209664020,51352096,64020,Non-criminal,"Aided Case, Mental Disturbed",Wednesday,2005-11-30,21:35,Mission,Psychopathic Case,"Hancock St, Noe St",-122.432715763681,37.7602221178908
8106873064070,81068730,64070,SuspiciousOcc,Suspicious Occurrence,Sunday,2008-07-13,00:01,Southern,None,1400 Block Of Folsom St,-122.413674391078,37.7720641658687
7023458071000,70234580,71000,Non-criminal,Lost Property,Saturday,2007-01-06,21:00,Bayview,None,"Keith St, Thomas Avenue",-122.389421299039,37.7293538492444
5048455116625,50484551,16625,Drug/narcotic,Sale Of Base/rock Cocaine,Sunday,2005-05-01,23:16,Tenderloin,"Arrest, Booked",100 Block Of Taylor St,-122.410791677645,37.7836952269749
3136685705043,31366857,5043,Burglary,"Burglary Of Residence, Unlawful Entry",Friday,2003-11-14,12:00,Ingleside,None,0 Block Of Ellsworth St,-122.414341026107,37.7419923166147
7052105813060,70521058,13060,Prostitution,Solicits For Act Of Prostitution,Tuesday,2007-05-22,22:15,Central,"Arrest, Cited","Post St, Larkin St",-122.41827417166,37.7870372043685
10087524075000,100875240,75000,MissingPerson,Found Person,Tuesday,2010-09-21,07:35,Mission,"Arrest, Booked",100 Block Of Capp St,-122.418549940195,37.7642837095036
4098701006243,40987010,6243,Larceny/theft,Petty Theft From Locked Auto,Saturday,2004-08-28,23:00,Richmond,None,3700 Block Of Sacramento St,-122.454419510878,37.7871843201568
4067326915150,40673269,15150,OtherOffenses,Violation Of Restraining Order,Saturday,2004-06-12,08:20,Central,None,800 Block Of Bush St,-122.411281399822,37.7898978570344
3112522730190,31125227,30190,OtherOffenses,Violation Of Municipal Police Code,Tuesday,2003-09-23,18:38,Mission,None,"Osage St, 25th St",-122.418862681565,37.7506062364011
6045931204013,60459312,4013,Assault,Aggravated Assault With A Deadly Weapon,Saturday,2006-04-29,22:00,Taraval,None,300 Block Of Sloat Bl,-122.476112101091,37.734780118103
10097661616110,100976616,16110,Drug/narcotic,Possession Of Heroin For Sales,Wednesday,2010-10-20,17:42,Tenderloin,"Arrest, Booked",200 Block Of Leavenworth St,-122.414217804322,37.7832593295025
6117902804134,61179028,4134,Assault,Battery,Friday,2006-11-03,22:36,Bayview,District Attorney Refuses To Prosecute,200 Block Of Holyoke St,-122.409346430586,37.7281149411497
11042137209015,110421372,9015,Forgery/counterfeiting,"Checks, Forgery (felony)",Wednesday,2011-04-27,13:00,Southern,None,900 Block Of Market St,-122.409708423721,37.7828276498838
10108965863010,101089658,63010,Warrants,Warrant Arrest,Wednesday,2010-11-24,11:45,Southern,"Arrest, Booked",300 Block Of 7th St,-122.406841835314,37.7758712904252
10063127404134,100631274,4134,Assault,Battery,Saturday,2010-07-10,01:35,Central,None,700 Block Of Sutter St,-122.412718544555,37.7886466255672
10034286371010,100342863,71010,OtherOffenses,Lost/stolen License Plate,Saturday,2010-04-10,20:30,Ingleside,None,"Cayuga Av, Geneva Avenue",-122.443696904615,37.718927976006
3022468405011,30224684,5011,Burglary,"Burglary Of Apartment House, Forcible Entry",Saturday,2003-02-22,17:00,Mission,None,300 Block Of Church St,-122.428671666207,37.7653073801622
7006733114020,70067331,14020,OtherOffenses,Failure To Register As Sex Offender,Friday,2007-01-19,09:54,Ingleside,"Arrest, Booked",0 Block Of Phelan Avenue,-122.452289660492,37.7256933575703
5094053106244,50940531,6244,Larceny/theft,Grand Theft From Locked Auto,Friday,2005-08-19,23:30,Southern,None,"Tehama St, 2nd St",-122.397707023375,37.7863399427411
13033192706244,130331927,6244,Larceny/theft,Grand Theft From Locked Auto,Tuesday,2013-04-23,12:00,Richmond,None,"Johnfkennedy Dr, Chainoflakes Dr",-122.500458705939,37.7681540346442
10100634571000,101006345,71000,Non-criminal,Lost Property,Friday,2010-10-29,14:00,Northern,None,"Fillmore St, Geary Bl",-122.432914603494,37.7843533426568
7088298565016,70882985,65016,OtherOffenses,"Drivers License, Suspended Or Revoked",Wednesday,2007-08-29,13:30,Taraval,"Arrest, Cited",1500 Block Of Sloat Bl,-122.489713969124,37.7339497680852
11025426403414,110254264,3414,Robbery,Attempted Robbery On The Street With Bodily Force,Monday,2011-03-28,18:00,Southern,"Arrest, Booked",1000 Block Of Market St,-122.411339562557,37.7812707434494
6105885871000,61058858,71000,Non-criminal,Lost Property,Thursday,2006-09-14,10:00,Southern,None,800 Block Of Bryant St,-122.403404791479,37.775420706711
12069195707021,120691957,7021,VehicleTheft,Stolen Automobile,Thursday,2012-08-30,06:00,Bayview,None,1700 Block Of Palou Avenue,-122.393696918834,37.7356272735926
9085044565016,90850445,65016,OtherOffenses,"Drivers License, Suspended Or Revoked",Wednesday,2009-08-19,23:34,Southern,"Arrest, Cited","6th St, Mission St",-122.408710606663,37.7809706722053
3133088027065,31330880,27065,Fraud,False Id To Peace Officer,Wednesday,2003-11-12,16:00,Taraval,"Arrest, Booked",3200 Block Of 20th Avenue,-122.475647460786,37.7285280627465
12086881106153,120868811,6153,Larceny/theft,Grand Theft From Person,Sunday,2012-10-28,03:00,Southern,None,800 Block Of Howard St,-122.403890955445,37.7824014072132
3068995328160,30689953,28160,Vandalism,"Malicious Mischief, Vandalism Of Vehicles",Thursday,2003-06-05,20:00,Taraval,None,2000 Block Of 44th Avenue,-122.502866729411,37.748381236261
12002436409164,120024364,9164,Fraud,"Access Card Information, Theft Of",Sunday,2012-01-08,00:01,Southern,None,0 Block Of Perry St,-122.396167865037,37.7827239702919
10601463871000,106014638,71000,Non-criminal,Lost Property,Sunday,2010-01-24,23:00,Northern,None,400 Block Of Polk St,-122.41882689472,37.7809952160597
5078088207025,50780882,7025,VehicleTheft,Stolen Truck,Wednesday,2005-07-13,08:00,Northern,None,1800 Block Of Polk St,-122.421250454707,37.7937178972146
5119153762050,51191537,62050,Warrants,Enroute To Outside Jurisdiction,Friday,2005-10-21,18:50,Southern,"Arrest, Booked",0 Block Of Sherman St,-122.405924386123,37.7766015774052
8134210806242,81342108,6242,Larceny/theft,Petty Theft From Locked Auto,Sunday,2008-12-07,12:30,Bayview,None,600 Block Of Jamestown Avenue,-122.387833652325,37.7131072321423
12049901871000,120499018,71000,Non-criminal,Lost Property,Sunday,2012-06-24,13:45,Southern,None,"Market St, 5th St",-122.408068345148,37.7839916768161
12072684904138,120726849,4138,Assault,"Battery, Former Spouse Or Dating Relationship",Monday,2012-09-10,22:45,Ingleside,"Arrest, Booked",600 Block Of Moultrie St,-122.415941119804,37.7366082931288
8049483704134,80494837,4134,Assault,Battery,Sunday,2008-05-11,01:45,Central,None,300 Block Of Columbus Avenue,-122.406842913454,37.7980587205991
8608180606244,86081806,6244,Larceny/theft,Grand Theft From Locked Auto,Sunday,2008-11-09,18:30,Southern,None,"Folsom St, Rodgers St",-122.40948237086,37.7754506238157
13608711606244,136087116,6244,Larceny/theft,Grand Theft From Locked Auto,Thursday,2013-05-16,22:00,Bayview,None,1000 Block Of Connecticut St,-122.397201937993,37.7535351242762
3078911107100,30789111,7100,VehicleTheft,Tampering With A Vehicle,Tuesday,2003-07-01,23:00,Taraval,None,100 Block Of Broadmoor Dr,-122.473364181282,37.7261170773812
5005864507041,50058645,7041,VehicleTheft,"Vehicle, Recovered, Auto",Saturday,2005-01-15,12:00,Taraval,None,1600 Block Of 22nd Avenue,-122.479948981848,37.7568750834085
12053256107021,120532561,7021,VehicleTheft,Stolen Automobile,Thursday,2012-07-05,18:30,Ingleside,None,300 Block Of 29th St,-122.427792484689,37.7435764123767
7018786028165,70187860,28165,Vandalism,"Malicious Mischief, Graffiti",Friday,2007-02-16,17:00,Park,None,1000 Block Of Fulton St,-122.434046062672,37.777329275022
13041371314020,130413713,14020,OtherOffenses,Failure To Register As Sex Offender,Monday,2013-05-20,02:00,Northern,"Arrest, Booked","Laguna St, Lombard St",-122.431118543788,37.8004687042875
3046107427195,30461074,27195,Trespass,Trespassing,Saturday,2003-04-19,16:13,Park,"Arrest, Cited",2000 Block Of Ofarrell St,-122.438885953102,37.7825586616359
10094823904134,100948239,4134,Assault,Battery,Tuesday,2010-10-12,08:55,Bayview,"Arrest, Cited",1400 Block Of Yosemite Avenue,-122.388923737371,37.7252253304287
3010432162020,30104321,62020,Warrants,Enroute To Department Of Corrections,Sunday,2003-01-26,12:08,Mission,"Arrest, Booked",1000 Block Of Potrero Avenue,-122.406539115148,37.7564864109309
9121221204134,91212212,4134,Assault,Battery,Tuesday,2009-11-24,12:00,Northern,None,2100 Block Of Franklin St,-122.424853069042,37.7941664311147
8091618207021,80916182,7021,VehicleTheft,Stolen Automobile,Friday,2008-08-29,19:30,Northern,None,2200 Block Of Lombard St,-122.43850831913,37.7994111027248
