id,incident_number,incident_code,category,descript,day_of_the_week,date,time,police_dept_district,resolution,address,location_x_axis,location_y_axis
13007467262050,130074672,62050,Warrants,Enroute To Outside Jurisdiction,Saturday,2013-01-26,22:35,Northern,"Arrest, Booked",1000 Block Of Larkin St,-122.418346670325,37.7877356891018
13104121407200,131041214,7200,OtherOffenses,False Evidence Of Vehicle Registration,Tuesday,2013-12-10,23:48,Bayview,"Arrest, Cited",1700 Block Of Lasalle Avenue,-122.391434800433,37.7381270935013
9606809871000,96068098,71000,Non-criminal,Lost Property,Sunday,2009-08-09,23:30,Northern,Unfounded,"Duboce Av, Fillmore St",-122.42990612145,37.7694071836367
3102063307041,31020633,7041,VehicleTheft,"Vehicle, Recovered, Auto",Thursday,2003-08-28,08:00,Southern,None,1000 Block Of Harrison St,-122.404439703838,37.7770583079983
8608657706244,86086577,6244,Larceny/theft,Grand Theft From Locked Auto,Sunday,2008-11-23,17:00,Park,None,"Beulah St, Cole St",-122.450335753245,37.7676645008247
3128401106243,31284011,6243,Larceny/theft,Petty Theft From Locked Auto,Friday,2003-10-31,23:15,Central,None,"Broadway St, Battery St",-122.401055856592,37.7985811020612
12616068106244,126160681,6244,Larceny/theft,Grand Theft From Locked Auto,Tuesday,2012-10-09,21:00,Central,None,1800 Block Of Montgomery St,-122.405198753901,37.805247004354
12059502003074,120595020,3074,Robbery,"Robbery, Bodily Force",Saturday,2012-07-28,02:15,Northern,None,"Greenwich St, Fillmore St",-122.435870220186,37.7989514142851
3084427619057,30844276,19057,Assault,Threats Against Life,Tuesday,2003-07-08,11:00,Northern,None,3500 Block Of Fillmore St,-122.436328202384,37.8017515400431
10095535315151,100955353,15151,OtherOffenses,"Stay Away Order Violation, Dv Related",Thursday,2010-10-14,01:47,Bayview,"Arrest, Booked",200 Block Of Tunnel Avenue,-122.401336174519,37.7103327641695
4117651107041,41176511,7041,VehicleTheft,"Vehicle, Recovered, Auto",Friday,2004-10-08,12:00,Central,None,"The Embarcadero North St, Washington St",-122.39532966299,37.7966652982785
11013467228160,110134672,28160,Vandalism,"Malicious Mischief, Vandalism Of Vehicles",Saturday,2011-02-12,20:00,Taraval,None,"Head St, Santabarbara Avenue",-122.464336050523,37.7091607488602
3077824916621,30778249,16621,Drug/narcotic,Possession Of Base/rock Cocaine,Sunday,2003-06-29,18:43,Richmond,"Arrest, Booked","Post St, Baker St",-122.44299184243,37.7838965268972
6137144019057,61371440,19057,Assault,Threats Against Life,Thursday,2006-12-28,10:00,Southern,None,100 Block Of Townsend St,-122.391588816975,37.7796910137658
7122338610045,71223386,10045,Embezzlement,"Embezzlement, Grand Theft By Employee",Saturday,2007-09-01,09:00,Central,None,0 Block Of Post St,-122.402346586116,37.7890033382139
10040171006372,100401710,6372,Larceny/theft,Petty Theft Of Property,Thursday,2010-04-29,15:00,Northern,None,"Buchanan St, Page St",-122.42736043763,37.7734538474717
11089431506111,110894315,6111,Larceny/theft,Grand Theft Pickpocket,Friday,2011-11-04,20:00,Southern,None,800 Block Of Bryant St,-122.403404791479,37.775420706711
12076673264020,120766732,64020,Non-criminal,"Aided Case, Mental Disturbed",Monday,2012-09-24,13:30,Southern,Psychopathic Case,0 Block Of Perry St,-122.396167865037,37.7827239702919
5046669006244,50466690,6244,Larceny/theft,Grand Theft From Locked Auto,Wednesday,2005-04-27,13:00,Taraval,None,"9th Av, Lincoln Wy",-122.466442684179,37.7659245297742
12052099226141,120520992,26141,Kidnapping,"Kidnapping, Adult Victim",Thursday,2012-06-28,14:00,Ingleside,"Arrest, Booked","Diamond St, Kern St",-122.434050860058,37.7338900455815
8128119204134,81281192,4134,Assault,Battery,Sunday,2008-11-30,23:30,Mission,"Arrest, Booked",1100 Block Of Potrero Avenue,-122.406463425003,37.753636505486
6096604406114,60966044,6114,Larceny/theft,Grand Theft Pickpocket,Sunday,2006-09-10,11:30,Central,None,"Stockton St, Pacific Avenue",-122.408433097286,37.7967039278443
7011313816625,70113138,16625,Drug/narcotic,Sale Of Base/rock Cocaine,Wednesday,2007-01-31,17:45,Tenderloin,"Arrest, Booked",200 Block Of Golden Gate Avenue,-122.414302052544,37.781863316866
11005830103051,110058301,3051,Robbery,Robbery Of A Residence With A Gun,Wednesday,2011-01-19,12:30,Richmond,None,600 Block Of 48th Avenue,-122.509193552106,37.7756193870159
6097481572000,60974815,72000,Non-criminal,Found Property,Tuesday,2006-09-12,16:30,Tenderloin,None,0 Block Of Mason St,-122.409268441444,37.7837998723601
7093003928100,70930039,28100,Vandalism,"Malicious Mischief, Breaking Windows",Tuesday,2007-09-11,08:15,Bayview,None,1000 Block Of Connecticut St,-122.397089183868,37.7535987880327
3010300007043,30103000,7043,VehicleTheft,"Vehicle, Recovered, Motorcycle",Thursday,2003-01-23,12:00,Park,None,1700 Block Of Mcallister St,-122.440857271375,37.7774237689287
10008548328010,100085483,28010,OtherOffenses,Cruelty To Animals,Tuesday,2010-01-26,16:10,Tenderloin,"Arrest, Booked",100 Block Of Turk St,-122.411615075408,37.7831614109395
9032227806152,90322278,6152,Larceny/theft,Grand Theft From Person,Wednesday,2009-03-25,11:00,Taraval,None,3100 Block Of Ortega St,-122.497242493708,37.7513958957007
12049717507021,120497175,7021,VehicleTheft,Stolen Automobile,Saturday,2012-06-23,22:15,Ingleside,None,"San Jose Av, Duncan St",-122.421705189736,37.7464120543155
3143173909010,31431739,9010,Forgery/counterfeiting,"Checks, Forgery (misdemeanor)",Saturday,2003-08-30,12:00,Southern,None,800 Block Of Bryant St,-122.403404791479,37.775420706711
10116612162050,101166121,62050,Warrants,Enroute To Outside Jurisdiction,Sunday,2010-12-19,15:11,Southern,None,0 Block Of 6th St,-122.408913229808,37.7812116507663
8095436464020,80954364,64020,Non-criminal,"Aided Case, Mental Disturbed",Tuesday,2008-09-09,04:45,Tenderloin,Psychopathic Case,400 Block Of Ellis St,-122.413631253258,37.7848053746211
7111553916650,71115539,16650,Drug/narcotic,Possession Of Meth-amphetamine,Tuesday,2007-10-30,23:14,Tenderloin,"Arrest, Booked","Ellis St, Leavenworth St",-122.414433155063,37.7846576329256
7072537903024,70725379,3024,Robbery,"Robbery Of A Commercial Establishment, Strongarm",Wednesday,2007-07-18,16:04,Central,None,700 Block Of Post St,-122.41420144235,37.7876109394648
13609439371000,136094393,71000,Non-criminal,Lost Property,Sunday,2013-05-19,22:00,Ingleside,None,600 Block Of San Jose Avenue,-122.422657009241,37.7443660385474
6115231904013,61152319,4013,Assault,Aggravated Assault With A Deadly Weapon,Saturday,2006-10-28,17:50,Northern,"Arrest, Booked",400 Block Of Gough St,-122.42309400129,37.7771077210197
4132306328160,41323063,28160,Vandalism,"Malicious Mischief, Vandalism Of Vehicles",Friday,2004-11-19,17:00,Central,"Arrest, Booked",700 Block Of Vallejo St,-122.409791662293,37.7985083480435
6134524168020,61345241,68020,OtherOffenses,Miscellaneous Investigation,Tuesday,2006-12-19,18:05,Mission,"Arrest, Cited","24th St, Orange St",-122.420085439587,37.7521383342809
12059069471000,120590694,71000,Non-criminal,Lost Property,Saturday,2012-02-04,00:01,Mission,None,600 Block Of Valencia St,-122.421550176461,37.7621307247611
12105012807021,121050128,7021,VehicleTheft,Stolen Automobile,Sunday,2012-12-30,13:00,Mission,None,100 Block Of Hampshire St,-122.408746169981,37.7674040601386
11020682365015,110206823,65015,OtherOffenses,Traffic Violation,Friday,2011-03-11,23:15,Mission,"Arrest, Cited","16th St, Mission St",-122.419671780296,37.7650501214668
3099991262020,30999912,62020,Warrants,Enroute To Department Of Corrections,Sunday,2003-08-24,06:59,Tenderloin,"Arrest, Booked","Turk St, Leavenworth St",-122.414056291898,37.7827931070777
12096457209029,120964572,9029,OtherOffenses,False Personation To Receive Money Or Property,Friday,2012-11-23,09:00,Southern,None,500 Block Of 5th St,-122.39998111124,37.7776242389287
9078049465016,90780494,65016,OtherOffenses,"Drivers License, Suspended Or Revoked",Saturday,2009-08-01,16:45,Northern,"Arrest, Cited","Lombard St, Franklin St",-122.426184340275,37.8010960360093
11018198027195,110181980,27195,Trespass,Trespassing,Thursday,2011-03-03,10:25,Northern,Located,2300 Block Of Buchanan St,-122.431073169007,37.7915687103002
8044928005041,80449280,5041,Burglary,"Burglary Of Residence, Forcible Entry",Tuesday,2008-04-29,08:40,Northern,None,200 Block Of Laussat St,-122.431181214257,37.7714789291664
12014144128160,120141441,28160,Vandalism,"Malicious Mischief, Vandalism Of Vehicles",Sunday,2012-02-19,21:00,Ingleside,None,900 Block Of Edinburgh St,-122.436541001911,37.7150964213484
10118324474000,101183244,74000,MissingPerson,Missing Adult,Wednesday,2010-12-22,19:50,Park,Located,1400 Block Of Golden Gate Avenue,-122.434445230029,37.7793019548371
6102859428135,61028594,28135,OtherOffenses,Harassing Phone Calls,Tuesday,2006-09-26,12:00,Northern,None,1000 Block Of Mcallister St,-122.428464085513,37.7791067704679
13093903228160,130939032,28160,Vandalism,"Malicious Mischief, Vandalism Of Vehicles",Tuesday,2013-11-05,13:15,Mission,"Arrest, Booked",2300 Block Of Mission St,-122.419196838603,37.7594144253287
9032113964070,90321139,64070,SuspiciousOcc,Suspicious Occurrence,Friday,2009-03-27,13:56,Southern,"Arrest, Booked",100 Block Of 6th St,-122.408368579345,37.7807784253732
5080409006224,50804090,6224,Larceny/theft,Grand Theft From Unlocked Auto,Wednesday,2005-07-13,20:30,Northern,None,"Lombard St, Vanness Avenue",-122.424541870491,37.8013041477751
5095139071000,50951390,71000,Non-criminal,Lost Property,Tuesday,2005-08-23,13:00,Central,None,1400 Block Of Stockton St,-122.40879208563,37.7988132153058
6063090406240,60630904,6240,Larceny/theft,Attempted Theft From Locked Vehicle,Wednesday,2006-06-14,20:00,Mission,None,"Shotwell St, 19th St",-122.415929849548,37.7604330003754
8066344664070,80663446,64070,SuspiciousOcc,Suspicious Occurrence,Wednesday,2008-06-11,18:30,Tenderloin,None,"Ofarrell St, Hyde St",-122.416261836834,37.7853750846376
4059577606304,40595776,6304,Larceny/theft,Grand Theft From A Building,Thursday,2003-10-30,16:00,Northern,None,500 Block Of Hickory St,-122.42847852264,37.7748056677434
8088701606304,80887016,6304,Larceny/theft,Grand Theft From A Building,Wednesday,2008-08-20,10:00,Northern,None,800 Block Of Fillmore St,-122.431549683056,37.7772301113523
12617520471000,126175204,71000,Non-criminal,Lost Property,Sunday,2012-10-14,23:47,Tenderloin,None,"Stockton St, Ofarrell St",-122.406401668335,37.7866144613366
5017029904134,50170299,4134,Assault,Battery,Saturday,2005-02-12,16:30,Central,None,"Jefferson St, Jones St",-122.417448570426,37.8080122537817
7035066919057,70350669,19057,Assault,Threats Against Life,Thursday,2007-04-05,15:40,Bayview,None,1600 Block Of Davidson Avenue,-122.392447441376,37.746275498295
4045639404013,40456394,4013,Assault,Aggravated Assault With A Deadly Weapon,Wednesday,2004-04-21,14:20,Bayview,None,"Quint St, Santa Fe Avenue",-122.400037486491,37.7333529457441
9049255863010,90492558,63010,Warrants,Warrant Arrest,Tuesday,2009-05-12,10:05,Southern,"Arrest, Booked",700 Block Of Brannan St,-122.401830898172,37.7742149186174
11069111107100,110691111,7100,OtherOffenses,Tampering With A Vehicle,Sunday,2011-08-28,07:00,Park,None,"Fell St, Baker St",-122.440923876434,37.7736351065468
5121924207041,51219242,7041,VehicleTheft,"Vehicle, Recovered, Auto",Friday,2005-10-28,07:50,Southern,None,"Harrison St, 12th St",-122.413049740902,37.7700527878642
4135213106304,41352131,6304,Larceny/theft,Grand Theft From A Building,Wednesday,2004-11-24,15:01,Ingleside,None,400 Block Of Naples St,-122.43068585096,37.7216404356689
4005370215200,40053702,15200,SecondaryCodes,Domestic Violence,Tuesday,2004-01-13,17:00,Bayview,None,100 Block Of Middle Point Rd,-122.379486937006,37.7348550480451
13610736606372,136107366,6372,Larceny/theft,Petty Theft Of Property,Wednesday,2013-06-26,23:00,Southern,None,700 Block Of Harrison St,-122.397814506334,37.7821372491619
12042398265016,120423982,65016,OtherOffenses,"Drivers License, Suspended Or Revoked",Monday,2012-05-28,23:24,Central,"Arrest, Booked","Broadway St, Battery St",-122.401055856585,37.7985811020841
13040390262050,130403902,62050,Warrants,Enroute To Outside Jurisdiction,Thursday,2013-05-16,19:29,Central,"Arrest, Booked",500 Block Of California St,-122.403322520128,37.7928366196806
11077390716710,110773907,16710,Drug/narcotic,Possession Of Narcotics Paraphernalia,Sunday,2011-09-25,17:14,Northern,"Arrest, Booked",1200 Block Of Eddy St,-122.428245242312,37.7820044139073
8069918416623,80699184,16623,Drug/narcotic,Possession Of Base/rock Cocaine For Sale,Friday,2008-07-04,13:25,Southern,"Arrest, Booked",800 Block Of Bryant St,-122.403404791479,37.775420706711
6015101364070,60151013,64070,SuspiciousOcc,Suspicious Occurrence,Thursday,2006-02-09,07:51,Mission,None,4500 Block Of 19th St,-122.440463403709,37.7589809039288
11019170706303,110191707,6303,Larceny/theft,Petty Theft From A Building,Wednesday,2011-03-02,12:00,Northern,None,1400 Block Of Turk St,-122.43298921345,37.7804437011568
13039538707021,130395387,7021,VehicleTheft,Stolen Automobile,Monday,2013-05-13,11:00,Northern,None,2100 Block Of Pacific Avenue,-122.430653037512,37.7939243941217
8024823619055,80248236,19055,Assault,Threatening Phone Call(s),Saturday,2008-03-08,00:44,Northern,None,2500 Block Of Clay St,-122.435030889134,37.7905502462008
12035109874000,120351098,74000,MissingPerson,Missing Adult,Monday,2012-04-16,00:01,Richmond,Located,300 Block Of 5th Avenue,-122.463210168307,37.7820144487195
12099759575000,120997595,75000,MissingPerson,Found Person,Tuesday,2012-12-11,09:45,Ingleside,Located,1500 Block Of Treat Avenue,-122.41250614556,37.7456802881475
3026093965016,30260939,65016,OtherOffenses,"Drivers License, Suspended Or Revoked",Tuesday,2003-03-04,10:25,Southern,"Arrest, Cited","7th St, Bryant St",-122.40474927354,37.7742800977225
7604711971000,76047119,71000,Non-criminal,Lost Property,Wednesday,2007-07-04,23:00,Southern,None,"Market St, The Embarcaderonorth St",-122.393983685228,37.795060765295
6604606806244,66046068,6244,Larceny/theft,Grand Theft From Locked Auto,Tuesday,2006-07-11,11:00,Park,None,800 Block Of Waller St,-122.438163651417,37.7701139316558
4011187763010,40111877,63010,Warrants,Warrant Arrest,Wednesday,2004-01-28,14:45,Tenderloin,"Arrest, Booked",100 Block Of Fulton St,-122.415973980362,37.7797387918499
7052430307025,70524303,7025,VehicleTheft,Stolen Truck,Tuesday,2007-05-22,00:01,Central,None,"Taylor St, Jackson St",-122.413192128726,37.7951956757685
9052123204134,90521232,4134,Assault,Battery,Tuesday,2009-05-19,16:20,Bayview,"Arrest, Cited",1400 Block Of Thomas Avenue,-122.388542831272,37.7287892888548
7064838963010,70648389,63010,Warrants,Warrant Arrest,Wednesday,2007-06-27,15:30,Mission,"Arrest, Booked",1200 Block Of Treat Avenue,-122.41283040295,37.7501495078008
4080571371000,40805713,71000,Non-criminal,Lost Property,Tuesday,2004-07-13,20:00,Central,None,400 Block Of Davis Ct,-122.398187664281,37.7967148853927
13009317762050,130093177,62050,Warrants,Enroute To Outside Jurisdiction,Saturday,2013-02-02,00:01,Central,"Arrest, Booked","Columbus Av, Pacific Avenue",-122.405517223277,37.7970642284992
9021786765015,90217867,65015,OtherOffenses,Traffic Violation,Saturday,2009-02-28,19:30,Northern,"Arrest, Cited","Geary Bl, Steiner St",-122.4345637373,37.7841504915887
5077068919057,50770689,19057,Assault,Threats Against Life,Sunday,2005-07-10,19:45,Tenderloin,None,400 Block Of Eddy St,-122.41506687647,37.7835634796332
9100240503014,91002405,3014,Robbery,"Robbery On The Street, Strongarm",Monday,2009-09-28,15:50,Southern,"Arrest, Booked",500 Block Of Market St,-122.400922955775,37.7897601819924
5042428406244,50424284,6244,Larceny/theft,Grand Theft From Locked Auto,Sunday,2005-04-17,02:30,Southern,None,"5th St, Folsom St",-122.403390364804,37.780265577696
12008502104134,120085021,4134,Assault,Battery,Monday,2012-01-30,22:25,Northern,None,1800 Block Of Pine St,-122.426267960819,37.7889430432056
6013457004014,60134570,4014,Assault,Aggravated Assault With Bodily Force,Saturday,2006-02-04,20:45,Ingleside,None,200 Block Of Ney St,-122.424415451083,37.7301655270844
11096034265015,110960342,65015,OtherOffenses,Traffic Violation,Wednesday,2011-11-30,07:34,Southern,"Arrest, Cited","Market St, Sansome St",-122.400316057286,37.790099627367
5099256019090,50992560,19090,Drunkenness,Under Influence Of Alcohol In A Public Place,Saturday,2005-09-03,00:51,Taraval,None,"9th Av, Irving St",-122.466309668211,37.7640368477357
6005076663010,60050766,63010,Warrants,Warrant Arrest,Friday,2006-01-13,18:00,Southern,"Arrest, Booked",900 Block Of Market St,-122.408421116922,37.7835699386918
12059241865010,120592418,65010,OtherOffenses,Traffic Violation Arrest,Friday,2012-07-27,09:30,Tenderloin,"Arrest, Cited",700 Block Of Ofarrell St,-122.417085357424,37.7852153590471
4007251407023,40072514,7023,VehicleTheft,Stolen Motorcycle,Sunday,2004-01-18,12:00,Richmond,None,2900 Block Of Anza St,-122.479781949708,37.7783288174915
5004724005011,50047240,5011,Burglary,"Burglary Of Apartment House, Forcible Entry",Wednesday,2005-01-12,21:20,Central,None,600 Block Of Bush St,-122.407689581502,37.7902423892742
7115764407055,71157644,7055,RecoveredVehicle,Recovered Vehicle - Stolen Outside Sf,Sunday,2007-11-11,11:30,Tenderloin,None,100 Block Of Hyde St,-122.415533007999,37.7821372997842
8051078406302,80510784,6302,Larceny/theft,Petty Theft From A Building,Tuesday,2008-05-13,15:30,Central,None,200 Block Of Sutter St,-122.404060431727,37.7898571696747
5098020865016,50980208,65016,OtherOffenses,"Drivers License, Suspended Or Revoked",Wednesday,2005-08-31,12:00,Bayview,"Arrest, Cited","Palou Av, Keith St",-122.387167707633,37.7318594482946
12090030003014,120900300,3014,Robbery,"Robbery On The Street, Strongarm",Tuesday,2012-11-06,23:28,Ingleside,"Arrest, Booked",900 Block Of Geneva Avenue,-122.440593031551,37.7163046735122
12021987205053,120219872,5053,Burglary,"Burglary Of Store, Unlawful Entry",Saturday,2012-03-17,10:38,Southern,"Arrest, Booked",800 Block Of Market St,-122.407633520742,37.7841893501425
8036210903014,80362109,3014,Robbery,"Robbery On The Street, Strongarm",Sunday,2008-03-30,23:00,Tenderloin,None,"Market St, 8th St",-122.414743835382,37.778719262789
10094725319057,100947253,19057,Assault,Threats Against Life,Monday,2010-10-11,20:30,Northern,"Arrest, Booked",1400 Block Of Union St,-122.423164382502,37.7986007771754
10065393375000,100653933,75000,MissingPerson,Found Person,Friday,2010-07-16,23:14,Bayview,Located,1400 Block Of Phelps St,-122.394438859914,37.7364438996732
10102853771000,101028537,71000,Non-criminal,Lost Property,Friday,2010-11-05,10:30,Ingleside,None,"Mission St, Foote Avenue",-122.444742271037,37.7126229340876
12039681271000,120396812,71000,Non-criminal,Lost Property,Saturday,2012-05-19,07:00,Mission,None,"24th St, Mission St",-122.418448186101,37.7522391652625
11612389371000,116123893,71000,Non-criminal,Lost Property,Thursday,2011-08-25,00:01,Mission,None,2400 Block Of Bryant St,-122.409436313449,37.7551775435269
4091733028100,40917330,28100,Vandalism,"Malicious Mischief, Breaking Windows",Thursday,2004-08-12,23:45,Taraval,None,2400 Block Of 23rd Avenue,-122.479842381108,37.7419135289314
6057988506304,60579885,6304,Larceny/theft,Grand Theft From A Building,Thursday,2006-06-29,11:30,Central,None,200 Block Of Sutter St,-122.40482801879,37.7897596938342
11065639706304,110656397,6304,Larceny/theft,Grand Theft From A Building,Tuesday,2011-08-16,10:45,Central,None,200 Block Of Sutter St,-122.40482801879,37.7897596938342
9078856703051,90788567,3051,Robbery,Robbery Of A Residence With A Gun,Monday,2009-08-03,13:21,Ingleside,District Attorney Refuses To Prosecute,0 Block Of Norwich St,-122.410957707963,37.7452134967269
8034296365016,80342963,65016,OtherOffenses,"Drivers License, Suspended Or Revoked",Wednesday,2008-04-02,11:11,Bayview,"Arrest, Cited","Illinois St, 22nd St",-122.387316279433,37.7580021664589
3109511927090,31095119,27090,Larceny/theft,"Lost Property, Petty Theft",Thursday,2003-09-11,16:15,Northern,None,"Fillmore St, Vallejo St",-122.435115362797,37.7952252533418
13618238071000,136182380,71000,Non-criminal,Lost Property,Saturday,2013-09-28,15:00,Mission,None,"18th St, Guerrero St",-122.423803001901,37.7615655928045
7034489406303,70344894,6303,Larceny/theft,Petty Theft From A Building,Friday,2007-03-30,12:00,Southern,None,300 Block Of Mission St,-122.396211154038,37.790761361966
9037738665016,90377386,65016,OtherOffenses,"Drivers License, Suspended Or Revoked",Saturday,2009-04-11,01:19,Central,"Arrest, Cited","Broadway St, Montgomery St",-122.403864541976,37.7982226437427
5115238516623,51152385,16623,Drug/narcotic,Possession Of Base/rock Cocaine For Sale,Wednesday,2005-10-12,14:10,Southern,"Arrest, Booked",800 Block Of Bryant St,-122.403404791479,37.775420706711
7098238106374,70982381,6374,Larceny/theft,Grand Theft Of Property,Monday,2007-09-24,22:10,Southern,None,800 Block Of Bryant St,-122.403404791479,37.775420706711
13620901906372,136209019,6372,Larceny/theft,Petty Theft Of Property,Saturday,2013-10-19,19:30,Southern,None,200 Block Of Interstate80 Hy,-122.365565425353,37.8096707013239
12078679606126,120786796,6126,Larceny/theft,Theft Of Computers Or Cell Phones,Friday,2012-08-10,21:00,Mission,None,"18th St, Noe St",-122.432795347224,37.7610201697083
13099215906301,130992159,6301,Larceny/theft,Petty Theft From A Building,Saturday,2013-11-23,23:20,Southern,None,200 Block Of 8th St,-122.411271940537,37.7760329501244
5099281106243,50992811,6243,Larceny/theft,Petty Theft From Locked Auto,Friday,2005-09-02,23:55,Southern,None,800 Block Of Harrison St,-122.400799947914,37.7799338672319
10031376706361,100313767,6361,Larceny/theft,Petty Theft Shoplifting,Sunday,2010-04-04,16:20,Mission,"Arrest, Booked",1800 Block Of Folsom St,-122.415605496237,37.7677177520665
5077754406241,50777544,6241,Larceny/theft,Petty Theft From Locked Auto,Tuesday,2005-07-12,02:00,Park,None,0 Block Of Carmel St,-122.447048172645,37.760913433388
11104014504013,111040145,4013,Assault,Aggravated Assault With A Deadly Weapon,Thursday,2011-12-29,19:15,Tenderloin,"Arrest, Booked",0 Block Of Turk St,-122.409853729941,37.7833862379382
10020318009029,100203180,9029,OtherOffenses,False Personation To Receive Money Or Property,Wednesday,2010-02-17,06:00,Bayview,None,100 Block Of Scotia Avenue,-122.399760356651,37.7319561729586
3140739807026,31407398,7026,VehicleTheft,Stolen Miscellaneous Vehicle,Saturday,2003-11-15,12:00,Bayview,None,0 Block Of Boutwell St,-122.405878086361,37.7374071344253
11024401105014,110244011,5014,Burglary,"Burglary, Vehicle (arrest Made)",Thursday,2011-03-24,23:00,Northern,None,1800 Block Of Pine St,-122.426246092712,37.7888345695702
9119724406244,91197244,6244,Larceny/theft,Grand Theft From Locked Auto,Friday,2009-11-20,19:45,Northern,None,"Pine St, Vanness Avenue",-122.422139511488,37.7894107633457
11019499903014,110194999,3014,Robbery,"Robbery On The Street, Strongarm",Monday,2011-03-07,20:30,Ingleside,None,"Brookdale Av, Santos St",-122.418766889013,37.7119336857601
3050938907041,30509389,7041,VehicleTheft,"Vehicle, Recovered, Auto",Thursday,2003-05-01,00:01,Northern,None,"Sanchez St, Duboce Avenue",-122.431571409336,37.769305740363
12057958516710,120579585,16710,Drug/narcotic,Possession Of Narcotics Paraphernalia,Sunday,2012-07-22,22:46,Southern,"Arrest, Booked",800 Block Of Bryant St,-122.403404791479,37.775420706711
5010674907041,50106749,7041,VehicleTheft,"Vehicle, Recovered, Auto",Thursday,2005-01-27,17:00,Park,None,"Oak St, Broderick St",-122.43908839897,37.7729208953432
6019463716710,60194637,16710,Drug/narcotic,Possession Of Narcotics Paraphernalia,Monday,2006-02-20,12:30,Mission,"Arrest, Cited",600 Block Of Potrero Avenue,-122.407254213895,37.7612780377437
8063179419090,80631794,19090,Drunkenness,Under Influence Of Alcohol In A Public Place,Tuesday,2008-06-17,03:45,Southern,"Arrest, Booked",100 Block Of 6th St,-122.408368579345,37.7807784253732
5144202351040,51442023,51040,Non-criminal,Aided Case,Saturday,2005-12-24,18:00,Taraval,None,1600 Block Of 38th Avenue,-122.496954931819,37.7561210154405
4045250265016,40452502,65016,OtherOffenses,"Drivers License, Suspended Or Revoked",Tuesday,2004-04-20,16:30,Bayview,"Arrest, Cited","Evans Av, 3rd St",-122.387927387652,37.7427030847719
8022028465015,80220284,65015,OtherOffenses,Traffic Violation,Saturday,2008-03-01,10:59,Taraval,"Arrest, Cited","Broad St, Capitol Avenue",-122.459023622429,37.7131719025215
13050579665016,130505796,65016,OtherOffenses,"Drivers License, Suspended Or Revoked",Thursday,2013-06-20,07:54,Southern,"Arrest, Cited","2nd St, Brannan St",-122.392082305321,37.7818457722573
5061083107025,50610831,7025,VehicleTheft,Stolen Truck,Wednesday,2005-06-01,04:50,Northern,None,"Vanness Av, California St",-122.422330464205,37.7903690688591
9119116103021,91191161,3021,Robbery,Robbery Of A Commercial Establishment With A Gun,Thursday,2009-11-19,11:15,Mission,None,4100 Block Of 18th St,-122.435563016294,37.760801062884
11087622206244,110876222,6244,Larceny/theft,Grand Theft From Locked Auto,Sunday,2011-10-30,00:01,Bayview,None,0 Block Of Mansell St,-122.425333754714,37.7176206474966
13087265872000,130872658,72000,Non-criminal,Found Property,Tuesday,2013-10-15,10:00,Southern,None,"11th St, Folsom St",-122.41402726269,37.7718636177154
4085015015150,40850150,15150,OtherOffenses,Violation Of Restraining Order,Monday,2004-07-26,14:20,Southern,"Arrest, Booked",1000 Block Of Market St,-122.411071423064,37.7817511307229
7604755106244,76047551,6244,Larceny/theft,Grand Theft From Locked Auto,Friday,2007-07-06,21:00,Mission,None,600 Block Of Alvarado St,-122.435446402463,37.7536598749757
11024222504134,110242225,4134,Assault,Battery,Monday,2011-02-14,18:00,Northern,Exceptional Clearance,800 Block Of Webster St,-122.429798983981,37.778415568238
3096710771010,30967107,71010,OtherOffenses,Lost/stolen License Plate,Thursday,2003-08-14,22:00,Richmond,None,2400 Block Of Turk St,-122.448436018496,37.7783899203659
