id,incident_number,incident_code,category,descript,day_of_the_week,date,time,police_dept_district,resolution,address,location_x_axis,location_y_axis
8020668206240,80206682,6240,Larceny/theft,Attempted Theft From Locked Vehicle,Tuesday,2008-02-26,22:00,Taraval,None,"14th Av, Santiago St",-122.470365997562,37.74515794927
4121819106354,41218191,6354,Larceny/theft,Grand Theft Phone Booth,Friday,2004-11-26,11:00,Mission,None,1000 Block Of Potrero Avenue,-122.406539115148,37.7564864109309
10007924871000,100079248,71000,Non-criminal,Lost Property,Sunday,2010-01-24,17:00,Mission,None,"21st St, Church St",-122.427892650497,37.7564938657601
10017332316710,100173323,16710,Drug/narcotic,Possession Of Narcotics Paraphernalia,Sunday,2010-02-21,07:15,Bayview,"Arrest, Booked",1800 Block Of Egbert Avenue,-122.400756491094,37.727208031298
3033153006112,30331530,6112,Larceny/theft,Grand Theft Pickpocket,Thursday,2003-03-20,10:30,Richmond,None,"Geary Bl, 3rd Avenue",-122.461062711149,37.7811580518981
11005510304134,110055103,4134,Assault,Battery,Tuesday,2011-01-18,17:49,Park,None,"Divisadero St, Ofarrell St",-122.43929911672,37.7824492641129
5009971810140,50099718,10140,Fraud,"Short Change, Petty Theft",Wednesday,2004-10-13,12:00,Tenderloin,None,0 Block Of Powell St,-122.407845374111,37.7850943210103
9043940307025,90439403,7025,VehicleTheft,Stolen Truck,Saturday,2009-04-25,11:00,Ingleside,None,"Powhattan Av, Anderson St",-122.415073642246,37.7415810370507
9074265410115,90742654,10115,Fraud,"Trick And Device, Grand Theft",Monday,2009-07-20,12:00,Central,None,1500 Block Of Powell St,-122.410620367623,37.7988379965105
5015107371000,50151073,71000,Non-criminal,Lost Property,Friday,2005-02-04,23:00,Southern,None,800 Block Of Bryant St,-122.403404791479,37.775420706711
5095215064070,50952150,64070,SuspiciousOcc,Suspicious Occurrence,Monday,2005-08-01,22:00,Southern,None,500 Block Of Minna St,-122.40877066526,37.7801357011746
10601773906244,106017739,6244,Larceny/theft,Grand Theft From Locked Auto,Sunday,2010-02-07,14:00,Central,None,3100 Block Of Polk St,-122.423683348728,37.8057721323673
4077746307041,40777463,7041,VehicleTheft,"Vehicle, Recovered, Auto",Wednesday,2004-07-07,20:00,Northern,"Arrest, Booked",100 Block Of Sanchez St,-122.431145125864,37.7663920950126
9058346404013,90583464,4013,Assault,Aggravated Assault With A Deadly Weapon,Saturday,2009-06-06,19:16,Southern,None,300 Block Of 7th St,-122.406841835314,37.7758712904252
6008065016623,60080650,16623,Drug/narcotic,Possession Of Base/rock Cocaine For Sale,Saturday,2006-01-21,21:20,Tenderloin,"Arrest, Booked","Eddy St, Hyde St",-122.415885065788,37.7835160564153
9021397816710,90213978,16710,Drug/narcotic,Possession Of Narcotics Paraphernalia,Friday,2009-02-27,17:30,Mission,"Arrest, Cited","24th St, Mission St",-122.418448186101,37.7522391652625
4017464316621,40174643,16621,Drug/narcotic,Possession Of Base/rock Cocaine,Thursday,2004-02-12,17:04,Southern,"Arrest, Booked","Market St, Van Ness Avenue",-122.419257894821,37.775146291631
12604659206244,126046592,6244,Larceny/theft,Grand Theft From Locked Auto,Monday,2012-04-09,20:30,Southern,None,800 Block Of Howard St,-122.403793259489,37.7823235897616
8099716026150,80997160,26150,OtherOffenses,Parole Violation,Friday,2008-09-19,18:48,Central,"Arrest, Booked","Geary St, Hyde St",-122.416452065595,37.7863086885804
7121189226060,71211892,26060,Bribery,Bribery Of Witnesses,Thursday,2007-11-22,00:01,Mission,None,"Mission St, 24th St",-122.418448186101,37.7522391652625
3008483664020,30084836,64020,Non-criminal,"Aided Case, Mental Disturbed",Tuesday,2003-01-21,22:30,Bayview,None,1600 Block Of Mc Kinnon Avenue,-122.38974598966,37.7360920311297
10608994806231,106089948,6231,Larceny/theft,Petty Theft Auto Strip,Thursday,2010-07-22,16:00,Ingleside,None,400 Block Of Harkness Avenue,-122.405746022083,37.7182103216996
9063571462050,90635714,62050,Warrants,Enroute To Outside Jurisdiction,Sunday,2009-06-21,17:20,Tenderloin,"Arrest, Booked",0 Block Of Powell St,-122.407845374111,37.7850943210103
13615654506244,136156545,6244,Larceny/theft,Grand Theft From Locked Auto,Tuesday,2013-08-27,18:45,Central,None,"Chestnut St, Grant Avenue",-122.408335794054,37.8043665967987
10046849705041,100468497,5041,Burglary,"Burglary Of Residence, Forcible Entry",Thursday,2010-05-20,07:31,Ingleside,None,300 Block Of Prentiss St,-122.412128686928,37.7389671455261
4061886712100,40618867,12100,WeaponLaws,Poss Of Loaded Firearm,Sunday,2004-05-30,01:48,Central,"Arrest, Booked",700 Block Of Kearny St,-122.404767635853,37.7946646538154
7088044015150,70880440,15150,OtherOffenses,Violation Of Restraining Order,Tuesday,2007-08-28,20:42,Tenderloin,"Arrest, Booked",400 Block Of Ellis St,-122.413631253258,37.7848053746211
13075900664002,130759006,64002,Non-criminal,"Civil Sidewalks, Citation",Tuesday,2013-09-10,15:01,Mission,"Arrest, Cited",0 Block Of Hartford St,-122.434051954938,37.7617484575612
6128985905051,61289859,5051,Burglary,"Burglary Of Store, Forcible Entry",Monday,2006-12-04,18:00,Central,None,400 Block Of Battery St,-122.400439442308,37.7952225729948
4086015962050,40860159,62050,Warrants,Enroute To Outside Jurisdiction,Wednesday,2004-07-28,19:30,Mission,"Arrest, Booked",600 Block Of Valencia St,-122.421747650463,37.7627436601147
3011830006371,30118300,6371,Larceny/theft,Petty Theft Of Property,Wednesday,2003-01-29,12:30,Central,None,600 Block Of Filbert St,-122.410220142966,37.8013225692058
8043635604033,80436356,4033,Assault,Assault With Caustic Chemicals,Saturday,2008-04-26,13:15,Tenderloin,Unfounded,500 Block Of Ofarrell St,-122.413798415869,37.7856297942374
10607723806374,106077238,6374,Larceny/theft,Grand Theft Of Property,Tuesday,2010-06-22,21:00,Northern,None,"Franklin St, Post St",-122.423217673913,37.7864017954155
3054377906244,30543779,6244,Larceny/theft,Grand Theft From Locked Auto,Friday,2003-05-02,22:00,Bayview,None,"Bayview St, Latona St",-122.392361368523,37.7324903419947
11615513106244,116155131,6244,Larceny/theft,Grand Theft From Locked Auto,Wednesday,2011-12-07,20:30,Southern,None,"3rd St, Brannan St",-122.394304475194,37.7800905305924
12027232509250,120272325,9250,Fraud,Fraudulent Use Of Automated Teller Card,Thursday,2012-04-05,02:30,Southern,None,0 Block Of Lafayette St,-122.417223311452,37.7729316891676
10054560327170,100545603,27170,OtherOffenses,Resisting Arrest,Sunday,2010-06-13,00:56,Southern,"Arrest, Booked",700 Block Of Harrison St,-122.397814506334,37.7821372491619
7049529305011,70495293,5011,Burglary,"Burglary Of Apartment House, Forcible Entry",Tuesday,2007-05-15,11:15,Bayview,None,100 Block Of Westpoint Rd,-122.380382266471,37.7353538209895
3071176674000,30711766,74000,MissingPerson,Missing Adult,Thursday,2003-06-12,10:00,Tenderloin,Located,400 Block Of Powell St,-122.408568445228,37.7887594214703
6040156765016,60401567,65016,OtherOffenses,"Drivers License, Suspended Or Revoked",Saturday,2006-04-15,01:50,Central,"Arrest, Cited",0 Block Of Telegraphhill Bl,-122.405471739992,37.8022505061483
10048275405081,100482754,5081,Burglary,"Burglary, Hot Prowl, Forcible Entry",Monday,2010-05-24,19:00,Bayview,"Arrest, Booked",4900 Block Of 3rd St,-122.391243431227,37.7336342023099
8136906151040,81369061,51040,Non-criminal,Aided Case,Wednesday,2008-12-24,22:27,Tenderloin,None,"Leavenworth St, Ellis St",-122.414433155063,37.7846576329256
4049547700000,40495477,0,OtherOffenses,Unknown Complaint,Friday,2004-04-30,11:45,Ingleside,Located,1000 Block Of Cayuga Avenue,-122.440006611531,37.7218048835547
6122469505013,61224695,5013,Burglary,"Burglary Of Apartment House, Unlawful Entry",Thursday,2006-11-16,18:00,Park,None,600 Block Of Haight St,-122.432918340311,37.7717365330369
9608723606244,96087236,6244,Larceny/theft,Grand Theft From Locked Auto,Friday,2009-09-18,21:00,Taraval,None,"27th Av, Judah St",-122.485569288039,37.7613213723755
8060432171000,80604321,71000,Non-criminal,Lost Property,Monday,2008-06-09,15:00,Central,None,"Stockton St, Pacific Avenue",-122.408433097286,37.7967039278443
8103186262050,81031862,62050,Warrants,Enroute To Outside Jurisdiction,Sunday,2008-09-28,09:37,Mission,"Arrest, Booked",2400 Block Of 18th St,-122.406699612852,37.76202033109
5090460607021,50904606,7021,VehicleTheft,Stolen Automobile,Tuesday,2005-08-09,21:00,Park,None,"Oak St, Masonic Avenue",-122.445717668895,37.7720809772444
9082647428135,90826474,28135,OtherOffenses,Harassing Phone Calls,Monday,2009-08-10,15:00,Taraval,None,0 Block Of Westgate Dr,-122.466043693475,37.7278742751614
8106938009110,81069380,9110,Fraud,"Forgery, Credit Card",Tuesday,2008-01-01,00:01,Central,None,0 Block Of Ross Al,-122.407419469554,37.7954856471047
10097143472000,100971434,72000,Non-criminal,Found Property,Monday,2010-10-18,09:30,Ingleside,None,100 Block Of Arleta Avenue,-122.405839285503,37.7135422175169
3089855264070,30898552,64070,SuspiciousOcc,Suspicious Occurrence,Sunday,2003-07-13,01:00,Southern,None,0 Block Of 6th St,-122.40942036456,37.7816150265786
8117524416710,81175244,16710,Drug/narcotic,Possession Of Narcotics Paraphernalia,Monday,2008-11-03,00:24,Tenderloin,"Arrest, Booked","Ofarrell St, Jones St",-122.412970537591,37.7857883766888
3033403909040,30334039,9040,Forgery/counterfeiting,"Checks, Possession With Intent To Pass",Thursday,2003-03-20,23:45,Northern,None,3200 Block Of Divisadero St,-122.4428172375,37.7994896740468
12082081106242,120820811,6242,Larceny/theft,Petty Theft From Locked Auto,Friday,2012-10-12,15:42,Northern,None,"Post St, Franklin St",-122.423217673913,37.7864017954155
9080085406364,90800854,6364,Larceny/theft,Grand Theft Shoplifting,Thursday,2009-08-06,20:13,Southern,None,800 Block Of Market St,-122.407633520742,37.7841893501425
3136415206243,31364152,6243,Larceny/theft,Petty Theft From Locked Auto,Thursday,2003-11-20,12:15,Richmond,None,"Atalaya Tr, Fulton St",-122.44744530469,37.775675653652
5127242271000,51272422,71000,Non-criminal,Lost Property,Sunday,2005-11-06,13:00,Richmond,None,3700 Block Of California St,-122.455468425157,37.786210973675
5130309906224,51303099,6224,Larceny/theft,Grand Theft From Unlocked Auto,Thursday,2005-11-17,20:00,Taraval,None,300 Block Of Westportal Avenue,-122.469955448831,37.7373592055385
12617962606244,126179626,6244,Larceny/theft,Grand Theft From Locked Auto,Monday,2012-11-12,19:45,Northern,None,"California St, Steiner St",-122.435488624119,37.7886951990543
6082573564070,60825735,64070,SuspiciousOcc,Suspicious Occurrence,Friday,2006-08-04,16:30,Mission,None,"22nd St, Folsom St",-122.414389290829,37.7557003660169
10031839703051,100318397,3051,Robbery,Robbery Of A Residence With A Gun,Tuesday,2010-04-06,09:00,Bayview,"Arrest, Booked",300 Block Of Dwight St,-122.40610341071,37.7230816018394
3117972907023,31179729,7023,VehicleTheft,Stolen Motorcycle,Monday,2003-10-06,19:00,Taraval,"Arrest, Booked",600 Block Of John Muir Dr,-122.49206801734,37.7143615498756
3107316572000,31073165,72000,Non-criminal,Found Property,Thursday,2003-09-11,10:40,Central,None,800 Block Of Union St,-122.413300482333,37.7998720993886
7029456264080,70294562,64080,SuspiciousOcc,Suspicious Person,Wednesday,2007-03-21,16:40,Richmond,None,700 Block Of La Playa St,-122.510032525985,37.7741786514476
11101471415155,111014714,15155,OtherOffenses,Restraining Order Notification/service Of Restraining Order,Monday,2011-12-19,18:30,Ingleside,"Arrest, Booked",300 Block Of Vienna St,-122.428613620046,37.722765398728
12045780607100,120457806,7100,OtherOffenses,Tampering With A Vehicle,Saturday,2012-06-09,16:00,Park,None,1800 Block Of Eddy St,-122.438120409301,37.7807473113138
12040817219057,120408172,19057,Assault,Threats Against Life,Wednesday,2012-05-23,01:38,Southern,"Arrest, Booked",100 Block Of 6th St,-122.407877117352,37.7803875013555
5001400106242,50014001,6242,Larceny/theft,Petty Theft From Locked Auto,Wednesday,2005-01-05,01:44,Park,None,800 Block Of Waller St,-122.438170162913,37.7702242882488
6019609704013,60196097,4013,Assault,Aggravated Assault With A Deadly Weapon,Monday,2006-02-20,19:05,Central,None,"John St, Powell St",-122.409991544752,37.7960578963176
5037598816100,50375988,16100,Drug/narcotic,Possession Of Heroin,Tuesday,2005-04-05,20:35,Tenderloin,"Arrest, Booked",200 Block Of Leavenworth St,-122.414217804322,37.7832593295025
12900288065050,129002880,65050,DrivingUnderTheInfluence,Driving While Under The Influence Of Alcohol,Monday,2012-08-20,02:20,Taraval,"Arrest, Booked",200 Block Of Vidal Dr,-122.484666330998,37.7191895425338
8062405665016,80624056,65016,OtherOffenses,"Drivers License, Suspended Or Revoked",Saturday,2008-06-14,19:20,Mission,"Arrest, Cited","Hampshire St, 23rd St",-122.407449511511,37.7545081025069
3110500304134,31105003,4134,Assault,Battery,Friday,2003-09-12,03:30,Park,None,1600 Block Of Turk St,-122.436274979481,37.7800247331065
5000355913070,50003559,13070,Prostitution,Solicits To Visit House Of Prostitution,Sunday,2005-01-02,08:00,Mission,"Arrest, Cited","South Van Ness Av, 17th St",-122.417332582598,37.7635718955939
6606902606244,66069026,6244,Larceny/theft,Grand Theft From Locked Auto,Monday,2006-09-25,00:01,Southern,None,"Harrison St, 6th St",-122.404071611406,37.7772741854354
9008622065016,90086220,65016,OtherOffenses,"Drivers License, Suspended Or Revoked",Saturday,2009-01-24,07:16,Taraval,"Arrest, Cited","Broad St, Plymouth Avenue",-122.456050465866,37.7131938450626
4126919465016,41269194,65016,OtherOffenses,"Drivers License, Suspended Or Revoked",Saturday,2004-11-06,02:25,Tenderloin,"Arrest, Cited","Mcallister St, Leavenworth St",-122.413679376895,37.7809258336623
6047824307025,60478243,7025,VehicleTheft,Stolen Truck,Thursday,2006-05-04,17:45,Northern,None,"Willow St, Polk St",-122.419274801449,37.7835680535207
4034238928160,40342389,28160,Vandalism,"Malicious Mischief, Vandalism Of Vehicles",Wednesday,2004-03-24,16:00,Taraval,None,500 Block Of Arch St,-122.467100153254,37.7206866607598
4017735207021,40177352,7021,VehicleTheft,Stolen Automobile,Thursday,2004-02-12,12:00,Central,None,"Jones St, Union St",-122.415763895306,37.7996148911973
5144396807025,51443968,7025,VehicleTheft,Stolen Truck,Friday,2005-12-23,20:30,Northern,None,1900 Block Of Webster St,-122.43217019496,37.7886376204776
12097169665010,120971696,65010,OtherOffenses,Traffic Violation Arrest,Saturday,2012-12-01,23:17,Mission,"Arrest, Booked",400 Block Of Castro St,-122.435012093789,37.7617677182954
3022269465016,30222694,65016,OtherOffenses,"Drivers License, Suspended Or Revoked",Saturday,2003-02-22,20:40,Mission,"Arrest, Cited","23rd St, Bartlett St",-122.419705544814,37.7537707037126
3079202328160,30792023,28160,Vandalism,"Malicious Mischief, Vandalism Of Vehicles",Tuesday,2003-07-01,22:00,Central,None,"Broadway St, Battery St",-122.401055856592,37.7985811020612
6056443865015,60564438,65015,OtherOffenses,Traffic Violation,Sunday,2006-05-28,07:30,Southern,"Arrest, Cited","6th St, Mission St",-122.408710606663,37.7809706722053
4009056628150,40090566,28150,Vandalism,"Malicious Mischief, Vandalism",Wednesday,2004-01-21,20:00,Ingleside,None,100 Block Of Tucker Avenue,-122.406955614145,37.7162766822917
7123336365016,71233363,65016,OtherOffenses,"Drivers License, Suspended Or Revoked",Sunday,2007-12-02,05:52,Northern,"Arrest, Cited","Vanness Av, Geary St",-122.421395819115,37.7856843389472
9032652106244,90326521,6244,Larceny/theft,Grand Theft From Locked Auto,Saturday,2009-03-28,19:10,Mission,None,"Alameda St, Potrero Avenue",-122.407815467597,37.7683548732689
3059185312120,30591853,12120,WeaponLaws,Poss Of Prohibited Weapon,Wednesday,2003-05-14,18:26,Ingleside,"Arrest, Booked",200 Block Of Blythdale Avenue,-122.420556751442,37.7108945814914
7070119706223,70701197,6223,Larceny/theft,Petty Theft From Unlocked Auto,Wednesday,2007-07-11,23:30,Richmond,None,500 Block Of 17th Avenue,-122.475886375404,37.7776087618962
9118364165016,91183641,65016,OtherOffenses,"Drivers License, Suspended Or Revoked",Tuesday,2009-11-17,12:20,Bayview,"Arrest, Cited","Bay Shore Bl, Jerrold Avenue",-122.403564371001,37.7477613103514
13000630216650,130006302,16650,Drug/narcotic,Possession Of Meth-amphetamine,Thursday,2013-01-03,00:22,Richmond,"Arrest, Booked",2700 Block Of Clement St,-122.488635296121,37.7819041160259
5072339375000,50723393,75000,MissingPerson,Found Person,Tuesday,2005-06-28,17:30,Ingleside,None,100 Block Of Nevada St,-122.411368778971,37.7406048453638
7040751164070,70407511,64070,SuspiciousOcc,Suspicious Occurrence,Saturday,2007-04-21,06:20,Tenderloin,None,"Golden Gate Av, Hyde St",-122.415508242782,37.7816542806076
14030936209029,140309362,9029,OtherOffenses,False Personation To Receive Money Or Property,Friday,2010-01-01,09:00,Bayview,None,400 Block Of Paul Avenue,-122.399671791086,37.723293933153
3033986303014,30339863,3014,Robbery,"Robbery On The Street, Strongarm",Saturday,2003-03-22,14:35,Tenderloin,Complainant Refuses To Prosecute,"Golden Gate Av, Jones St",-122.412224164743,37.78207293118
5054621464020,50546214,64020,Non-criminal,"Aided Case, Mental Disturbed",Monday,2005-05-16,22:48,Northern,Psychopathic Case,100 Block Of Hemlock St,-122.420815202607,37.7872360476925
10006615406304,100066154,6304,Larceny/theft,Grand Theft From A Building,Wednesday,2010-01-20,19:15,Mission,None,200 Block Of Hartford St,-122.43359736099,37.7585437043023
13106529268020,131065292,68020,OtherOffenses,Miscellaneous Investigation,Thursday,2013-12-19,09:00,Mission,None,2800 Block Of Mission St,-122.418296094437,37.7514284856786
12046083711012,120460837,11012,StolenProperty,"Stolen Property, Possession With Knowledge, Receiving",Monday,2012-06-11,18:00,Southern,None,1200 Block Of Market St,-122.415448759562,37.778293520129
7105515168020,71055151,68020,OtherOffenses,Miscellaneous Investigation,Sunday,2007-10-14,13:00,Taraval,None,"Ortega St, 46th Avenue",-122.505275194098,37.7510903881084
12074136406304,120741364,6304,Larceny/theft,Grand Theft From A Building,Friday,2012-09-14,18:15,Mission,None,0 Block Of Collingwood St,-122.436107579123,37.7614706791054
3027311430190,30273114,30190,OtherOffenses,Violation Of Municipal Police Code,Thursday,2003-03-06,20:33,Southern,"Arrest, Cited",100 Block Of Beale St,-122.394981000521,37.7905664891361
9606810128150,96068101,28150,Vandalism,"Malicious Mischief, Vandalism",Wednesday,2009-08-05,21:05,Northern,None,1500 Block Of Ofarrell St,-122.430610535316,37.7834963710489
13090251227065,130902512,27065,Fraud,False Id To Peace Officer,Thursday,2013-10-24,13:37,Tenderloin,"Arrest, Booked","Geary St, Powell St",-122.408231026261,37.787359494956
11025229605081,110252296,5081,Burglary,"Burglary, Hot Prowl, Forcible Entry",Monday,2011-03-28,03:00,Taraval,None,0 Block Of Castenada Avenue,-122.462027484211,37.7496244997415
6110764365015,61107643,65015,OtherOffenses,Traffic Violation,Tuesday,2006-10-17,08:56,Bayview,"Arrest, Cited","3rd St, 25th St",-122.387759351288,37.7528363805294
3030678771000,30306787,71000,Non-criminal,Lost Property,Saturday,2003-03-08,23:00,Park,None,500 Block Of Parnassus Avenue,-122.458220811697,37.7633123961354
11040689105014,110406891,5014,Burglary,"Burglary, Vehicle (arrest Made)",Friday,2011-05-20,12:05,Northern,"Arrest, Booked",1600 Block Of Fillmore St,-122.433068689791,37.7847514954484
10604148706244,106041487,6244,Larceny/theft,Grand Theft From Locked Auto,Sunday,2010-04-11,16:00,Ingleside,None,200 Block Of Chenery St,-122.426931311652,37.7377893527232
10097960430131,100979604,30131,OtherOffenses,Scalping Tickets,Thursday,2010-10-21,16:40,Southern,"Arrest, Cited",800 Block Of 3rd St,-122.391425069857,37.7778727797586
13021020215300,130210202,15300,SecondaryCodes,Prejudice-based Incident,Monday,2013-03-11,06:00,Mission,None,500 Block Of South Van Ness Avenue,-122.41747701285,37.764357751686
11030458068020,110304580,68020,OtherOffenses,Miscellaneous Investigation,Monday,2011-04-11,18:00,Ingleside,None,5200 Block Of Diamondheights Bl,-122.439065944959,37.7442774766877
13094289706302,130942897,6302,Larceny/theft,Petty Theft From A Building,Wednesday,2013-11-06,12:00,Richmond,None,6100 Block Of Fulton St,-122.496505445596,37.7719526452281
13041660415200,130416604,15200,SecondaryCodes,Domestic Violence,Saturday,2012-05-19,18:00,Bayview,Complainant Refuses To Prosecute,6600 Block Of 3rd St,-122.398315314856,37.7181339755846
11100331909016,111003319,9016,Forgery/counterfeiting,"Checks Or Legal Instruments, Uttering Forged",Thursday,2011-12-15,08:40,Northern,None,1400 Block Of Fillmore St,-122.432544280591,37.7828388666355
6022851509340,60228515,9340,Fraud,Fraudulent Credit Application,Sunday,2005-11-06,06:00,Ingleside,Not Prosecuted,200 Block Of Santos St,-122.419657380352,37.709094924139
3135198316662,31351983,16662,Drug/narcotic,Possession Of Controlled Substance For Sale,Tuesday,2003-11-18,08:55,Tenderloin,"Arrest, Booked","Jones St, Golden Gate Avenue",-122.412224164743,37.78207293118
8114852064020,81148520,64020,Non-criminal,"Aided Case, Mental Disturbed",Monday,2008-10-27,01:20,Ingleside,None,100 Block Of Appleton Avenue,-122.42189877187,37.7379500847076
7038587628165,70385876,28165,Vandalism,"Malicious Mischief, Graffiti",Sunday,2007-04-15,22:30,Southern,None,800 Block Of Bryant St,-122.403404791479,37.775420706711
8006089263010,80060892,63010,Warrants,Warrant Arrest,Thursday,2008-01-17,19:09,Tenderloin,"Arrest, Booked",0 Block Of Turk St,-122.409853729941,37.7833862379382
12062885307021,120628853,7021,VehicleTheft,Stolen Automobile,Wednesday,2012-08-08,19:00,Taraval,None,"25th Av, Irving St",-122.483552403515,37.7632782053122
10099641003074,100996410,3074,Robbery,"Robbery, Bodily Force",Tuesday,2010-10-26,19:51,Ingleside,"Arrest, Booked","Visitacion Av, Schwerin St",-122.410641280689,37.7122058691973
5114661771000,51146617,71000,Non-criminal,Lost Property,Saturday,2005-10-08,18:00,Northern,None,1500 Block Of Pine St,-122.421341005458,37.7895684897255
7059632404134,70596324,4134,Assault,Battery,Wednesday,2007-06-13,06:50,Southern,None,"Market St, Mason St",-122.408953598279,37.783287873572
12061082264020,120610822,64020,Non-criminal,"Aided Case, Mental Disturbed",Thursday,2012-08-02,16:57,Mission,Psychopathic Case,2800 Block Of Mission St,-122.418296094437,37.7514284856786
12051739765015,120517397,65015,OtherOffenses,Traffic Violation,Sunday,2012-07-01,09:20,Bayview,"Arrest, Cited","Jennings St, Fitzgerald Avenue",-122.393174162423,37.722036232083
4082021606304,40820216,6304,Larceny/theft,Grand Theft From A Building,Sunday,2004-07-18,16:00,Mission,None,2600 Block Of 21st St,-122.408197661326,37.7576232173354
8128235065015,81282350,65015,OtherOffenses,Traffic Violation,Monday,2008-12-01,11:31,Ingleside,"Arrest, Cited",4900 Block Of Mission St,-122.438695075365,37.7196920262929
12012682972000,120126829,72000,Non-criminal,Found Property,Tuesday,2012-02-14,15:33,Northern,None,"Turk St, Fillmore St",-122.432142776025,37.780495583709
8028470764070,80284707,64070,SuspiciousOcc,Suspicious Occurrence,Monday,2008-03-17,11:00,Mission,Unfounded,"26th St, Castro St",-122.433770279928,37.7480963338973
8128270816623,81282708,16623,Drug/narcotic,Possession Of Base/rock Cocaine For Sale,Monday,2008-12-01,11:53,Southern,"Arrest, Booked",1700 Block Of Market St,-122.422188261426,37.7726948236861
6133586606244,61335866,6244,Larceny/theft,Grand Theft From Locked Auto,Saturday,2006-12-16,22:00,Mission,None,"Bryant St, 24th St",-122.409131939489,37.7527969985584
8086908671010,80869086,71010,OtherOffenses,Lost/stolen License Plate,Sunday,2008-08-17,19:30,Taraval,None,500 Block Of Pacheco St,-122.465950188066,37.751017267203
10075708028135,100757080,28135,OtherOffenses,Harassing Phone Calls,Thursday,2010-08-12,16:00,Ingleside,Exceptional Clearance,200 Block Of Brookdale Avenue,-122.423098270217,37.7103045151288
9125374927170,91253749,27170,OtherOffenses,Resisting Arrest,Friday,2009-12-04,23:36,Park,"Arrest, Booked",900 Block Of Burnett Avenue,-122.444935228433,37.7481925988058
7604205606244,76042056,6244,Larceny/theft,Grand Theft From Locked Auto,Saturday,2007-06-16,22:00,Northern,None,0 Block Of Haight St,-122.423023243605,37.7731064642904
7059363709020,70593637,9020,Forgery/counterfeiting,"Checks, Make Or Pass Fictitious",Friday,2007-06-01,09:00,Northern,None,2100 Block Of Vanness Avenue,-122.42315068625,37.7953061262191
6042865206244,60428652,6244,Larceny/theft,Grand Theft From Locked Auto,Friday,2006-04-21,22:00,Central,None,300 Block Of Lombard St,-122.407708273853,37.803432762656
3141660663010,31416606,63010,Warrants,Warrant Arrest,Thursday,2003-12-04,17:20,Tenderloin,"Arrest, Booked",100 Block Of Leavenworth St,-122.413893155951,37.782346520673
12066967504092,120669675,4092,Assault,"Assault, Aggravated, W/ Gun",Wednesday,2012-08-22,18:17,Bayview,"Arrest, Booked","Palou Av, Crisp Rd",-122.379995240289,37.7277878206282
12099162228100,120991622,28100,Vandalism,"Malicious Mischief, Breaking Windows",Sunday,2012-12-09,02:10,Central,None,1000 Block Of Sutter St,-122.417650682357,37.7880158477339
5056563406365,50565634,6365,Larceny/theft,Petty Theft With Prior,Saturday,2005-05-21,07:35,Southern,"Arrest, Booked",800 Block Of Market St,-122.406520987144,37.7850629421661
4108874006243,41088740,6243,Larceny/theft,Petty Theft From Locked Auto,Wednesday,2004-09-22,20:00,Mission,None,"21st St, Lexington St",-122.420341260853,37.7569495275631
13010096075000,130100960,75000,MissingPerson,Found Person,Monday,2013-02-04,18:04,Mission,None,400 Block Of Castro St,-122.435150099812,37.7617597243598
10086733865016,100867338,65016,OtherOffenses,"Drivers License, Suspended Or Revoked",Saturday,2010-09-18,22:05,Taraval,None,"Randolph St, Arch St",-122.467092240422,37.7142735660512
3089618604014,30896186,4014,Assault,Aggravated Assault With Bodily Force,Tuesday,2003-07-29,08:00,Ingleside,None,100 Block Of Athens St,-122.425247698124,37.725787458004
12101748551040,121017485,51040,Non-criminal,Aided Case,Tuesday,2012-12-18,09:40,Southern,Psychopathic Case,800 Block Of Bryant St,-122.403404791479,37.775420706711
