id,incident_number,incident_code,category,descript,day_of_the_week,date,time,police_dept_district,resolution,address,location_x_axis,location_y_axis
10052363719090,100523637,19090,Drunkenness,Under Influence Of Alcohol In A Public Place,Sunday,2010-06-06,06:30,Bayview,"Arrest, Booked","23rd St, Rhodeisland St",-122.401590336879,37.7545698243645
11084739216652,110847392,16652,Drug/narcotic,Possession Of Meth-amphetamine For Sale,Thursday,2011-10-20,15:06,Ingleside,"Arrest, Booked",1800 Block Of Sunnydale Avenue,-122.417107986993,37.7122561827524
7603312406244,76033124,6244,Larceny/theft,Grand Theft From Locked Auto,Sunday,2007-05-20,14:00,Northern,None,"Fulton St, Steiner St",-122.433220475299,37.7774892652621
9609483306244,96094833,6244,Larceny/theft,Grand Theft From Locked Auto,Tuesday,2009-09-29,21:00,Southern,None,"Harrison St, The Embarcaderosouth St",-122.388485562387,37.789572762563
12085777371000,120857773,71000,Non-criminal,Lost Property,Sunday,2012-10-21,22:00,Mission,None,3000 Block Of Mission St,-122.418163204335,37.7485889485524
6028406226150,60284062,26150,OtherOffenses,Parole Violation,Wednesday,2006-03-15,14:08,Park,"Arrest, Booked",200 Block Of Divisadero St,-122.437252069809,37.7717213027751
7021780965016,70217809,65016,OtherOffenses,"Drivers License, Suspended Or Revoked",Thursday,2007-03-01,17:35,Bayview,"Arrest, Cited","Cesar Chavez St, Vermont St",-122.402868034981,37.7494783929125
4131130305013,41311303,5013,Burglary,"Burglary Of Apartment House, Unlawful Entry",Monday,2004-11-08,09:00,Ingleside,None,0 Block Of Tucker Avenue,-122.404586629869,37.7154432787137
11602793806244,116027938,6244,Larceny/theft,Grand Theft From Locked Auto,Wednesday,2011-03-02,16:00,Ingleside,None,2500 Block Of Diamond St,-122.434792451657,37.7373721310386
12021973128160,120219731,28160,Vandalism,"Malicious Mischief, Vandalism Of Vehicles",Friday,2012-03-16,19:45,Southern,None,800 Block Of Bryant St,-122.403404791479,37.775420706711
6052294706374,60522947,6374,Larceny/theft,Grand Theft Of Property,Tuesday,2006-05-16,09:00,Tenderloin,None,300 Block Of Mason St,-122.409756223507,37.7869126924267
9039886505073,90398865,5073,Burglary,"Burglary, Unlawful Entry",Thursday,2009-04-16,17:10,Ingleside,None,300 Block Of Lagrande Avenue,-122.425591802243,37.7197426710766
12068925306153,120689253,6153,Larceny/theft,Grand Theft From Person,Sunday,2012-08-26,10:00,Southern,None,500 Block Of 5th St,-122.39998111124,37.7776242389287
7104550063010,71045500,63010,Warrants,Warrant Arrest,Thursday,2007-10-11,19:10,Tenderloin,"Arrest, Booked",200 Block Of Turk St,-122.413237516676,37.7828430233213
5107829228160,51078292,28160,Vandalism,"Malicious Mischief, Vandalism Of Vehicles",Sunday,2005-09-25,12:45,Mission,"Arrest, Booked",0 Block Of Brosnan St,-122.423356925403,37.7686357546846
7059853006244,70598530,6244,Larceny/theft,Grand Theft From Locked Auto,Wednesday,2007-06-13,07:00,Northern,None,"Vanness Av, Hayes St",-122.419697721691,37.7773009526003
13033522016710,130335220,16710,Drug/narcotic,Possession Of Narcotics Paraphernalia,Wednesday,2013-04-24,12:36,Richmond,"Arrest, Cited",400 Block Of 28th Avenue,-122.488083217932,37.7808891871743
7071358419057,70713584,19057,Assault,Threats Against Life,Sunday,2007-07-15,16:49,Mission,"Arrest, Booked","Sancarlos St, 20th St",-122.419843759487,37.7585838119382
8036036316710,80360363,16710,Drug/narcotic,Possession Of Narcotics Paraphernalia,Sunday,2008-04-06,21:35,Tenderloin,"Arrest, Booked","Golden Gate Av, Leavenworth St",-122.413869632554,37.7818621883021
4038647809310,40386478,9310,Fraud,"Credit Card, Theft Of",Sunday,2004-04-04,15:25,Richmond,None,0 Block Of Presidio Avenue,-122.447656988785,37.7912458280451
7040313363010,70403133,63010,Warrants,Warrant Arrest,Friday,2007-04-20,00:11,Northern,"Arrest, Booked","Olive St, Larkin St",-122.4178091031,37.7847098968616
4005563905071,40055639,5071,Burglary,"Burglary, Forcible Entry",Thursday,2004-01-15,03:29,Central,None,1000 Block Of Grant Avenue,-122.406810062197,37.7964631364923
9602540206244,96025402,6244,Larceny/theft,Grand Theft From Locked Auto,Wednesday,2009-04-08,16:00,Park,None,0 Block Of Glendale St,-122.442659681596,37.756279762576
6034950319057,60349503,19057,Assault,Threats Against Life,Saturday,2006-04-01,15:00,Southern,None,800 Block Of Bryant St,-122.403404791479,37.775420706711
4147023827090,41470238,27090,Larceny/theft,"Lost Property, Petty Theft",Sunday,2004-12-19,11:30,Central,None,200 Block Of Grant Avenue,-122.405254463024,37.7892525040522
7121498764080,71214987,64080,SuspiciousOcc,Suspicious Person,Tuesday,2007-11-27,11:05,Mission,None,"South Van Ness Av, 16th St",-122.417488323639,37.7651818039906
7054613165016,70546131,65016,OtherOffenses,"Drivers License, Suspended Or Revoked",Tuesday,2007-05-29,20:30,Bayview,"Arrest, Cited","20th St, 3rd St",-122.388559411328,37.7604929243617
11054608307200,110546083,7200,OtherOffenses,False Evidence Of Vehicle Registration,Thursday,2011-07-07,18:41,Ingleside,"Arrest, Cited",3500 Block Of Mission St,-122.423404548611,37.7402756023882
6088173763010,60881737,63010,Warrants,Warrant Arrest,Saturday,2006-08-19,13:10,Tenderloin,"Arrest, Booked",700 Block Of Ofarrell St,-122.417107256373,37.7853238292094
6083496809320,60834968,9320,Fraud,"Credit Card, Theft By Use Of",Thursday,2006-07-20,23:59,Ingleside,None,3400 Block Of Mission St,-122.422286651689,37.7420041169835
12044697806371,120446978,6371,Larceny/theft,Petty Theft Of Property,Tuesday,2012-06-05,18:15,Mission,None,"Cesar Chavez St, Mission St",-122.418221946229,37.7481664083985
13014320528100,130143205,28100,Vandalism,"Malicious Mischief, Breaking Windows",Friday,2013-02-08,08:00,Ingleside,None,500 Block Of Precita Avenue,-122.410106428722,37.7472418497075
9004386616625,90043866,16625,Drug/narcotic,Sale Of Base/rock Cocaine,Tuesday,2009-01-13,12:11,Mission,"Arrest, Booked",2000 Block Of Mission St,-122.41965834371,37.7642205603745
13071470928165,130714709,28165,Vandalism,"Malicious Mischief, Graffiti",Tuesday,2013-08-27,15:15,Bayview,"Arrest, Cited",1200 Block Of Michigan St,-122.385839094171,37.7535777318866
7035608726170,70356087,26170,OtherOffenses,Probation Violation,Saturday,2007-04-07,11:13,Tenderloin,"Arrest, Booked","Eddy St, Hyde St",-122.415885065788,37.7835160564153
11016516665016,110165166,65016,OtherOffenses,"Drivers License, Suspended Or Revoked",Friday,2011-02-25,13:10,Ingleside,"Arrest, Cited","Sunnydale Av, Santos St",-122.418283197104,37.7123508590096
3135064019022,31350640,19022,DisorderlyConduct,Disturbing The Peace,Monday,2003-11-17,20:35,Northern,None,"Haight St, Octavia St",-122.423869271704,37.7729422631024
5031542371000,50315423,71000,Non-criminal,Lost Property,Thursday,2005-03-17,12:00,Mission,None,2100 Block Of 16th St,-122.408054148234,37.7658071389786
12061582228160,120615822,28160,Vandalism,"Malicious Mischief, Vandalism Of Vehicles",Saturday,2012-08-04,10:46,Richmond,None,500 Block Of Johnfkennedy Dr,-122.466204667893,37.7725405391593
8021951664070,80219516,64070,SuspiciousOcc,Suspicious Occurrence,Saturday,2008-03-01,03:01,Mission,None,"24th St, Mission St",-122.418448186101,37.7522391652625
10604004771000,106040047,71000,Non-criminal,Lost Property,Sunday,2010-03-28,20:00,Northern,None,3100 Block Of Fillmore St,-122.43575101831,37.7987282178823
9042214168020,90422141,68020,OtherOffenses,Miscellaneous Investigation,Wednesday,2009-04-22,18:45,Northern,None,1000 Block Of Fillmore St,-122.431927647615,37.7790983243181
12006701364085,120067013,64085,SuspiciousOcc,Investigative Detention,Tuesday,2012-01-24,22:54,Bayview,None,0 Block Of Maddux Avenue,-122.398371210091,37.733938077148
12011496507021,120114965,7021,VehicleTheft,Stolen Automobile,Thursday,2012-02-09,21:00,Ingleside,None,"Ward St, Girard St",-122.401122464539,37.7189799997236
9609611871000,96096118,71000,Non-criminal,Lost Property,Sunday,2009-09-27,07:00,Richmond,None,2300 Block Of Golden Gate Avenue,-122.449116002905,37.7773216006661
5125994715150,51259947,15150,OtherOffenses,Violation Of Restraining Order,Monday,2005-11-07,18:04,Park,None,1500 Block Of Turk St,-122.434631237377,37.7802343955112
5042881616650,50428816,16650,Drug/narcotic,Possession Of Meth-amphetamine,Monday,2005-04-18,11:00,Park,"Arrest, Booked",700 Block Of Panorama Dr,-122.454090476739,37.7534123449924
9017169926150,90171699,26150,OtherOffenses,Parole Violation,Monday,2009-02-16,20:50,Tenderloin,"Arrest, Booked",100 Block Of Jones St,-122.412249767634,37.782556330202
6016193765010,60161937,65010,OtherOffenses,Traffic Violation Arrest,Saturday,2006-02-11,20:01,Ingleside,"Arrest, Booked","Alemany Bl, Geneva Avenue",-122.442326614218,37.7178353145571
3131149826150,31311498,26150,OtherOffenses,Parole Violation,Friday,2003-11-07,16:00,Mission,"Arrest, Booked","19th St, Folsom St",-122.414845139214,37.7605000726041
7058555904014,70585559,4014,Assault,Aggravated Assault With Bodily Force,Sunday,2007-06-10,01:45,Park,"Arrest, Booked",0 Block Of Baker St,-122.440383635898,37.7713219755505
5119993906374,51199939,6374,Larceny/theft,Grand Theft Of Property,Thursday,2005-10-20,11:00,Northern,None,2900 Block Of Webster St,-122.433874688712,37.7977817126685
9067516806244,90675168,6244,Larceny/theft,Grand Theft From Locked Auto,Thursday,2009-07-02,17:20,Central,None,900 Block Of Northpoint St,-122.422857719558,37.8054440413944
11039921806304,110399218,6304,Larceny/theft,Grand Theft From A Building,Tuesday,2011-05-17,09:00,Central,None,600 Block Of Davis St,-122.398447802857,37.7980037233355
7111695706374,71116957,6374,Larceny/theft,Grand Theft Of Property,Wednesday,2007-10-31,00:45,Northern,None,2000 Block Of Union St,-122.433052223884,37.7974547210515
8102228103083,81022281,3083,Robbery,Carjacking With A Dangerous Weapon,Thursday,2008-09-25,20:40,Ingleside,None,200 Block Of Maynard St,-122.424915560486,37.7295080178827
11008529127122,110085291,27122,WeaponLaws,Firearm With Altered Identification,Thursday,2011-01-27,22:13,Ingleside,"Arrest, Booked",3100 Block Of Harrison St,-122.411504150729,37.7477859069595
12015057703071,120150577,3071,Robbery,"Robbery, Armed With A Gun",Thursday,2012-02-23,00:15,Ingleside,None,500 Block Of Alemany Bl,-122.421305348396,37.7321638759455
11100608475000,111006084,75000,MissingPerson,Found Person,Friday,2011-12-16,15:40,Central,Located,1000 Block Of Clay St,-122.410786921931,37.7937490287187
12019901472000,120199014,72000,Non-criminal,Found Property,Saturday,2012-03-10,13:51,Northern,None,200 Block Of Webster St,-122.428875899713,37.7730292536228
9069067716030,90690677,16030,Drug/narcotic,Possession Of Marijuana For Sales,Tuesday,2009-07-07,13:43,Park,"Arrest, Booked",0 Block Of Kezar Dr,-122.45512727517,37.7695200227183
7036005064070,70360050,64070,SuspiciousOcc,Suspicious Occurrence,Sunday,2007-04-08,15:15,Ingleside,None,500 Block Of Avalon Avenue,-122.428111302642,37.7256596307906
12091227019400,120912270,19400,SecondaryCodes,Gang Activity,Sunday,2012-11-11,02:30,Mission,None,500 Block Of Valencia St,-122.421738508476,37.7640972229024
12100777106244,121007771,6244,Larceny/theft,Grand Theft From Locked Auto,Friday,2012-12-14,00:01,Mission,None,1100 Block Of Vermont St,-122.403513955008,37.7550864947417
9058986016623,90589860,16623,Drug/narcotic,Possession Of Base/rock Cocaine For Sale,Monday,2009-06-08,16:15,Tenderloin,"Arrest, Booked",400 Block Of Ellis St,-122.413609328985,37.784696907904
13050836464085,130508364,64085,SuspiciousOcc,Investigative Detention,Thursday,2013-06-20,22:27,Bayview,None,"Navy Rd, Griffith St",-122.37854421405,37.7289426950962
6041285965016,60412859,65016,OtherOffenses,"Drivers License, Suspended Or Revoked",Tuesday,2006-04-18,10:40,Northern,"Arrest, Cited","Church St, Duboce Avenue",-122.429128783477,37.7694556178593
7010848064070,70108480,64070,SuspiciousOcc,Suspicious Occurrence,Monday,2007-01-15,19:00,Mission,Unfounded,200 Block Of Church St,-122.428951613741,37.766799959982
3003079868020,30030798,68020,OtherOffenses,Miscellaneous Investigation,Wednesday,2003-01-08,12:15,Park,None,300 Block Of Laguna Honda Bl,-122.458680189782,37.7481554692332
9054055516664,90540555,16664,Drug/narcotic,Sale Of Controlled Substance,Monday,2009-05-25,13:05,Tenderloin,"Arrest, Booked","Turk St, Jones St",-122.412414263581,37.7830037964534
3069116873000,30691168,73000,Non-criminal,Property For Identification,Saturday,2003-06-07,20:15,Mission,None,"18th St, Dolores St",-122.426079580553,37.7614267757518
9097310028160,90973100,28160,Vandalism,"Malicious Mischief, Vandalism Of Vehicles",Sunday,2009-09-20,20:15,Mission,"Arrest, Booked",1300 Block Of Castro St,-122.434116168391,37.7508871106101
12009233326063,120092333,26063,Bribery,"Dissuading Witness, Victim",Thursday,2012-02-02,15:15,Northern,"Arrest, Booked",900 Block Of Franklin St,-122.42258112165,37.7829192180689
8012718565015,80127185,65015,OtherOffenses,Traffic Violation,Tuesday,2008-02-05,22:24,Park,"Arrest, Booked","Pierce St, Page St",-122.433924307791,37.7726211586507
8032984205152,80329842,5152,Burglary,"Burglary,store Under Construction, Att. Forcible",Friday,2008-03-28,20:15,Northern,None,0 Block Of Sanchez St,-122.431342864403,37.7684539072982
8110197603014,81101976,3014,Robbery,"Robbery On The Street, Strongarm",Monday,2008-10-13,20:45,Park,None,"Lyon St, Grove St",-122.442946750803,37.7752938920622
4133234305013,41332343,5013,Burglary,"Burglary Of Apartment House, Unlawful Entry",Monday,2004-11-22,01:30,Northern,None,1800 Block Of Pacific Avenue,-122.425719698405,37.7945546414296
2116580763010,21165807,63010,Warrants,Warrant Arrest,Monday,2004-07-05,16:46,Northern,"Arrest, Booked",0 Block Of Fell St,-122.418500584434,37.7764380944444
11048143906363,110481439,6363,Larceny/theft,Petty Theft Shoplifting,Wednesday,2011-06-15,13:25,Tenderloin,"Arrest, Cited",100 Block Of Ofarrell St,-122.407244087032,37.7865647607685
11606636206244,116066362,6244,Larceny/theft,Grand Theft From Locked Auto,Friday,2011-05-20,23:30,Central,None,1500 Block Of Stockton St,-122.409035282337,37.7999845229184
3048098311010,30480983,11010,StolenProperty,Receiving Stolen Property,Thursday,2003-04-24,13:07,Southern,"Arrest, Booked",1200 Block Of Market St,-122.415448759562,37.778293520129
12002205104011,120022051,4011,Assault,Aggravated Assault With A Gun,Monday,2012-01-09,00:55,Mission,None,2700 Block Of Mission St,-122.41844919178,37.7530267515876
3118489706361,31184897,6361,Larceny/theft,Petty Theft Shoplifting,Wednesday,2003-10-08,10:30,Tenderloin,"Arrest, Cited",0 Block Of Ofarrell St,-122.405895369887,37.7867342184983
7102006305041,71020063,5041,Burglary,"Burglary Of Residence, Forcible Entry",Thursday,2007-10-04,09:00,Bayview,None,400 Block Of Amherst St,-122.415115941771,37.7239444802397
4145722005011,41457220,5011,Burglary,"Burglary Of Apartment House, Forcible Entry",Friday,2004-12-24,21:00,Bayview,None,1000 Block Of 23rd St,-122.390458984333,37.755186717447
9042013971000,90420139,71000,Non-criminal,Lost Property,Friday,2009-04-17,08:30,Southern,None,800 Block Of Bryant St,-122.403404791479,37.775420706711
13105990006114,131059900,6114,Larceny/theft,Grand Theft Pickpocket,Tuesday,2013-12-17,13:00,Southern,None,800 Block Of Bryant St,-122.403404791479,37.775420706711
6062850163010,60628501,63010,Warrants,Warrant Arrest,Tuesday,2006-06-13,22:49,Bayview,"Arrest, Booked","Mckinnon Av, Newhall St",-122.391090325597,37.7369085657287
11041576762050,110415767,62050,Warrants,Enroute To Outside Jurisdiction,Monday,2011-05-23,11:20,Southern,"Arrest, Booked",800 Block Of Bryant St,-122.403404791479,37.775420706711
13614595206374,136145952,6374,Larceny/theft,Grand Theft Of Property,Thursday,2013-08-15,07:40,Northern,None,1700 Block Of Pine St,-122.424606849092,37.7890426863656
6019259009150,60192590,9150,Forgery/counterfeiting,"Forgery, Notes",Sunday,2006-02-19,19:02,Southern,"Arrest, Booked",1100 Block Of Market St,-122.413564091744,37.779514030063
13067603064070,130676030,64070,SuspiciousOcc,Suspicious Occurrence,Sunday,2013-08-04,12:00,Northern,None,500 Block Of Vanness Avenue,-122.420243933127,37.7808347556477
11093711916621,110937119,16621,Drug/narcotic,Possession Of Base/rock Cocaine,Monday,2011-11-21,05:06,Northern,"Arrest, Booked","Willow St, Polk St",-122.419274801449,37.7835680535207
3094833926150,30948339,26150,OtherOffenses,Parole Violation,Monday,2003-08-11,14:12,Tenderloin,"Arrest, Booked",0 Block Of Turk St,-122.409849441655,37.7832755202567
3029708907020,30297089,7020,VehicleTheft,Stolen And Recovered Vehicle,Wednesday,2003-03-12,11:00,Taraval,None,100 Block Of Corona St,-122.466235239779,37.7244048814203
13059303616710,130593036,16710,Drug/narcotic,Possession Of Narcotics Paraphernalia,Saturday,2013-07-13,00:05,Mission,"Arrest, Booked","16th St, Valencia St",-122.421886357981,37.7649178909424
11028100716625,110281007,16625,Drug/narcotic,Sale Of Base/rock Cocaine,Wednesday,2011-04-06,18:54,Tenderloin,"Arrest, Booked","Golden Gate Av, Hyde St",-122.415508242782,37.7816542806076
6018593716625,60185937,16625,Drug/narcotic,Sale Of Base/rock Cocaine,Friday,2006-02-17,17:45,Ingleside,"Arrest, Booked","Mission St, Cortland Avenue",-122.422842376051,37.7410287442117
13014370003474,130143700,3474,Robbery,Attempted Robbery With Bodily Force,Monday,2013-02-18,21:17,Northern,None,800 Block Of Ofarrell St,-122.418751252829,37.7851160049429
3139082816710,31390828,16710,Drug/narcotic,Possession Of Narcotics Paraphernalia,Thursday,2003-11-27,18:34,Tenderloin,"Arrest, Booked","Ellis St, Jones St",-122.412784096509,37.7848656939297
6135912361020,61359123,61020,Non-criminal,"Death, Non-manslaughter Auto Accident",Saturday,2006-12-23,21:22,Mission,None,3300 Block Of 25th St,-122.418036313252,37.7507099034324
9000410305071,90004103,5071,Burglary,"Burglary, Forcible Entry",Friday,2009-01-02,04:00,Northern,None,1500 Block Of Bay St,-122.43253044394,37.8032140328664
3148414203051,31484142,3051,Robbery,Robbery Of A Residence With A Gun,Monday,2003-12-22,16:00,Ingleside,None,100 Block Of Campbell Avenue,-122.401088027158,37.714930574379
6601780906244,66017809,6244,Larceny/theft,Grand Theft From Locked Auto,Wednesday,2006-03-15,19:15,Central,None,500 Block Of Beach St,-122.418111096758,37.8070199998601
7045656864080,70456568,64080,SuspiciousOcc,Suspicious Person,Friday,2007-05-04,19:36,Bayview,"Arrest, Booked","Keith St, Thomas Avenue",-122.389421299039,37.7293538492444
4072453306112,40724533,6112,Larceny/theft,Grand Theft Pickpocket,Thursday,2004-06-24,14:30,Central,None,500 Block Of Geary St,-122.41275532583,37.7867259286124
9126387307021,91263873,7021,VehicleTheft,Stolen Automobile,Monday,2009-12-07,06:00,Mission,None,900 Block Of Potrero Avenue,-122.406870402082,37.7572895904578
5010352911010,50103529,11010,StolenProperty,Receiving Stolen Property,Tuesday,2005-01-25,00:01,Northern,None,2500 Block Of Fillmore St,-122.434579028616,37.792926508556
5068147862020,50681478,62020,Warrants,Enroute To Department Of Corrections,Saturday,2005-06-18,15:43,Northern,"Arrest, Booked","Myrtle St, Larkin St",-122.417999278698,37.7856407526414
8058974516040,80589745,16040,Drug/narcotic,Sale Of Marijuana,Thursday,2008-06-05,14:55,Tenderloin,"Arrest, Booked",0 Block Of Jones St,-122.412054141237,37.7816136403158
12034710004170,120347100,4170,Assault,False Imprisonment,Wednesday,2012-05-02,00:46,Bayview,"Arrest, Booked",6200 Block Of 3rd St,-122.395918665947,37.722108976156
12064484304138,120644843,4138,Assault,"Battery, Former Spouse Or Dating Relationship",Monday,2012-07-30,08:00,Northern,None,1000 Block Of Polk St,-122.419858277339,37.786137125238
6041932274000,60419322,74000,MissingPerson,Missing Adult,Tuesday,2006-04-18,13:30,Mission,None,700 Block Of Capp St,-122.417511996621,37.754691084878
12034390415200,120343904,15200,SecondaryCodes,Domestic Violence,Monday,2012-04-30,19:15,Tenderloin,None,100 Block Of Taylor St,-122.410928353347,37.7836778741124
7114767306244,71147673,6244,Larceny/theft,Grand Theft From Locked Auto,Sunday,2007-11-04,10:00,Taraval,None,1500 Block Of Eucalyptus Dr,-122.487500161818,37.7309003421445
13027761616662,130277616,16662,Drug/narcotic,Possession Of Controlled Substance For Sale,Friday,2013-04-05,00:01,Tenderloin,"Arrest, Booked",100 Block Of Leavenworth St,-122.413893155951,37.782346520673
8077990265015,80779902,65015,OtherOffenses,Traffic Violation,Thursday,2008-07-24,22:16,Central,"Arrest, Cited","Post St, Powell St",-122.408403859899,37.7882933915158
3027980506243,30279805,6243,Larceny/theft,Petty Theft From Locked Auto,Friday,2003-03-07,23:40,Taraval,None,200 Block Of Buckingham Wy,-122.478884586609,37.7258438313416
12049896372000,120498963,72000,Non-criminal,Found Property,Sunday,2012-06-24,15:00,Bayview,None,2500 Block Of Marin St,-122.402767417355,37.7482203413295
5009955865016,50099558,65016,OtherOffenses,"Drivers License, Suspended Or Revoked",Wednesday,2005-01-26,12:35,Southern,"Arrest, Cited","9th St, Minna St",-122.414177161799,37.7758002573111
8085513209320,80855132,9320,Fraud,"Credit Card, Theft By Use Of",Sunday,2008-06-29,12:00,Ingleside,None,700 Block Of Rolph St,-122.431015257276,37.7117445002313
7019022716710,70190227,16710,Drug/narcotic,Possession Of Narcotics Paraphernalia,Wednesday,2007-02-21,16:22,Southern,"Arrest, Booked",800 Block Of Market St,-122.406520987144,37.7850629421661
9014474327065,90144743,27065,Fraud,False Id To Peace Officer,Monday,2009-02-09,11:43,Central,"Arrest, Booked",1200 Block Of Stockton St,-122.408562639884,37.7970067945044
9075787904013,90757879,4013,Assault,Aggravated Assault With A Deadly Weapon,Sunday,2009-07-26,01:25,Central,"Arrest, Booked","Geary St, Mason St",-122.409876622532,37.787148807979
9061928507021,90619285,7021,VehicleTheft,Stolen Automobile,Sunday,2009-06-14,11:00,Southern,None,300 Block Of Beale St,-122.391985513707,37.7880203829063
6005418864020,60054188,64020,Non-criminal,"Aided Case, Mental Disturbed",Saturday,2006-01-14,18:25,Northern,Psychopathic Case,800 Block Of Hayes St,-122.43040309844,37.7759915316036
11026102165016,110261021,65016,OtherOffenses,"Drivers License, Suspended Or Revoked",Wednesday,2011-03-30,22:04,Taraval,"Arrest, Booked",1500 Block Of Pacheco St,-122.476737809893,37.7505419599127
12007982064085,120079820,64085,SuspiciousOcc,Investigative Detention,Sunday,2012-01-29,02:21,Southern,None,0 Block Of Dore St,-122.412933062384,37.7739274524819
10018562974000,100185629,74000,MissingPerson,Missing Adult,Wednesday,2010-02-24,22:00,Bayview,None,0 Block Of Ledyard St,-122.402116556292,37.7332354676556
5056356964070,50563569,64070,SuspiciousOcc,Suspicious Occurrence,Friday,2005-05-20,17:15,Southern,None,800 Block Of Bryant St,-122.403404791479,37.775420706711
13052560304013,130525603,4013,Assault,Aggravated Assault With A Deadly Weapon,Wednesday,2013-06-26,18:15,Bayview,"Arrest, Booked",1600 Block Of Shafter Avenue,-122.39123221352,37.7313908777775
9081088104134,90810881,4134,Assault,Battery,Sunday,2009-08-09,18:10,Taraval,"Arrest, Booked",0 Block Of Broad St,-122.454756002084,37.7132579074067
6138090204114,61380902,4114,Assault,Attempted Simple Assault,Sunday,2006-12-31,02:12,Southern,"Arrest, Booked","6th St, Bryant St",-122.402527594665,37.7760382838346
5022255504011,50222555,4011,Assault,Aggravated Assault With A Gun,Saturday,2005-02-26,02:10,Southern,None,500 Block Of Bryant St,-122.397501734179,37.7800859438702
8603581906244,86035819,6244,Larceny/theft,Grand Theft From Locked Auto,Wednesday,2008-05-07,21:30,Richmond,None,"4th Av, Geary Bl",-122.462141270182,37.7811098899332
8023670826170,80236708,26170,OtherOffenses,Probation Violation,Wednesday,2008-03-05,14:30,Northern,"Arrest, Booked","Cedar St, Larkin St",-122.418182397674,37.7865662290665
8020835906304,80208359,6304,Larceny/theft,Grand Theft From A Building,Tuesday,2008-01-01,10:00,Taraval,None,200 Block Of Westportal Avenue,-122.468117499815,37.7389000144845
13060330606222,130603306,6222,Larceny/theft,Petty Theft From Unlocked Auto,Tuesday,2013-07-09,15:30,Park,None,0 Block Of Levant St,-122.442259650589,37.7642194454928
9114952416010,91149524,16010,Drug/narcotic,Possession Of Marijuana,Saturday,2009-11-07,18:00,Tenderloin,"Arrest, Cited",0 Block Of Powell St,-122.407845374111,37.7850943210103
11035546419057,110355464,19057,Assault,Threats Against Life,Friday,2010-01-01,00:01,Central,None,1300 Block Of Sacramento St,-122.41459097819,37.792360250298
13103727906374,131037279,6374,Larceny/theft,Grand Theft Of Property,Monday,2013-12-09,01:00,Tenderloin,None,"Turk St, Leavenworth St",-122.414056291891,37.7827931071006
9605368506244,96053685,6244,Larceny/theft,Grand Theft From Locked Auto,Sunday,2009-07-12,23:00,Southern,None,"Minna St, 8th St",-122.412620258006,37.7770259271797
3140654402004,31406544,2004,"SexOffenses,Forcible","Forcible Rape, Bodily Force",Sunday,2003-11-30,20:30,Northern,"Arrest, Booked",800 Block Of Ofarrell St,-122.418729600557,37.785007503993
8604853306244,86048533,6244,Larceny/theft,Grand Theft From Locked Auto,Thursday,2008-06-26,20:30,Southern,None,"The Embarcaderosouth St, Howard St",-122.391004273278,37.7925182655105
12032341703011,120323417,3011,Robbery,Robbery On The Street With A Gun,Monday,2012-04-23,23:10,Central,None,1300 Block Of Kearny St,-122.405999142498,37.8003678866966
13600623528150,136006235,28150,Vandalism,"Malicious Mischief, Vandalism",Friday,2013-01-04,08:00,Taraval,None,500 Block Of Gonzalez Dr,-122.477975897762,37.7160190677349
7102713806360,71027138,6360,Larceny/theft,Attempted Shoplifting,Tuesday,2007-09-25,10:58,Tenderloin,None,100 Block Of Ofarrell St,-122.407244087032,37.7865647607685
7041859606224,70418596,6224,Larceny/theft,Grand Theft From Unlocked Auto,Saturday,2007-03-24,23:00,Southern,None,400 Block Of 7th St,-122.405187364125,37.7745529324018
11054691404134,110546914,4134,Assault,Battery,Friday,2011-07-08,01:52,Southern,"Arrest, Booked","5th St, Howard St",-122.404934413339,37.7814987213218
7003309704012,70033097,4012,Assault,Aggravated Assault With A Knife,Wednesday,2007-01-10,00:02,Ingleside,None,4600 Block Of Mission St,-122.435041282959,37.7242560470421
