id,incident_number,incident_code,category,descript,day_of_the_week,date,time,police_dept_district,resolution,address,location_x_axis,location_y_axis
5096689464080,50966894,64080,SuspiciousOcc,Suspicious Person,Sunday,2005-08-28,09:55,Southern,None,"6th St, Mission St",-122.408710606671,37.7809706721824
5007058664090,50070586,64090,SuspiciousOcc,Unusual Occurence,Friday,2005-01-14,14:00,Bayview,None,200 Block Of Industrial St,-122.404603330992,37.7385046034115
13109199607023,131091996,7023,VehicleTheft,Stolen Motorcycle,Thursday,2013-11-28,15:00,Northern,None,3600 Block Of Fillmore St,-122.436634731484,37.803135683639
6007599606304,60075996,6304,Larceny/theft,Grand Theft From A Building,Sunday,2006-01-08,10:45,Northern,None,0 Block Of Waller St,-122.424535363098,37.771951149902
3037602565016,30376025,65016,OtherOffenses,"Drivers License, Suspended Or Revoked",Monday,2003-03-31,10:15,Bayview,"Arrest, Cited","Newcomb Av, Phelps St",-122.39352632602,37.7373529004232
4049025106240,40490251,6240,Larceny/theft,Attempted Theft From Locked Vehicle,Tuesday,2004-04-27,23:59,Ingleside,None,100 Block Of Tiffany Avenue,-122.421113318205,37.7451988038002
8029414816710,80294148,16710,Drug/narcotic,Possession Of Narcotics Paraphernalia,Wednesday,2008-03-19,21:37,Southern,"Arrest, Booked","Market St, 5th St",-122.408068345148,37.7839916768161
3013767306244,30137673,6244,Larceny/theft,Grand Theft From Locked Auto,Sunday,2003-02-02,22:00,Northern,None,300 Block Of Grove St,-122.42236966578,37.7779702929916
11605992506244,116059925,6244,Larceny/theft,Grand Theft From Locked Auto,Tuesday,2011-04-26,21:40,Bayview,None,"Silver Av, Elmira St",-122.403511122553,37.7336649642014
12085057305073,120850573,5073,Burglary,"Burglary, Unlawful Entry",Thursday,2012-10-18,19:30,Central,None,1000 Block Of Sansome St,-122.402445775732,37.7998620462817
4144147707021,41441477,7021,VehicleTheft,Stolen Automobile,Monday,2004-12-20,17:40,Central,Unfounded,200 Block Of Geary St,-122.407434989523,37.7875158741623
9606999906244,96069999,6244,Larceny/theft,Grand Theft From Locked Auto,Monday,2009-08-17,12:30,Taraval,None,0 Block Of Majestic Avenue,-122.451373572837,37.7176993326583
10007828416010,100078284,16010,Drug/narcotic,Possession Of Marijuana,Sunday,2010-01-24,16:17,Tenderloin,"Arrest, Booked","Fulton St, Larkin St",-122.416769999704,37.7795845776674
3045330028161,30453300,28161,Vandalism,"Malicious Mischief, Tire Slashing",Sunday,2003-04-13,12:00,Taraval,None,1700 Block Of 41st Avenue,-122.50003862141,37.7541121762271
7016735128150,70167351,28150,Vandalism,"Malicious Mischief, Vandalism",Wednesday,2007-02-14,22:00,Ingleside,"Arrest, Booked",100 Block Of Brookdale Avenue,-122.4208910342,37.7120920675614
13109331206221,131093312,6221,Larceny/theft,Petty Theft From Unlocked Auto,Thursday,2013-12-26,16:30,Bayview,None,300 Block Of Sweeny St,-122.412041415023,37.7317940508537
8026524664020,80265246,64020,Non-criminal,"Aided Case, Mental Disturbed",Wednesday,2008-03-12,15:23,Bayview,"Arrest, Booked",200 Block Of Harbor Rd,-122.378392257534,37.7323312464378
12084114604134,120841146,4134,Assault,Battery,Friday,2012-10-19,06:05,Southern,None,1100 Block Of Market St,-122.41371122073,37.7796660426062
11070822762020,110708227,62020,Warrants,Enroute To Department Of Corrections,Saturday,2011-09-03,15:17,Bayview,"Arrest, Booked",0 Block Of Dakota St,-122.395635436168,37.7535645746594
4065153809320,40651538,9320,Fraud,"Credit Card, Theft By Use Of",Saturday,2004-06-05,01:00,Central,None,400 Block Of Clay St,-122.400922761049,37.794959803128
10088996262050,100889962,62050,Warrants,Enroute To Outside Jurisdiction,Saturday,2010-09-25,00:23,Central,"Arrest, Booked",400 Block Of Broadway St,-122.405087523335,37.7981219270604
10048288916625,100482889,16625,Drug/narcotic,Sale Of Base/rock Cocaine,Monday,2010-05-24,20:50,Mission,"Arrest, Booked",2000 Block Of Mission St,-122.41965834371,37.7642205603745
10043604628165,100436046,28165,Vandalism,"Malicious Mischief, Graffiti",Saturday,2010-05-08,17:00,Southern,None,1500 Block Of Mission St,-122.417523396516,37.7738670346175
7005907104134,70059071,4134,Assault,Battery,Tuesday,2007-01-16,15:30,Ingleside,None,400 Block Of Raymond Avenue,-122.412457953057,37.7147347356846
13078303327170,130783033,27170,OtherOffenses,Resisting Arrest,Tuesday,2013-09-17,13:00,Ingleside,"Arrest, Cited",100 Block Of Teddy Avenue,-122.405444797777,37.7142848933372
5088116707021,50881167,7021,VehicleTheft,Stolen Automobile,Sunday,2005-08-07,01:00,Bayview,"Arrest, Cited","Felton St, San Bruno Avenue",-122.404594140643,37.7300379995448
3116007919010,31160079,19010,DisorderlyConduct,Committing Public Nuisance,Thursday,2003-10-02,07:48,Southern,"Arrest, Booked",200 Block Of King St,-122.393110640713,37.7773103219698
7123177119057,71231771,19057,Assault,Threats Against Life,Saturday,2007-12-01,16:45,Northern,None,1100 Block Of Fillmore St,-122.432116233695,37.7800304351156
8037577604011,80375776,4011,Assault,Aggravated Assault With A Gun,Thursday,2008-04-10,22:45,Bayview,None,"Lasalle Av, Kirkwood Avenue",-122.372234412189,37.7277850523654
13024965905014,130249659,5014,Burglary,"Burglary, Vehicle (arrest Made)",Tuesday,2013-03-26,12:35,Central,"Arrest, Booked",200 Block Of Kearny St,-122.403822206288,37.79007905288
3109257907055,31092579,7055,VehicleTheft,Recovered Vehicle - Stolen Outside Sf,Tuesday,2003-09-16,09:30,Park,None,300 Block Of Buena Vista East Avenue,-122.440720545257,37.7667916111324
11032289963010,110322899,63010,Warrants,Warrant Arrest,Thursday,2011-04-21,01:43,Mission,Prosecuted By Outside Agency,1000 Block Of South Van Ness Avenue,-122.416572667483,37.7563562905072
4033085116010,40330851,16010,Drug/narcotic,Possession Of Marijuana,Monday,2004-03-22,09:13,Mission,"Arrest, Cited",100 Block Of Bartlett St,-122.419849215246,37.7545482521345
6115799962050,61157999,62050,Warrants,Enroute To Outside Jurisdiction,Monday,2006-10-30,11:27,Tenderloin,"Arrest, Booked","Market St, 8th St",-122.414743835382,37.778719262789
12098189965015,120981899,65015,OtherOffenses,Traffic Violation,Wednesday,2012-12-05,17:05,Southern,"Arrest, Cited",800 Block Of Bryant St,-122.403404791479,37.775420706711
5072759906304,50727599,6304,Larceny/theft,Grand Theft From A Building,Sunday,2005-06-26,17:00,Central,None,100 Block Of Sansome St,-122.400772032282,37.791660455665
6078290316710,60782903,16710,Drug/narcotic,Possession Of Narcotics Paraphernalia,Monday,2006-07-24,14:51,Mission,"Arrest, Cited","Julian Av, 15th St",-122.421057854839,37.7665987781478
12059139119057,120591391,19057,Assault,Threats Against Life,Thursday,2012-07-12,20:05,Bayview,None,400 Block Of Holyoke St,-122.408352785307,37.7257130077522
4097175668020,40971756,68020,OtherOffenses,Miscellaneous Investigation,Wednesday,2004-08-25,15:53,Tenderloin,None,200 Block Of Powell St,-122.408201657254,37.7868849113107
7124737026120,71247370,26120,OtherOffenses,Injury To Telegraph/telephone Lines,Wednesday,2007-12-05,23:00,Central,"Arrest, Booked",1500 Block Of Leavenworth St,-122.416632826445,37.7952235534034
12073778316625,120737783,16625,Drug/narcotic,Sale Of Base/rock Cocaine,Friday,2012-09-14,13:54,Southern,"Arrest, Booked","6th St, Stevenson St",-122.409696355558,37.7817540588712
10083739726063,100837397,26063,Bribery,"Dissuading Witness, Victim",Friday,2010-09-10,11:00,Mission,"Arrest, Booked",100 Block Of Quane St,-122.424674629078,37.7542615677783
4127886606314,41278866,6314,Larceny/theft,Grand Theft Bicycle,Monday,2004-11-08,13:50,Northern,None,"Post St, Webster St",-122.431369772406,37.7853730435249
11096319204014,110963192,4014,Assault,Aggravated Assault With Bodily Force,Thursday,2011-12-01,06:15,Southern,None,300 Block Of King St,-122.395021745914,37.7753128522284
12020915227130,120209152,27130,OtherOffenses,Possession Of Burglary Tools,Tuesday,2012-03-13,22:21,Central,"Arrest, Booked",1800 Block Of Grant Avenue,-122.40835709397,37.8041380814215
12609262006374,126092620,6374,Larceny/theft,Grand Theft Of Property,Saturday,2012-06-23,19:00,Northern,None,2100 Block Of Franklin St,-122.424853069042,37.7941664311147
9078204228160,90782042,28160,Vandalism,"Malicious Mischief, Vandalism Of Vehicles",Saturday,2009-08-01,17:00,Central,None,"Stockton St, Jackson St",-122.408254664048,37.7958223141329
5126627106224,51266271,6224,Larceny/theft,Grand Theft From Unlocked Auto,Sunday,2005-10-30,21:20,Mission,None,4000 Block Of 26th St,-122.430467556518,37.7482398314844
13079241005011,130792410,5011,Burglary,"Burglary Of Apartment House, Forcible Entry",Friday,2013-09-20,10:00,Bayview,"Arrest, Booked",1200 Block Of Felton St,-122.4169490482,37.7268638079222
4071690004072,40716900,4072,Assault,Aggravated Assault On Police Officer With A Knife,Wednesday,2004-06-23,11:50,Southern,"Arrest, Booked",0 Block Of 9th St,-122.415064887666,37.7764354063246
13064837463010,130648374,63010,Warrants,Warrant Arrest,Tuesday,2013-08-06,12:43,Northern,"Arrest, Booked","Octavia St, Greenwich St",-122.429293734683,37.7997871229932
13618852606372,136188526,6372,Larceny/theft,Petty Theft Of Property,Friday,2013-09-13,12:30,Central,None,200 Block Of Geary St,-122.407413025963,37.7874074125228
10006818804134,100068188,4134,Assault,Battery,Monday,2010-01-18,09:00,Taraval,None,4700 Block Of Irving St,-122.508740241518,37.7621113223499
11027892919057,110278929,19057,Assault,Threats Against Life,Wednesday,2011-04-06,06:30,Northern,None,"Polk St, Hemlock St",-122.420021471047,37.7872807076108
13619585006372,136195850,6372,Larceny/theft,Petty Theft Of Property,Saturday,2013-10-19,15:40,Park,None,1900 Block Of Geary Bl,-122.436248450213,37.784048423587
13070730606244,130707306,6244,Larceny/theft,Grand Theft From Locked Auto,Sunday,2013-08-25,08:00,Ingleside,None,0 Block Of Putnam St,-122.410875138737,37.7389778799779
10034812826145,100348128,26145,Larceny/theft,"Lost Property, Grand Theft",Thursday,2010-04-15,11:00,Tenderloin,None,200 Block Of Ofarrell St,-122.409155386902,37.7863245885511
6604852506372,66048525,6372,Larceny/theft,Petty Theft Of Property,Friday,2006-07-21,14:00,Northern,None,"Vanness Av, Lombard St",-122.424541870484,37.8013041477981
8059820706244,80598207,6244,Larceny/theft,Grand Theft From Locked Auto,Saturday,2008-06-07,00:01,Tenderloin,None,200 Block Of Golden Gate Avenue,-122.414263390372,37.7817569847968
8053156415150,80531564,15150,OtherOffenses,Violation Of Restraining Order,Wednesday,2008-05-21,01:24,Taraval,None,400 Block Of Garfield St,-122.466712834635,37.7197301627348
10042077609320,100420776,9320,Fraud,"Credit Card, Theft By Use Of",Sunday,2010-04-18,15:00,Southern,None,800 Block Of Market St,-122.407633520742,37.7841893501425
8069836804134,80698368,4134,Assault,Battery,Friday,2008-07-04,07:40,Park,"Arrest, Booked",1600 Block Of Haight St,-122.450452600564,37.7695032629887
6032082664070,60320826,64070,SuspiciousOcc,Suspicious Occurrence,Friday,2006-03-24,21:55,Taraval,None,"15th Av, Lincoln Wy",-122.472923191487,37.7656404316299
7017580965016,70175809,65016,OtherOffenses,"Drivers License, Suspended Or Revoked",Saturday,2007-02-17,16:20,Ingleside,"Arrest, Cited","Mission St, Santamarina St",-122.423091821462,37.7406428494892
3096976106244,30969761,6244,Larceny/theft,Grand Theft From Locked Auto,Saturday,2003-08-16,16:55,Park,None,300 Block Of Christmas Tree Pt Rd,-122.446859860246,37.7549434272913
12033872315151,120338723,15151,OtherOffenses,"Stay Away Order Violation, Dv Related",Sunday,2012-04-29,00:07,Northern,None,1400 Block Of Lombard St,-122.42540353319,37.8013130714495
10090459864020,100904598,64020,Non-criminal,"Aided Case, Mental Disturbed",Wednesday,2010-09-29,00:01,Mission,None,400 Block Of Fairoaks St,-122.423821049158,37.7494882577814
12604042506244,126040425,6244,Larceny/theft,Grand Theft From Locked Auto,Sunday,2012-03-18,21:00,Bayview,None,"Rhodeisland St, Mariposa St",-122.402445290975,37.763502723082
13001540005023,130015400,5023,Burglary,"Burglary Of Flat, Unlawful Entry",Friday,2013-01-04,22:00,Park,None,1000 Block Of Broderick St,-122.44056317651,37.7799057692424
12609141271000,126091412,71000,Non-criminal,Lost Property,Thursday,2012-06-21,12:30,Central,None,"Kearny St, Clay St",-122.404799424951,37.7944525389481
10071522665016,100715226,65016,OtherOffenses,"Drivers License, Suspended Or Revoked",Thursday,2010-08-05,13:16,Ingleside,None,"Geneva Av, London St",-122.440253342983,37.7160400107849
5091296671000,50912966,71000,Non-criminal,Lost Property,Saturday,2005-08-13,01:00,Southern,None,800 Block Of Bryant St,-122.403404791479,37.775420706711
3073613461030,30736134,61030,Non-criminal,"Death Report, Cause Unknown",Thursday,2003-06-19,06:00,Northern,None,1600 Block Of Clay St,-122.420254113231,37.7925403924507
12032035063010,120320350,63010,Warrants,Warrant Arrest,Monday,2012-04-23,00:19,Park,"Arrest, Booked",700 Block Of Stanyan St,-122.453512911126,37.7686969786551
4088903028160,40889030,28160,Vandalism,"Malicious Mischief, Vandalism Of Vehicles",Wednesday,2004-08-04,08:00,Ingleside,None,1800 Block Of Alemany Bl,-122.438092607546,37.7222482615412
12077111765016,120771117,65016,OtherOffenses,"Drivers License, Suspended Or Revoked",Wednesday,2012-09-26,04:42,Mission,"Arrest, Cited","24th St, Douglass St",-122.438475396324,37.7510241816681
4104695830210,41046958,30210,OtherOffenses,Violation Of Park Code,Monday,2004-09-13,11:45,Mission,"Arrest, Booked","19th St, Linda St",-122.422880477231,37.7600121527994
8137147019057,81371470,19057,Assault,Threats Against Life,Thursday,2008-12-25,21:30,Richmond,"Arrest, Booked",2200 Block Of Balboa St,-122.48286853329,37.7764298138945
9085292426170,90852924,26170,OtherOffenses,Probation Violation,Thursday,2009-08-20,15:20,Park,"Arrest, Booked",700 Block Of Stanyan St,-122.453512911126,37.7686969786551
3004537712026,30045377,12026,WeaponLaws,Discharge Firearm At An Inhabited Dwelling,Sunday,2003-01-12,00:21,Mission,None,600 Block Of Capp St,-122.417802962628,37.7562822236574
4118224505053,41182245,5053,Burglary,"Burglary Of Store, Unlawful Entry",Friday,2004-10-15,21:10,Tenderloin,"Arrest, Booked",0 Block Of Stockton St,-122.406212878217,37.7860371623519
4009706764015,40097067,64015,Non-criminal,"Aided Case, Injured Person",Sunday,2004-01-25,02:21,Northern,None,"Van Ness Av, Clay St",-122.422695629372,37.7921733284299
13108638906304,131086389,6304,Larceny/theft,Grand Theft From A Building,Monday,2013-12-23,16:45,Southern,None,300 Block Of Howard St,-122.394673125041,37.7895349198995
5005370819090,50053708,19090,Drunkenness,Under Influence Of Alcohol In A Public Place,Friday,2005-01-14,17:25,Taraval,"Arrest, Booked","46th Av, Judah St",-122.505928450155,37.7604217436805
1106896007041,11068960,7041,VehicleTheft,"Vehicle, Recovered, Auto",Monday,2003-06-02,22:00,Richmond,Unfounded,"Arguello Bl, Anza St",-122.458733742297,37.7793315985509
9104855661030,91048556,61030,Non-criminal,"Death Report, Cause Unknown",Saturday,2009-10-10,21:55,Central,None,700 Block Of Broadway St,-122.409164766852,37.7976146082072
11017202013075,110172020,13075,Prostitution,Loitering For Purpose Of Prostitution,Monday,2011-02-28,00:30,Mission,"Arrest, Cited","20th St, Capp St",-122.41796448376,37.7586968166489
4038880007025,40388800,7025,VehicleTheft,Stolen Truck,Sunday,2004-04-04,22:30,Bayview,None,1400 Block Of Kansas St,-122.402316839735,37.7512533511923
13057847005083,130578470,5083,Burglary,"Burglary, Hot Prowl, Unlawful Entry",Sunday,2013-07-14,07:50,Mission,None,4300 Block Of 18th St,-122.437743631662,37.7607793481
4044029007046,40440290,7046,VehicleTheft,"Vehicle, Recovered, Other Vehicle",Friday,2004-04-16,21:20,Northern,None,"Franklin St, Pacific Avenue",-122.424873688626,37.7946072649822
4124933407021,41249334,7021,VehicleTheft,Stolen Automobile,Sunday,2004-10-31,16:15,Bayview,None,0 Block Of Garlington Ct,-122.38435769838,37.7324996437285
10103321365015,101033213,65015,OtherOffenses,Traffic Violation,Saturday,2010-11-06,19:09,Taraval,"Arrest, Cited","17th Av, Vicente St",-122.473292342506,37.7394172712622
8100785705071,81007857,5071,Burglary,"Burglary, Forcible Entry",Sunday,2008-09-14,12:00,Northern,None,2600 Block Of Fillmore St,-122.434896620139,37.7938067742445
13013142664070,130131426,64070,SuspiciousOcc,Suspicious Occurrence,Thursday,2013-02-14,18:17,Southern,Complainant Refuses To Prosecute,1200 Block Of Folsom St,-122.410802477808,37.7743299153836
12057479505051,120574795,5051,Burglary,"Burglary Of Store, Forcible Entry",Friday,2012-07-20,23:00,Southern,None,200 Block Of 9th St,-122.411938244812,37.7739450369534
8107598912026,81075989,12026,WeaponLaws,Discharge Firearm At An Inhabited Dwelling,Wednesday,2008-10-08,22:07,Bayview,None,1300 Block Of Phelps St,-122.393757742747,37.7370014513939
6131244404104,61312444,4104,Assault,Assault,Monday,2006-12-11,05:45,Ingleside,None,0 Block Of Leland Avenue,-122.405202907793,37.7118274140818
12014830674000,120148306,74000,MissingPerson,Missing Adult,Wednesday,2012-02-08,08:00,Northern,Located,100 Block Of Page St,-122.42320280363,37.7740394663904
6076489826142,60764898,26142,Kidnapping,False Imprisonment,Wednesday,2006-07-19,18:49,Bayview,"Arrest, Booked",700 Block Of Barneveld Avenue,-122.407755673257,37.7339837270721
5056716328160,50567163,28160,Vandalism,"Malicious Mischief, Vandalism Of Vehicles",Saturday,2005-05-21,00:01,Taraval,None,"38th Av, Rivera St",-122.49630962044,37.7458777622819
10002801316100,100028013,16100,Drug/narcotic,Possession Of Heroin,Saturday,2010-01-09,10:22,Tenderloin,"Arrest, Booked",0 Block Of Unitednations Pz,-122.414317857881,37.7799444052046
13043986664020,130439866,64020,Non-criminal,"Aided Case, Mental Disturbed",Tuesday,2013-05-28,15:35,Tenderloin,None,500 Block Of Ofarrell St,-122.413820070176,37.7857382950322
11097077762050,110970777,62050,Warrants,Enroute To Outside Jurisdiction,Saturday,2011-12-03,22:26,Southern,"Arrest, Booked",0 Block Of 6th St,-122.40942036456,37.7816150265786
10101155427090,101011554,27090,Larceny/theft,"Lost Property, Petty Theft",Friday,2010-10-29,22:30,Southern,None,0 Block Of 1st St,-122.397694321211,37.7899359092419
9106950263010,91069502,63010,Warrants,Warrant Arrest,Friday,2009-10-16,19:50,Tenderloin,None,300 Block Of Ellis St,-122.411987643595,37.7850226622786
10615405206244,106154052,6244,Larceny/theft,Grand Theft From Locked Auto,Friday,2010-12-03,21:45,Northern,None,"Laguna St, Sutter St",-122.428337917055,37.7867109731605
12051252964001,120512529,64001,Non-criminal,"Civil Sidewalks, Warning",Friday,2012-06-29,12:41,Tenderloin,"Arrest, Booked",0 Block Of Turk St,-122.409849441655,37.7832755202567
13073374319057,130733743,19057,Assault,Threats Against Life,Tuesday,2013-09-03,05:46,Mission,"Arrest, Booked",2600 Block Of Mission St,-122.418738265772,37.7546172382083
8092525264070,80925252,64070,SuspiciousOcc,Suspicious Occurrence,Monday,2008-09-01,15:02,Mission,None,"16th St, Hoff St",-122.420580440111,37.7649968622937
11013664028100,110136640,28100,Vandalism,"Malicious Mischief, Breaking Windows",Monday,2011-02-14,20:33,Southern,None,800 Block Of Bryant St,-122.403404791479,37.775420706711
13013574175030,130135741,75030,Non-criminal,Case Closure,Saturday,2013-02-16,07:00,Bayview,Complainant Refuses To Prosecute,"San Bruno Av, Bacon St",-122.403595293514,37.7276340992506
6056463204134,60564632,4134,Assault,Battery,Sunday,2006-05-28,09:36,Mission,"Arrest, Booked","9th St, Division St",-122.405942290896,37.7696597423213
6070004604134,60700046,4134,Assault,Battery,Sunday,2006-07-02,09:45,Bayview,"Arrest, Booked",4900 Block Of 3rd St,-122.391243431227,37.7336342023099
5091294407054,50912944,7054,Non-criminal,Misplaced Vehicle,Saturday,2005-08-13,20:00,Central,None,"Sacramento St, Mason St",-122.411010975031,37.7927615798099
5006120604134,50061206,4134,Assault,Battery,Monday,2005-01-17,01:00,Central,None,500 Block Of Broadway St,-122.406460643507,37.7979466732983
5104138027300,51041380,27300,OtherOffenses,Miscellaneous State Misdemeanor,Friday,2005-09-16,05:50,Bayview,"Arrest, Cited","Carolina St, 16th St",-122.400756349779,37.7661917267156
13099895304134,130998953,4134,Assault,Battery,Monday,2013-11-25,11:50,Tenderloin,"Arrest, Cited",100 Block Of Golden Gate Avenue,-122.413069926397,37.7820204255866
4023873806365,40238738,6365,Larceny/theft,Petty Theft With Prior,Sunday,2004-02-29,00:01,Tenderloin,"Arrest, Booked",400 Block Of Ofarrell St,-122.412569415086,37.7858955061569
13067330909150,130673309,9150,Forgery/counterfeiting,"Forgery, Notes",Sunday,2013-08-04,12:00,Ingleside,None,900 Block Of Geneva Avenue,-122.439909766772,37.715765426995
11047787006304,110477870,6304,Larceny/theft,Grand Theft From A Building,Monday,2011-06-13,17:00,Tenderloin,None,200 Block Of Mason St,-122.409523740653,37.7857602954934
4049000719057,40490007,19057,Assault,Threats Against Life,Wednesday,2004-04-28,22:00,Taraval,"Arrest, Booked",2200 Block Of 48th Avenue,-122.507031438787,37.7444579146653
5010376726150,50103767,26150,OtherOffenses,Parole Violation,Thursday,2005-01-27,12:00,Southern,"Arrest, Booked",900 Block Of Market St,-122.408421116922,37.7835699386918
10055361219400,100553612,19400,SecondaryCodes,Gang Activity,Tuesday,2010-06-15,21:15,Tenderloin,"Arrest, Booked",100 Block Of Hyde St,-122.415669661443,37.7821198488931
13033658563010,130336585,63010,Warrants,Warrant Arrest,Wednesday,2013-04-24,19:42,Bayview,"Arrest, Booked","3rd St, Mckinnon Avenue",-122.39014671644,37.7363908050669
12100374105042,121003741,5042,Burglary,"Burglary Of Residence, Attempted Forcible Entry",Thursday,2012-12-13,12:55,Ingleside,None,600 Block Of Powhattan Avenue,-122.412899093417,37.7414024410314
3066108665016,30661086,65016,OtherOffenses,"Drivers License, Suspended Or Revoked",Saturday,2003-05-31,15:12,Northern,"Arrest, Cited","Steiner St, Eddy St",-122.43397512883,37.7812181960282
6098003816030,60980038,16030,Drug/narcotic,Possession Of Marijuana For Sales,Wednesday,2006-09-13,18:55,Park,"Arrest, Booked",1800 Block Of Haight St,-122.452706340322,37.7692156705894
3118608106374,31186081,6374,Larceny/theft,Grand Theft Of Property,Wednesday,2003-10-08,14:40,Northern,None,"Beach St, Baker St",-122.446912736969,37.8032828090542
9116348309320,91163483,9320,Fraud,"Credit Card, Theft By Use Of",Friday,2009-11-06,12:00,Ingleside,None,100 Block Of Congdon St,-122.426182433659,37.7304979029841
6045458803044,60454588,3044,Robbery,Robbery Of A Chain Store With Bodily Force,Friday,2006-04-28,17:32,Central,"Arrest, Booked",800 Block Of Geary St,-122.417295322526,37.7862578545865
7016926664070,70169266,64070,SuspiciousOcc,Suspicious Occurrence,Thursday,2007-02-15,12:00,Central,Not Prosecuted,1100 Block Of Columbus Avenue,-122.416976744235,37.8050697823361
9120346526142,91203465,26142,Kidnapping,False Imprisonment,Saturday,2009-11-21,00:01,Southern,None,"King St, 7th St",-122.400806797286,37.7711380940528
13014094472000,130140944,72000,Non-criminal,Found Property,Sunday,2013-02-17,18:00,Northern,None,1800 Block Of Clay St,-122.423544081104,37.7921222370469
5025069707055,50250697,7055,VehicleTheft,Recovered Vehicle - Stolen Outside Sf,Saturday,2005-03-05,07:48,Southern,None,"5th St, Mission St",-122.40648197275,37.7827317884658
11603045871000,116030458,71000,Non-criminal,Lost Property,Friday,2011-02-25,21:00,Central,None,1800 Block Of Montgomery St,-122.405198753901,37.805247004354
8014559164020,80145591,64020,Non-criminal,"Aided Case, Mental Disturbed",Monday,2008-02-11,03:27,Taraval,None,200 Block Of Monticello St,-122.470673521408,37.7187815894447
5125133565015,51251335,65015,OtherOffenses,Traffic Violation,Saturday,2005-11-05,10:18,Mission,None,"Cesar Chavez St, Bryant St",-122.408706424996,37.7483538788784
12093472905043,120934729,5043,Burglary,"Burglary Of Residence, Unlawful Entry",Thursday,2012-11-15,08:30,Richmond,None,800 Block Of 26th Avenue,-122.48525926398,37.7734393135661
5027899065016,50278990,65016,OtherOffenses,"Drivers License, Suspended Or Revoked",Saturday,2005-03-12,03:23,Park,"Arrest, Cited","Castro St, Beaver St",-122.435398682784,37.7649247900518
11010428362050,110104283,62050,Warrants,Enroute To Outside Jurisdiction,Thursday,2011-02-03,15:44,Ingleside,None,"Mission St, Ocean Avenue",-122.435385454946,37.7239104470753
4080687416010,40806874,16010,Drug/narcotic,Possession Of Marijuana,Thursday,2004-07-15,14:02,Southern,"Arrest, Booked",1000 Block Of Market St,-122.411071423064,37.7817511307229
8604654306244,86046543,6244,Larceny/theft,Grand Theft From Locked Auto,Sunday,2008-06-22,20:00,Park,None,"Fell St, Broderick St",-122.43927866767,37.7738462272885
9056028004011,90560280,4011,Assault,Aggravated Assault With A Gun,Sunday,2009-05-31,00:01,Ingleside,"Arrest, Booked","Blythdale Av, Santos St",-122.418770479936,37.7107332124
8053582364070,80535823,64070,SuspiciousOcc,Suspicious Occurrence,Thursday,2008-05-22,10:10,Taraval,None,300 Block Of Junipero Serra Bl,-122.472059739272,37.7299290458107
5074186206241,50741862,6241,Larceny/theft,Petty Theft From Locked Auto,Sunday,2005-07-03,10:30,Northern,None,"Hemlock St, Vanness Avenue",-122.42166371444,37.7870754039701
11010601362050,110106013,62050,Warrants,Enroute To Outside Jurisdiction,Friday,2011-02-04,09:30,Bayview,"Arrest, Booked",100 Block Of Harbor Rd,-122.378268018481,37.7323807302226
9120824904144,91208249,4144,"SexOffenses,Forcible",Sexual Battery,Monday,2009-11-23,15:08,Bayview,None,0 Block Of Conkling St,-122.401968361773,37.7356138034783
3017641165016,30176411,65016,OtherOffenses,"Drivers License, Suspended Or Revoked",Tuesday,2003-02-11,20:27,Bayview,"Arrest, Booked",1300 Block Of Shafter Avenue,-122.386109619077,37.7283547937407
13602861506244,136028615,6244,Larceny/theft,Grand Theft From Locked Auto,Saturday,2013-02-09,07:30,Northern,None,"Scott St, Alhambra St",-122.441372464723,37.8011244190024
12028778860150,120287788,60150,Suicide,Suicide By Firearms,Wednesday,2012-04-11,06:12,Central,None,1000 Block Of Green St,-122.416421719622,37.7986283900074
7067665309110,70676653,9110,Fraud,"Forgery, Credit Card",Sunday,2005-05-01,00:01,Taraval,None,1500 Block Of Sloat Bl,-122.489713969124,37.7339497680852
