id,incident_number,incident_code,category,descript,day_of_the_week,date,time,police_dept_district,resolution,address,location_x_axis,location_y_axis
15018598662020,150185986,62020,Warrants,Enroute To Department Of Corrections,Sunday,2015-03-01,07:20,Central,"Arrest, Booked",600 Block Of Post St,-122.413056449036,37.7876453111782
14099212709320,140992127,9320,Fraud,"Credit Card, Theft By Use Of",Sunday,2014-11-23,02:30,Ingleside,None,300 Block Of Moscow St,-122.427127092149,37.7220546946947
14087968875030,140879688,75030,Non-criminal,Case Closure,Friday,2014-10-17,15:45,Central,Exceptional Clearance,"California St, Battery St",-122.399962950879,37.7932093101245
15019225405013,150192254,5013,Burglary,"Burglary Of Apartment House, Unlawful Entry",Monday,2015-03-02,20:00,Park,"Arrest, Booked",1400 Block Of Page St,-122.444712962011,37.771302186583
15029091171024,150290911,71024,Non-criminal,"Stay Away Or Court Order, Non-dv Related",Friday,2015-04-03,00:02,Southern,None,"6th St, Minna St",-122.408162953857,37.7805345385278
15031482810010,150314828,10010,Embezzlement,"Embezzlement, Petty Theft",Friday,2015-04-10,21:00,Ingleside,"Arrest, Booked",400 Block Of Madrid St,-122.432171559555,37.7223498379767
15049090175030,150490901,75030,Non-criminal,Case Closure,Friday,2015-06-05,10:54,Southern,None,1300 Block Of Howard St,-122.414217817669,37.774239170665
14106766468020,141067664,68020,OtherOffenses,Miscellaneous Investigation,Saturday,2014-12-20,08:30,Taraval,Unfounded,1300 Block Of 47th Avenue,-122.507132523226,37.7612864224736
15027780609320,150277806,9320,Fraud,"Credit Card, Theft By Use Of",Sunday,2015-03-29,18:00,Northern,None,1300 Block Of Webster St,-122.431046366089,37.7830295716044
14012142312168,140121423,12168,WeaponLaws,"Firearm, Loaded, In Vehicle, Possession Or Use",Monday,2014-02-10,19:15,Bayview,"Arrest, Booked","Bay Shore Bl, Cortland Avenue",-122.406979507963,37.739566960911
15008715015155,150087150,15155,OtherOffenses,Restraining Order Notification/service Of Restraining Order,Tuesday,2014-01-28,20:17,Ingleside,None,0 Block Of Regent St,-122.456407784485,37.709691756097
15602403528150,156024035,28150,Vandalism,"Malicious Mischief, Vandalism",Wednesday,2014-10-29,22:00,Southern,None,1600 Block Of Harrison St,-122.41318059398,37.7697620111661
15028078006242,150280780,6242,Larceny/theft,Petty Theft From Locked Auto,Monday,2015-03-30,18:00,Central,None,"Northpoint St, Mason St",-122.413789467437,37.8065526528708
14101618805013,141016188,5013,Burglary,"Burglary Of Apartment House, Unlawful Entry",Thursday,2014-11-27,07:00,Central,None,1000 Block Of Leavenworth St,-122.415724826731,37.7907307937229
15026370809029,150263708,9029,OtherOffenses,False Personation To Receive Money Or Property,Wednesday,2015-02-25,00:01,Southern,None,1000 Block Of Mission St,-122.409795194505,37.7800356268394
14044261175030,140442611,75030,Non-criminal,Case Closure,Sunday,2014-05-25,11:30,Southern,Located,800 Block Of Bryant St,-122.403404791479,37.775420706711
14090771206301,140907712,6301,Larceny/theft,Petty Theft From A Building,Sunday,2014-10-26,19:25,Central,None,300 Block Of Jefferson St,-122.418270696719,37.8078519838014
15027229865016,150272298,65016,OtherOffenses,"Drivers License, Suspended Or Revoked",Saturday,2015-03-28,00:09,Mission,"Arrest, Booked","23rd St, Capp St",-122.417508586687,37.7539026121867
14096615004013,140966150,4013,Assault,Aggravated Assault With A Deadly Weapon,Friday,2014-11-14,19:00,Mission,"Arrest, Booked",2600 Block Of 24th St,-122.405838144649,37.7529785864877
14082903127195,140829031,27195,Trespass,Trespassing,Monday,2014-09-29,10:45,Northern,None,0 Block Of Mallorca Wy,-122.437321645794,37.8011379896213
14028365362071,140283653,62071,Warrants,Probation Search,Saturday,2014-04-05,18:35,Bayview,"Arrest, Booked",0 Block Of Osceola Ln,-122.383187458704,37.7316757960484
15047286826170,150472868,26170,OtherOffenses,Probation Violation,Saturday,2015-05-30,18:42,Tenderloin,"Arrest, Booked","Jones St, Golden Gate Avenue",-122.412224164736,37.7820729312029
15041343662050,150413436,62050,Warrants,Enroute To Outside Jurisdiction,Tuesday,2015-05-12,15:45,Bayview,None,0 Block Of Turner Tr,-122.395106891925,37.7566305834521
15018643971000,150186439,71000,Non-criminal,Lost Property,Saturday,2015-01-03,12:00,Taraval,None,2400 Block Of Noriega St,-122.489876327133,37.7537048425564
14101546909320,141015469,9320,Fraud,"Credit Card, Theft By Use Of",Monday,2014-11-17,17:20,Northern,None,1800 Block Of Vanness Avenue,-122.422955398555,37.7925995641481
14000789515162,140007895,15162,OtherOffenses,Violation Of Stay Away Order,Friday,2014-01-03,16:25,Southern,"Arrest, Booked",300 Block Of 10th St,-122.412311666664,37.7724811636038
14023040009029,140230400,9029,OtherOffenses,False Personation To Receive Money Or Property,Thursday,2014-02-06,00:01,Mission,None,500 Block Of South Van Ness Avenue,-122.41747701285,37.764357751686
14092659604014,140926596,4014,Assault,Aggravated Assault With Bodily Force,Saturday,2014-11-01,17:10,Central,"Arrest, Booked",1200 Block Of Stockton St,-122.40865661986,37.7974686241104
14097408419057,140974084,19057,Assault,Threats Against Life,Friday,2014-11-14,13:00,Central,None,1000 Block Of Bush St,-122.414576897,37.7894768075723
15030858664070,150308586,64070,SuspiciousOcc,Suspicious Occurrence,Wednesday,2015-04-08,20:30,Ingleside,None,0 Block Of Sala Tr,-122.445502670509,37.7142098169481
14102238928150,141022389,28150,Vandalism,"Malicious Mischief, Vandalism",Thursday,2014-12-04,06:15,Mission,None,300 Block Of Church St,-122.428809654361,37.7652991255017
14092465312166,140924653,12166,WeaponLaws,"Firearm, Carrying Loaded With Intent To Commit Felony",Saturday,2014-11-01,01:07,Bayview,"Arrest, Booked","Lasalle Av, 3rd St",-122.389865610332,37.7371699446203
15018818406303,150188184,6303,Larceny/theft,Petty Theft From A Building,Sunday,2015-03-01,21:30,Taraval,None,1800 Block Of Ocean Avenue,-122.461683159559,37.7251897236748
14626332806244,146263328,6244,Larceny/theft,Grand Theft From Locked Auto,Thursday,2014-12-11,14:03,Southern,None,900 Block Of Market St,-122.408421116922,37.7835699386918
14098269528160,140982695,28160,Vandalism,"Malicious Mischief, Vandalism Of Vehicles",Thursday,2014-11-20,04:37,Northern,"Arrest, Booked",1400 Block Of Larkin St,-122.419199089939,37.7912461027068
15018978409250,150189784,9250,Fraud,Fraudulent Use Of Automated Teller Card,Tuesday,2015-01-27,10:30,Northern,None,1300 Block Of Webster St,-122.431046366089,37.7830295716044
14063015109027,140630151,9027,OtherOffenses,False Personation,Monday,2014-07-14,00:01,Bayview,None,300 Block Of 24th St,-122.383572457035,37.7542651413222
14626677006372,146266770,6372,Larceny/theft,Petty Theft Of Property,Sunday,2014-12-14,17:45,Southern,None,800 Block Of Bryant St,-122.403404791479,37.775420706711
14007779112164,140077791,12164,WeaponLaws,"Switchblade Knife, Possession",Sunday,2014-01-26,23:20,Mission,"Arrest, Booked",2700 Block Of Mission St,-122.418587172219,37.7530186537446
14622418206244,146224182,6244,Larceny/theft,Grand Theft From Locked Auto,Saturday,2014-10-25,17:00,Southern,None,800 Block Of Bryant St,-122.403404791479,37.775420706711
14082254606244,140822546,6244,Larceny/theft,Grand Theft From Locked Auto,Monday,2014-09-29,20:38,Northern,"Arrest, Booked",1200 Block Of Fillmore St,-122.432168165552,37.7809799644491
14015668064001,140156680,64001,Non-criminal,"Civil Sidewalks, Warning",Saturday,2014-02-22,11:24,Park,None,1400 Block Of Haight St,-122.446165617978,37.7701611813393
14031790113075,140317901,13075,Prostitution,Loitering For Purpose Of Prostitution,Wednesday,2014-04-16,23:52,Mission,None,400 Block Of Capp St,-122.417970955091,37.7594884557036
14075767015161,140757670,15161,OtherOffenses,Violation Of Restraining Order,Monday,2014-09-08,09:45,Bayview,None,700 Block Of Kirkwood Avenue,-122.374100613159,37.7291144726553
14008499011012,140084990,11012,StolenProperty,"Stolen Property, Possession With Knowledge, Receiving",Wednesday,2014-01-29,06:14,Ingleside,"Arrest, Booked",100 Block Of Kingston St,-122.421836167533,37.7414838982789
15023874506243,150238745,6243,Larceny/theft,Petty Theft From Locked Auto,Tuesday,2015-03-17,16:00,Bayview,None,5000 Block Of 3rd St,-122.391257625349,37.7327899367388
14109729106363,141097291,6363,Larceny/theft,Petty Theft Shoplifting,Tuesday,2014-12-30,11:43,Southern,"Arrest, Booked",900 Block Of Market St,-122.408421116922,37.7835699386918
14045328215152,140453282,15152,OtherOffenses,"Probation Violation, Dv Related",Saturday,2014-05-31,03:15,Ingleside,"Arrest, Booked",1700 Block Of Sunnydale Avenue,-122.417107986993,37.7122561827524
14106843006303,141068430,6303,Larceny/theft,Petty Theft From A Building,Saturday,2014-12-20,10:30,Park,None,1400 Block Of Mcallister St,-122.435879473355,37.7780533541929
14008740504138,140087405,4138,Assault,"Battery, Former Spouse Or Dating Relationship",Wednesday,2014-01-29,22:51,Northern,"Arrest, Booked",500 Block Of Haight St,-122.431289969136,37.7720549755537
14098380306243,140983803,6243,Larceny/theft,Petty Theft From Locked Auto,Thursday,2014-11-20,12:00,Mission,None,2300 Block Of 16th St,-122.409529913278,37.7657184395282
14080775804136,140807758,4136,Assault,Battery With Serious Injuries,Tuesday,2014-09-23,11:30,Northern,None,100 Block Of Church St,-122.429080297019,37.7681979747465
14099735907025,140997359,7025,VehicleTheft,Stolen Truck,Monday,2014-11-24,19:00,Ingleside,None,100 Block Of College Avenue,-122.426495413982,37.735348450768
14098009764085,140980097,64085,SuspiciousOcc,Investigative Detention,Wednesday,2014-11-19,03:00,Northern,None,800 Block Of Turk St,-122.423105855786,37.7815834072995
14625301228160,146253012,28160,Vandalism,"Malicious Mischief, Vandalism Of Vehicles",Friday,2014-11-28,23:00,Bayview,None,600 Block Of 20th St,-122.388077276848,37.7605748200898
14107730605071,141077306,5071,Burglary,"Burglary, Forcible Entry",Saturday,2014-12-20,00:54,Central,None,400 Block Of Jackson St,-122.402116694119,37.7965361658282
14072335827199,140723358,27199,Trespass,Lodging Without Permission,Thursday,2014-08-28,06:55,Southern,"Arrest, Cited","Brannan St, 8th St",-122.405427162783,37.7712969876277
15032116805171,150321168,5171,Burglary,"Burglary,bldg. Under Construction, Forcible Entry",Monday,2015-04-13,02:47,Central,"Arrest, Booked",200 Block Of Kearny St,-122.403915681571,37.790538993725
14035159575030,140351595,75030,Non-criminal,Case Closure,Saturday,2014-03-15,08:00,Taraval,Exceptional Clearance,2500 Block Of 29th Avenue,-122.48627784324,37.7397606117042
14106265804083,141062658,4083,Assault,"Firearm, Discharging In Grossly Negligent Manner",Thursday,2014-12-18,14:25,Bayview,"Arrest, Booked",1700 Block Of Quesada Avenue,-122.392393403915,37.7337451568089
14093862604144,140938626,4144,"SexOffenses,Forcible",Sexual Battery,Tuesday,2014-10-21,18:30,Central,None,100 Block Of Waverly Pl,-122.406844394483,37.7946548898815
15032613003043,150326130,3043,Robbery,Robbery Of A Chain Store With A Dangerous Weapon,Tuesday,2015-04-14,15:38,Central,"Arrest, Booked",0 Block Of Jefferson St,-122.413349164272,37.8084667368908
15031202627170,150312026,27170,OtherOffenses,Resisting Arrest,Friday,2015-04-10,00:41,Mission,"Arrest, Booked","15th St, Valencia St",-122.422045943548,37.7665387195995
14004959671024,140049596,71024,Non-criminal,"Stay Away Or Court Order, Non-dv Related",Friday,2014-01-17,17:38,Northern,"Arrest, Booked",600 Block Of Larch St,-122.42815115473,37.7815325510309
15029245602020,150292456,2020,"SexOffenses,Forcible","Penetration, Forced, With Object",Friday,2015-04-03,10:00,Southern,None,1700 Block Of Market St,-122.422188261426,37.7726948236861
14097840664020,140978406,64020,Non-criminal,"Aided Case, Mental Disturbed",Tuesday,2014-11-18,18:40,Tenderloin,None,300 Block Of Eddy St,-122.412930522059,37.7838344374141
14108025228160,141080252,28160,Vandalism,"Malicious Mischief, Vandalism Of Vehicles",Wednesday,2014-12-24,01:32,Central,None,1000 Block Of Sutter St,-122.417650682357,37.7880158477339
14094079003074,140940790,3074,Robbery,"Robbery, Bodily Force",Friday,2014-10-31,22:00,Mission,None,3000 Block Of 16th St,-122.421662616877,37.7648758178404
15031123806243,150311238,6243,Larceny/theft,Petty Theft From Locked Auto,Thursday,2015-04-09,07:00,Northern,None,"Laguna St, Post St",-122.428151140162,37.7857828233879
15044726928160,150447269,28160,Vandalism,"Malicious Mischief, Vandalism Of Vehicles",Friday,2015-05-22,17:40,Central,None,"Northpoint St, Powell St",-122.412143310586,37.8067579023106
14102292528160,141022925,28160,Vandalism,"Malicious Mischief, Vandalism Of Vehicles",Thursday,2014-12-04,14:16,Tenderloin,None,100 Block Of Taylor St,-122.410791677645,37.7836952269749
14041227264085,140412272,64085,SuspiciousOcc,Investigative Detention,Saturday,2014-05-17,07:15,Taraval,None,1200 Block Of Great Hy,-122.50966215971,37.7630355540213
14103371206223,141033712,6223,Larceny/theft,Petty Theft From Unlocked Auto,Monday,2014-12-08,14:45,Richmond,None,4600 Block Of Cabrillo St,-122.508429297096,37.7732782238941
15028820128150,150288201,28150,Vandalism,"Malicious Mischief, Vandalism",Wednesday,2015-04-01,08:00,Park,None,2000 Block Of Oak St,-122.453078855673,37.7710611356079
15054026175000,150540261,75000,MissingPerson,Found Person,Sunday,2015-06-21,10:55,Park,None,0 Block Of Castro St,-122.435637436721,37.7681694346175
14095274506243,140952745,6243,Larceny/theft,Petty Theft From Locked Auto,Monday,2014-11-10,10:30,Southern,None,0 Block Of Sherman St,-122.406783397667,37.7771361539361
14035711703054,140357117,3054,Robbery,Robbery Of A Residence With Bodily Force,Wednesday,2014-04-30,10:25,Northern,"Arrest, Booked",1400 Block Of Post St,-122.426529714226,37.7860427680942
14036780911012,140367809,11012,StolenProperty,"Stolen Property, Possession With Knowledge, Receiving",Friday,2014-05-02,15:00,Mission,"Arrest, Booked",4100 Block Of 23rd St,-122.43537342142,37.7528789436618
14025823612171,140258236,12171,WeaponLaws,"Weapon, Assault, Possession, Manufacture, Or Sale",Thursday,2014-03-27,19:47,Northern,"Arrest, Booked","Sacramento St, Gough St",-122.425804925314,37.7908727425161
14042360575030,140423605,75030,Non-criminal,Case Closure,Wednesday,2014-05-21,00:01,Mission,Located,900 Block Of Potrero Avenue,-122.406604919508,37.7571580431915
14105179219090,141051792,19090,Drunkenness,Under Influence Of Alcohol In A Public Place,Sunday,2014-12-14,21:30,Taraval,"Arrest, Booked",2300 Block Of 24th Avenue,-122.48118317163,37.7437268170337
15030258805041,150302588,5041,Burglary,"Burglary Of Residence, Forcible Entry",Monday,2015-04-06,06:30,Northern,None,1600 Block Of Sacramento St,-122.420052444419,37.7915436932136
14103065573010,141030655,73010,Non-criminal,Turned In Gun,Sunday,2014-12-07,13:40,Taraval,None,2300 Block Of 24th Avenue,-122.48118317163,37.7437268170337
14008517011012,140085170,11012,StolenProperty,"Stolen Property, Possession With Knowledge, Receiving",Wednesday,2014-01-29,08:00,Mission,"Arrest, Cited",100 Block Of Clintonpark St,-122.423417640611,37.7692664689781
14096564109320,140965641,9320,Fraud,"Credit Card, Theft By Use Of",Saturday,2014-11-01,15:00,Richmond,None,300 Block Of 32nd Avenue,-122.49248913097,37.7822906641847
14623360006244,146233600,6244,Larceny/theft,Grand Theft From Locked Auto,Friday,2014-11-07,16:00,Taraval,None,100 Block Of Junipero Serra Bl,-122.472156761057,37.7325199293917
14098283362050,140982833,62050,Warrants,Enroute To Outside Jurisdiction,Thursday,2014-11-20,07:33,Taraval,"Arrest, Booked",2500 Block Of Great Hy,-122.50648456409,37.7388739744874
14100573307027,141005733,7027,VehicleTheft,"Auto, Grand Theft Of",Wednesday,2014-11-26,17:00,Northern,"Arrest, Booked",200 Block Of Pixley St,-122.436623173287,37.7984345820405
14079326011012,140793260,11012,StolenProperty,"Stolen Property, Possession With Knowledge, Receiving",Friday,2014-09-19,07:00,Northern,"Arrest, Booked",500 Block Of Steiner St,-122.432631414378,37.7742247517444
14089896764020,140898967,64020,Non-criminal,"Aided Case, Mental Disturbed",Thursday,2014-10-23,22:05,Southern,None,800 Block Of Bryant St,-122.403404791479,37.775420706711
14102478304134,141024783,4134,Assault,Battery,Tuesday,2014-12-02,12:00,Taraval,None,1500 Block Of 21st Avenue,-122.479007763695,37.7587840702253
14089359706123,140893597,6123,Larceny/theft,"Theft, Drunk Roll, $200-$400",Sunday,2014-10-19,02:00,Northern,None,"Geary Bl, Fillmore St",-122.432914603494,37.7843533426568
15030933007021,150309330,7021,VehicleTheft,Stolen Automobile,Thursday,2015-04-09,00:01,Ingleside,None,200 Block Of London St,-122.433515832649,37.7251070324143
14041655311012,140416553,11012,StolenProperty,"Stolen Property, Possession With Knowledge, Receiving",Sunday,2014-05-18,20:20,Bayview,"Arrest, Booked","18th St, San Bruno Avenue",-122.405221227251,37.7620542126608
14072203709164,140722037,9164,Fraud,"Access Card Information, Theft Of",Wednesday,2014-08-27,18:11,Northern,None,1600 Block Of Post St,-122.428969462908,37.7856179045546
15032311403414,150323114,3414,Robbery,Attempted Robbery On The Street With Bodily Force,Monday,2015-04-06,22:50,Ingleside,None,"30th St, Mission St",-122.421970919029,37.7423752245255
14102060606374,141020606,6374,Larceny/theft,Grand Theft Of Property,Wednesday,2014-12-03,16:45,Taraval,None,3200 Block Of 20th Avenue,-122.475647460786,37.7285280627465
14007451564085,140074515,64085,SuspiciousOcc,Investigative Detention,Saturday,2014-01-25,20:56,Richmond,None,4000 Block Of Balboa St,-122.502148728509,37.7755496261634
14622219206372,146222192,6372,Larceny/theft,Petty Theft Of Property,Sunday,2014-10-26,01:25,Northern,None,1300 Block Of Polk St,-122.420515681408,37.7893840503369
14058676475030,140586764,75030,Non-criminal,Case Closure,Monday,2014-07-07,00:01,Tenderloin,District Attorney Refuses To Prosecute,300 Block Of Taylor St,-122.411302813025,37.7855355791102
14010165712164,140101657,12164,WeaponLaws,"Switchblade Knife, Possession",Tuesday,2014-02-04,00:18,Bayview,"Arrest, Booked",4100 Block Of 3rd St,-122.389030559959,37.7399490247176
14072166964002,140721669,64002,Non-criminal,"Civil Sidewalks, Citation",Wednesday,2014-08-27,16:58,Park,"Arrest, Cited",500 Block Of Clayton St,-122.448739865726,37.7702466927234
14104512174000,141045121,74000,MissingPerson,Missing Adult,Thursday,2014-12-11,14:00,Southern,Unfounded,0 Block Of Dore St,-122.413045971966,37.7738617771611
14624803506244,146248035,6244,Larceny/theft,Grand Theft From Locked Auto,Sunday,2014-11-23,23:00,Ingleside,None,0 Block Of Oneida Avenue,-122.439624543268,37.7206038015008
15026988105011,150269881,5011,Burglary,"Burglary Of Apartment House, Forcible Entry",Friday,2015-03-27,09:53,Richmond,None,700 Block Of La Playa St,-122.510170706093,37.7741725064496
15027431306244,150274313,6244,Larceny/theft,Grand Theft From Locked Auto,Saturday,2015-03-28,14:00,Central,None,"Jones St, Beach St",-122.417265053145,37.807073051215
14107622305153,141076223,5153,Burglary,"Burglary,store Under Construction, Unlawful Entry",Sunday,2014-12-21,17:00,Ingleside,None,200 Block Of 30th St,-122.425051202722,37.7422418542525
14068974409024,140689744,9024,OtherOffenses,"Fraudulent Game Or Trick, Obtaining Money Or Property",Sunday,2014-08-17,18:03,Central,"Arrest, Cited",0 Block Of Jefferson St,-122.41337058114,37.8085752673964
14051320613075,140513206,13075,Prostitution,Loitering For Purpose Of Prostitution,Friday,2014-06-20,22:00,Central,"Arrest, Cited",300 Block Of Stockton St,-122.406886503606,37.7887345763527
14059460464001,140594604,64001,Non-criminal,"Civil Sidewalks, Warning",Thursday,2014-07-17,16:01,Park,None,1400 Block Of Haight St,-122.446143672039,37.7700527182372
14081295128092,140812951,28092,Vandalism,"Malicious Mischief, Adult Suspect",Friday,2014-09-26,16:36,Mission,"Arrest, Cited",3900 Block Of 17th St,-122.43466870921,37.7625723537425
15023323464020,150233234,64020,Non-criminal,"Aided Case, Mental Disturbed",Monday,2015-03-16,02:55,Richmond,"Arrest, Booked",5100 Block Of Geary Bl,-122.474554128533,37.7806813481352
14065241215151,140652412,15151,OtherOffenses,"Stay Away Order Violation, Dv Related",Tuesday,2014-08-05,23:30,Ingleside,"Arrest, Booked",2100 Block Of Alemany Bl,-122.441733117504,37.7181504780055
14094609928150,140946099,28150,Vandalism,"Malicious Mischief, Vandalism",Saturday,2014-11-08,05:15,Southern,"Arrest, Booked",300 Block Of 9th St,-122.410416664036,37.7727234013654
15029575103444,150295751,3444,Robbery,Attempted Robbery Chain Store With Bodily Force,Saturday,2015-04-04,13:35,Bayview,None,400 Block Of Rhodeisland St,-122.402571216964,37.7641259075201
14021083864085,140210838,64085,SuspiciousOcc,Investigative Detention,Wednesday,2014-03-12,06:30,Mission,None,300 Block Of Sancarlos St,-122.419694769885,37.7577752793043
14623433528150,146234335,28150,Vandalism,"Malicious Mischief, Vandalism",Sunday,2014-11-09,09:45,Southern,None,0 Block Of Harrison St,-122.389008295709,37.7892474519723
15027046865010,150270468,65010,OtherOffenses,Traffic Violation Arrest,Friday,2015-03-27,14:03,Tenderloin,"Arrest, Booked","Ellis St, Taylor St",-122.411141948101,37.7850736197499
15028652806243,150286528,6243,Larceny/theft,Petty Theft From Locked Auto,Wednesday,2015-04-01,15:35,Southern,None,800 Block Of Bryant St,-122.403404791479,37.775420706711
14035622264085,140356222,64085,SuspiciousOcc,Investigative Detention,Tuesday,2014-04-29,22:50,Northern,None,"Vanness Av, Turk St",-122.420641893733,37.7819608221838
14108214506244,141082145,6244,Larceny/theft,Grand Theft From Locked Auto,Wednesday,2014-12-24,18:00,Southern,None,0 Block Of Hawthorne St,-122.39863943141,37.7852440203445
14040249975030,140402499,75030,Non-criminal,Case Closure,Tuesday,2014-05-13,21:30,Ingleside,Unfounded,300 Block Of Vienna St,-122.428613620046,37.722765398728
15028518864020,150285188,64020,Non-criminal,"Aided Case, Mental Disturbed",Wednesday,2015-04-01,05:50,Tenderloin,None,300 Block Of Eddy St,-122.412930522059,37.7838344374141
15027322462050,150273224,62050,Warrants,Enroute To Outside Jurisdiction,Saturday,2015-03-28,09:27,Southern,None,"6th St, Mission St",-122.408710606663,37.7809706722053
14031412364085,140314123,64085,SuspiciousOcc,Investigative Detention,Tuesday,2014-04-15,19:50,Southern,None,800 Block Of 3rd St,-122.391425069857,37.7778727797586
15031053171010,150310531,71010,OtherOffenses,Lost/stolen License Plate,Monday,2015-04-06,16:00,Ingleside,None,400 Block Of Bosworth St,-122.431529190589,37.7330042457332
14001038764085,140010387,64085,SuspiciousOcc,Investigative Detention,Saturday,2014-01-04,14:20,Richmond,None,2500 Block Of Sutter St,-122.442364696255,37.7848750530811
14093394909029,140933949,9029,OtherOffenses,False Personation To Receive Money Or Property,Monday,2014-10-27,00:01,Bayview,None,0 Block Of Charteroak Avenue,-122.404686545316,37.7365866116543
14091032364020,140910323,64020,Non-criminal,"Aided Case, Mental Disturbed",Monday,2014-10-27,15:35,Taraval,None,600 Block Of Johnmuir Dr,-122.49206801734,37.7143615498756
14082590415162,140825904,15162,OtherOffenses,Violation Of Stay Away Order,Tuesday,2014-09-30,22:30,Taraval,"Arrest, Booked",3000 Block Of 20th Avenue,-122.475913117818,37.7318853447788
14621746606244,146217466,6244,Larceny/theft,Grand Theft From Locked Auto,Saturday,2014-10-18,15:00,Taraval,None,1600 Block Of 21st Avenue,-122.478877270862,37.7569222496142
14096684304134,140966843,4134,Assault,Battery,Saturday,2014-11-15,00:41,Mission,"Arrest, Booked",3000 Block Of 16th St,-122.421082850193,37.764910844226
14625913906224,146259139,6224,Larceny/theft,Grand Theft From Unlocked Auto,Saturday,2014-12-06,05:10,Park,None,1400 Block Of Cole St,-122.448969965226,37.7612508132309
14072914665056,140729146,65056,DrivingUnderTheInfluence,"Driving While Under The Influence Of Alcohol, W/injury",Tuesday,2014-09-02,06:00,Mission,None,1000 Block Of Potrero Avenue,-122.406539115148,37.7564864109309
15030156809320,150301568,9320,Fraud,"Credit Card, Theft By Use Of",Saturday,2015-04-04,20:48,Tenderloin,None,0 Block Of Turk St,-122.409853729941,37.7833862379382
14109673206244,141096732,6244,Larceny/theft,Grand Theft From Locked Auto,Tuesday,2014-12-30,09:45,Northern,None,1100 Block Of Fillmore St,-122.431979576386,37.7800478529923
15029511526145,150295115,26145,Larceny/theft,"Lost Property, Grand Theft",Saturday,2015-04-04,10:33,Mission,"Arrest, Booked",2500 Block Of 25th St,-122.403768502755,37.7518182541031
14090278419090,140902784,19090,Drunkenness,Under Influence Of Alcohol In A Public Place,Friday,2014-10-24,22:00,Tenderloin,"Arrest, Booked",0 Block Of 5thstnorth St,-122.408648588965,37.7849124714135
14089225416662,140892254,16662,Drug/narcotic,Possession Of Controlled Substance For Sale,Tuesday,2014-10-21,19:45,Tenderloin,"Arrest, Booked",300 Block Of Leavenworth St,-122.414406029855,37.7841907151119
15020222365070,150202223,65070,OtherOffenses,Throwing Substance At Vehicle,Friday,2015-03-06,07:30,Ingleside,None,"Alemany Bl, Silver Avenue",-122.43338693948,37.7297750315377
14094409364020,140944093,64020,Non-criminal,"Aided Case, Mental Disturbed",Friday,2014-11-07,14:41,Southern,None,1100 Block Of Mission St,-122.412736707425,37.7777124404316
15032492471010,150324924,71010,OtherOffenses,Lost/stolen License Plate,Sunday,2015-04-12,19:30,Ingleside,None,1000 Block Of Prague St,-122.437116746948,37.7101091081067
15031036504013,150310365,4013,Assault,Aggravated Assault With A Deadly Weapon,Thursday,2015-04-09,14:49,Bayview,None,"Fitzgerald Av, Jennings St",-122.393174162423,37.722036232083
14624067706374,146240677,6374,Larceny/theft,Grand Theft Of Property,Tuesday,2014-11-04,22:00,Northern,None,1900 Block Of Laguna St,-122.428878902684,37.7890558876736
14024522751041,140245227,51041,Non-criminal,Aided Case -property For Destruction,Sunday,2014-03-23,13:45,Park,None,100 Block Of Belvedere St,-122.449328648219,37.7677738874748
14093105664020,140931056,64020,Non-criminal,"Aided Case, Mental Disturbed",Monday,2014-11-03,12:22,Ingleside,None,200 Block Of Naglee Avenue,-122.448591356737,37.7135200057947
