fiscal_year,revenue_or_spending,related_govt_unit,organization_group_code,organization_group,department_code,department,program_code,program,character_code,character,object_code,object,sub_object_code,sub_object,fund_type_code,fund_type,fund_code,fund,fund_category_code,fund_category,budget
2025,Revenue,Revenue,2,"Public Works, Transportation & Commerce",PUC,Public Utilities Commission,ADMIN,Administrative,INT_INV_INC,Interest & Investment Income,INTEREST,Interest,430150,Interest Earned - Pooled Cash,ENT_FUND,Enterprise Funds,ENT_FUND~SFWD_TRST_AGNCY,San Francisco Water Department-Trust and Agency Fund,0.0,Unspecified,0.0
2025,Revenue,Revenue,2,"Public Works, Transportation & Commerce",DPW,Public Works,CAPCP,Capital-CPC Funded,INT_INV_INC,Interest & Investment Income,INTEREST,Interest,430150,Interest Earned - Pooled Cash,SP_REV,Special Revenue Funds,SP_REV~12785,Special Revenue Regional Measure 3 Authority County Capital Funding,3.0,Continuing Projects - Authority Control,0.0
2025,Revenue,Revenue,1,Public Protection,POL,Police,OPR,Operating,INT_INV_INC,Interest & Investment Income,INTEREST,Interest,430199,Interest Earned Adjustment,AGNCY_FUNDS,Agency Funds,AGNCY_FUNDS~28660,District Attorney Pre-Forfeited Asset Accounts,0.0,Unspecified,0.0
2025,Revenue,Revenue,6,General Administration & Finance,TIS,General Services Agency - Technology,OPR,Operating,EXP_RECOVERY,Expenditure Recovery,EXP_REC_SVC_AAO_FND,Expenditure Recovery - Services to AAO Fund,486630,Expense Recovery From Recreation and Parks (All Agency Operations),INTRL_SRVC,Internal Service Funds,INTRL_SRVC~DTIS_TELCOM_IS,Department of Technology and Information Services-Telecommunications and Information Services,3.0,Continuing Projects - Authority Control,0.0
2025,Spending,Spending,2,"Public Works, Transportation & Commerce",PUC,Public Utilities Commission,ADMIN,Administrative,SALARIES,Salaries,TEMP_MISC,Temporary Miscellaneous Salaries,505050,Temp Misc Other Timeoff,ENT_FUND,Enterprise Funds,ENT_FUND~SFWD_OP,San Francisco Water Department-Operating Fund,1.0,Operating,0.0
2025,Revenue,Revenue,4,Community Health,DPH,Public Health,RCVY,Disaster Recovery,INTER_REV_FED,Intergovernmental: Federal,FED_DIS_RELIEF,Federal - Disaster Relief,443111,Federal Emergency Management Agency - Federal Share,ENT_FUND,Enterprise Funds,ENT_FUND~SFGH_OP_,San Francisco General Hospital-Operating Fund,3.0,Continuing Projects - Authority Control,0.0
2025,Spending,Spending,4,Community Health,DPH,Public Health,TECH,Technology,MTL_SUPP,Materials & Supplies,OTH_MATL_SUPP,Other Materials and Supplies,549250,Minor Data Processing Equipment,GEN_FUND,General Fund,GEN_FUND~10020,General Fund Continuing Authority Control,3.0,Continuing Projects - Authority Control,0.0
2025,Spending,Spending,6,General Administration & Finance,ADM,General Services Agency - City Administrator,OPR,Operating,MAND_FRING_BEN,Mandatory Fringe Benefits,SOC_SEC,Social Security,514020,Social Sec-Medicare(HI Only),SP_REV,Special Revenue Funds,SP_REV~13550,Special Revenue Public Protection-Grant,4.0,Grants Projects,0.0
2025,Revenue,Revenue,2,"Public Works, Transportation & Commerce",PUC,Public Utilities Commission,OPR,Operating,INT_INV_INC,Interest & Investment Income,INTEREST,Interest,430150,Interest Earned - Pooled Cash,ENT_FUND,Enterprise Funds,ENT_FUND~CLN_PWR_SP_REV,CleanPowerSF Special Revenue F,6.0,Continuing Projects - Project Control,0.0
2025,Spending,Spending,2,"Public Works, Transportation & Commerce",DPW,Public Works,CAP,Capital,MAND_FRING_BEN,Mandatory Fringe Benefits,HLTH_SVC,Health Service,515010,Health Service - City Match,ENT_FUND,Enterprise Funds,ENT_FUND~HH_CPTL_PRJ,Hetchy Capital Projects Fund,3.0,Continuing Projects - Authority Control,0.0
2025,Spending,Spending,2,"Public Works, Transportation & Commerce",PUC,Public Utilities Commission,OPR,Operating,OH_ALLOCS,Overhead and Allocations,OVERHEAD,Overhead,520290,Division Overhead,ENT_FUND,Enterprise Funds,ENT_FUND~HH_OP,Hetchy Operating Fund,2.0,Annual Projects - Authority Control,0.0
2025,Revenue,Revenue,2,"Public Works, Transportation & Commerce",PRT,Port,CAP,Capital,INT_INV_INC,Interest & Investment Income,INTEREST,Interest,430120,Interest Earned-FisclAgentAcct,SP_REV,Special Revenue Funds,SP_REV~10865,Mission Rock Impact Fee,0.0,Unspecified,0.0
2025,Spending,Spending,2,"Public Works, Transportation & Commerce",PUC,Public Utilities Commission,OPR,Operating,NON_PERS_SVCS,Non-Personnel Services,OTH_CURR_EXP,Other Current Expenses,535810,Advertising,ENT_FUND,Enterprise Funds,ENT_FUND~CWP_OP,CleanPowerSF Water Power-Operating Fund,1.0,Operating,0.0
2025,Spending,Spending,5,Culture & Recreation,ART,Arts Commission,OPR,Operating,MAND_FRING_BEN,Mandatory Fringe Benefits,OTH_FR_BEN,Other Fringe Benefits,519990,Other Fringe Benefits,GEN_FUND,General Fund,GEN_FUND~10010,General Fund Annual Authority Control,2.0,Annual Projects - Authority Control,0.0
2025,Spending,Spending,1,Public Protection,SHF,Sheriff,MAINC,Maintenance-CPC Funded,MTL_SUPP,Materials & Supplies,BLDG_CNST_SUP,Building and Construction Supplies,542990,Other Building Maintenance Supplies,GEN_FUND,General Fund,GEN_FUND~10010,General Fund Annual Authority Control,2.0,Annual Projects - Authority Control,0.0
2025,Spending,Spending,3,Human Welfare & Neighborhood Development,HOM,Homelessness and Supportive Housing,OPR,Operating,SVCS_OTHER_DEPTS,Services Of Other Depts,581670,General Fund - Mayor's - Community Development Block Grant,581670,General Fund - Mayor's - Community Development Block Grant,GEN_FUND,General Fund,GEN_FUND~10020,General Fund Continuing Authority Control,3.0,Continuing Projects - Authority Control,0.0
2025,Revenue,Revenue,4,Community Health,DPH,Public Health,OPR,Operating,CHGS_FOR_SERVICES,Charges for Services,PB_INPATIENT_REV,Physician-Based Inpatient Revenue,465568,Patient Billing Inpatient San Francisco Health Plan/San Francisco Health Network Medi-Cal Managed Financial Class 108,ENT_FUND,Enterprise Funds,ENT_FUND~LHH_OP,Laguna Honda Hospital-Operating Fund,1.0,Operating,0.0
2025,Spending,Spending,6,General Administration & Finance,TTX,Treasurer/Tax Collector,OPR,Operating,NON_PERS_SVCS,Non-Personnel Services,TRAVEL,Travel,521030,Air Travel - Employees,GEN_FUND,General Fund,GEN_FUND~10000,General Fund Annual Account Control,1.0,Operating,0.0
2025,Spending,Spending,2,"Public Works, Transportation & Commerce",DPW,Public Works,OPR,Operating,SALARIES,Salaries,TEMP_MISC,Temporary Miscellaneous Salaries,505010,Temporary Miscellaneous Regular Salaries,SP_REV,Special Revenue Funds,SP_REV~12920,Special Revenue Human Welfare-Grants State,6.0,Continuing Projects - Project Control,0.0
2025,Spending,Spending,2,"Public Works, Transportation & Commerce",DPW,Public Works,OPR,Operating,NON_PERS_SVCS,Non-Personnel Services,PROF_SPEC_SVC,Professional and Specialized Services,527010,Architectural Services,ENT_FUND,Enterprise Funds,ENT_FUND~MTA_TRANSIT,Transit,0.0,Unspecified,0.0
2025,Spending,Spending,1,Public Protection,SHF,Sheriff,OPR,Operating,MTL_SUPP,Materials & Supplies,OTH_MATL_SUPP,Other Materials and Supplies,549410,Minor Furnishings,GEN_FUND,General Fund,GEN_FUND~10000,General Fund Annual Account Control,1.0,Operating,0.0
2025,Revenue,Revenue,4,Community Health,DPH,Public Health,OPR,Operating,CHGS_FOR_SERVICES,Charges for Services,HB_OUTPATIENT_REV,Hospital-Based Outpatient Revenue,465369,Hospital Billing Outpatient Other Medi-Cal Managed Financial Class 109,ENT_FUND,Enterprise Funds,ENT_FUND~LHH_OP,Laguna Honda Hospital-Operating Fund,1.0,Operating,0.0
2025,Revenue,Revenue,5,Culture & Recreation,WAR,War Memorial,MAINT,Maintenance,INT_INV_INC,Interest & Investment Income,INTEREST,Interest,430150,Interest Earned - Pooled Cash,SP_REV,Special Revenue Funds,SP_REV~14700,Special Revenue War Memorial Conservation Equipment Replacement,0.0,Unspecified,0.0
2025,Spending,Spending,6,General Administration & Finance,MYR,Mayor,OPR,Operating,SVCS_OTHER_DEPTS,Services Of Other Depts,581140,Department of Technology - Technology Projects,581140,Department of Technology - Technology Projects,SP_REV,Special Revenue Funds,SP_REV~12550,Special Revenue Grants; General Services Fund Continuing,4.0,Grants Projects,0.0
2025,Spending,Spending,5,Culture & Recreation,ART,Arts Commission,OPR,Operating,MAND_FRING_BEN,Mandatory Fringe Benefits,OTH_FR_BEN,Other Fringe Benefits,519110,Flexible Benefit Package,GEN_FUND,General Fund,GEN_FUND~10020,General Fund Continuing Authority Control,3.0,Continuing Projects - Authority Control,0.0
2025,Spending,Spending,2,"Public Works, Transportation & Commerce",DPW,Public Works,CAP,Capital,NON_PERS_SVCS,Non-Personnel Services,RENTLSE_EQUIP,Rents and Leases - Equipment,531990,Other Equipment Rentals,SP_REV,Special Revenue Funds,SP_REV~12920,Special Revenue Human Welfare-Grants State,6.0,Continuing Projects - Project Control,0.0
2025,Spending,Spending,2,"Public Works, Transportation & Commerce",AIR,Airport Commission,CAP,Capital,MAND_FRING_BEN,Mandatory Fringe Benefits,UNEMP_INSUR,Unemployment Insurance,517010,Unemployment Insurance,ENT_FUND,Enterprise Funds,ENT_FUND~SFIA_CPTL_PRJ,San Francisco International Airport-Capital Projects Fund,0.0,Unspecified,0.0
2025,Spending,Spending,5,Culture & Recreation,REC,Recreation and Park Commission,CAP,Capital,NON_PERS_SVCS,Non-Personnel Services,TAX_LIC_PERM,Taxes: Licenses/Permits,552260,San Francisco Department of Public Works Permits and Fees,CPTL_PRJ,Capital Projects Funds,CPTL_PRJ~15384,Capital Projects X Fund Certificate of Participation Critical Repairs/Recovery Stimulus,3.0,Continuing Projects - Authority Control,0.0
2025,Spending,Spending,2,"Public Works, Transportation & Commerce",PUC,Public Utilities Commission,OPR,Operating,MTL_SUPP,Materials & Supplies,SAFETY,Safety,545990,Other Safety Expenses,ENT_FUND,Enterprise Funds,ENT_FUND~SFWD_OP,San Francisco Water Department-Operating Fund,2.0,Annual Projects - Authority Control,0.0
2025,Revenue,Revenue,3,Human Welfare & Neighborhood Development,CCD,San Francisco Community College District,OPR,Operating,PROP_TAX,Property Taxes,SUPP_CY,Supplemental - Current Year,410310,Supplemental Assistance Senate Bill 813 - Current Year Secured,INVEST_TRST_FUND,Investment Trust Fund,INVEST_TRST_FUND~30510,San Francisco Community College District-General Fund,0.0,Unspecified,0.0
2025,Spending,Spending,6,General Administration & Finance,TIS,General Services Agency - Technology,CAP,Capital,MAND_FRING_BEN,Mandatory Fringe Benefits,SOC_SEC,Social Security,514020,Social Sec-Medicare(HI Only),ENT_FUND,Enterprise Funds,ENT_FUND~SFWD_CPTL_PRJ,San Francisco Water Department-Capital Projects Fund,3.0,Continuing Projects - Authority Control,0.0
2025,Spending,Spending,2,"Public Works, Transportation & Commerce",DBI,Department of Building Inspection,OPR,Operating,MAND_FRING_BEN,Mandatory Fringe Benefits,SOC_SEC,Social Security,514020,Social Sec-Medicare(HI Only),SP_REV,Special Revenue Funds,SP_REV~10230,Special Revenue Building Inspection Fund-Continuing Projects,3.0,Continuing Projects - Authority Control,0.0
2025,Spending,Spending,2,"Public Works, Transportation & Commerce",AIR,Airport Commission,OPR,Operating,NON_PERS_SVCS,Non-Personnel Services,PROF_SPEC_SVC,Professional and Specialized Services,527080,Construction Management Svcs,ENT_FUND,Enterprise Funds,ENT_FUND~SFIA_OP,San Francisco International Airport-Operating Fund,1.0,Operating,0.0
2025,Spending,Spending,6,General Administration & Finance,MYR,Mayor,OPR,Operating,MTL_SUPP,Materials & Supplies,FOOD,Food,546990,Food,SP_REV,Special Revenue Funds,SP_REV~10790,Special Revenue Housing Program Fees,3.0,Continuing Projects - Authority Control,0.0
2025,Spending,Spending,2,"Public Works, Transportation & Commerce",DPW,Public Works,CAPCP,Capital-CPC Funded,MAND_FRING_BEN,Mandatory Fringe Benefits,OTH_FR_BEN,Other Fringe Benefits,519120,Long Term Disability Insurance,SP_REV,Special Revenue Funds,SP_REV~11895,Special Revenue Recreation and Parks Maintenance Fund,3.0,Continuing Projects - Authority Control,0.0
2025,Spending,Spending,2,"Public Works, Transportation & Commerce",PUC,Public Utilities Commission,MAINT,Maintenance,SVCS_OTHER_DEPTS,Services Of Other Depts,581071,Street Repair - Department of Public Works - Engineering,581071,Street Repair - Department of Public Works - Engineering,ENT_FUND,Enterprise Funds,ENT_FUND~SFWD_OP,San Francisco Water Department-Operating Fund,2.0,Annual Projects - Authority Control,0.0
2025,Spending,Spending,1,Public Protection,ADP,Adult Probation,ADMIN,Administrative,MTL_SUPP,Materials & Supplies,OTH_MATL_SUPP,Other Materials and Supplies,549990,Other Materials and Supplies,SP_REV,Special Revenue Funds,SP_REV~13550,Special Revenue Public Protection-Grant,4.0,Grants Projects,0.0
2025,Spending,Spending,2,"Public Works, Transportation & Commerce",MTA,Municipal Transportation Agency,OPR,Operating,MAND_FRING_BEN,Mandatory Fringe Benefits,HLTH_SVC,Health Service,515710,Dependent Coverage,ENT_FUND,Enterprise Funds,ENT_FUND~STBL_ST,Sustainable Streets,1.0,Operating,0.0
2025,Spending,Spending,2,"Public Works, Transportation & Commerce",DPW,Public Works,CAP,Capital,MAND_FRING_BEN,Mandatory Fringe Benefits,HLTH_SVC,Health Service,515030,Retiree Health Care - City Match Proposition C,CPTL_PRJ,Capital Projects Funds,CPTL_PRJ~15440,Capital Projects X Fund 2008 San Francisco General Hospital Improvement S2012D,0.0,Unspecified,0.0
2025,Revenue,Revenue,3,Human Welfare & Neighborhood Development,CCD,San Francisco Community College District,OPR,Operating,PROP_TAX,Property Taxes,OTH_PROP_TAX,Other Property Tax,410920,Prop Tax Ab 1290 Rda Passthrgh,INVEST_TRST_FUND,Investment Trust Fund,INVEST_TRST_FUND~30510,San Francisco Community College District-General Fund,0.0,Unspecified,0.0
2025,Spending,Spending,2,"Public Works, Transportation & Commerce",DPW,Public Works,CAP,Capital,MAND_FRING_BEN,Mandatory Fringe Benefits,OTH_FR_BEN,Other Fringe Benefits,519130,Life Insurance,SP_REV,Special Revenue Funds,SP_REV~CHLD,Children's Fund,3.0,Continuing Projects - Authority Control,0.0
2025,Spending,Spending,1,Public Protection,DAT,District Attorney,OPR,Operating,NON_PERS_SVCS,Non-Personnel Services,MNTSVCS_BLDG_STRUC,Maintenance Services - Buildings & Structures,528110,Security,GEN_FUND,General Fund,GEN_FUND~10000,General Fund Annual Account Control,1.0,Operating,0.0
2025,Revenue,Revenue,6,General Administration & Finance,HSS,Health Service System,OPR,Operating,EXP_RECOVERY,Expenditure Recovery,EXP_REC_SVC_AAO_FND,Expenditure Recovery - Services to AAO Fund,486030,Expense Recovery From Administrative Services (All Agency Operations),GEN_FUND,General Fund,GEN_FUND~10000,General Fund Annual Account Control,1.0,Operating,0.0
2025,Spending,Spending,2,"Public Works, Transportation & Commerce",MTA,Municipal Transportation Agency,CAP,Capital,SALARIES,Salaries,PREM_PAY,Premium Pay,509010,Premium Pay - Misc,ENT_FUND,Enterprise Funds,ENT_FUND~SFWD_CPTL_PRJ,San Francisco Water Department-Capital Projects Fund,3.0,Continuing Projects - Authority Control,0.0
2025,Spending,Spending,2,"Public Works, Transportation & Commerce",PUC,Public Utilities Commission,RCVY,Disaster Recovery,MAND_FRING_BEN,Mandatory Fringe Benefits,RETIREMENT,Retirement,513010,Retiree City Miscellaneous,ENT_FUND,Enterprise Funds,ENT_FUND~SFWD_OP,San Francisco Water Department-Operating Fund,1.0,Operating,0.0
2025,Revenue,Revenue,7,General City Responsibilities,GEN,General Fund Unallocated,OPR,Operating,PROP_TAX,Property Taxes,OTH_PROP_TAX,Other Property Tax,410999,Unallocated General Property Taxes,GEN_FUND,General Fund,GEN_FUND~10000,General Fund Annual Account Control,1.0,Operating,0.0
2025,Spending,Spending,6,General Administration & Finance,MYR,Mayor,OPR,Operating,NON_PERS_SVCS,Non-Personnel Services,PROF_SPEC_SVC,Professional and Specialized Services,527990,Other Professional Services,SP_REV,Special Revenue Funds,SP_REV~13350,Open Space & Park-Annual Proj,2.0,Annual Projects - Authority Control,0.0
2025,Revenue,Revenue,4,Community Health,DPH,Public Health,OPR,Operating,CHGS_FOR_SERVICES,Charges for Services,PB_INPATIENT_REV,Physician-Based Inpatient Revenue,465544,Patient Billing Inpatient Self-pay Financial Class 4,ENT_FUND,Enterprise Funds,ENT_FUND~SFGH_OP_,San Francisco General Hospital-Operating Fund,1.0,Operating,31115.0
2025,Revenue,Revenue,2,"Public Works, Transportation & Commerce",DPW,Public Works,CAP,Capital,EXP_RECOVERY,Expenditure Recovery,EXP_REC_SVC_NONAAO,Expenditure Recovery - Services to Non-AAO,487040,Expense Recovery From Administration (Non-All Agency Operations),GEN_FUND,General Fund,GEN_FUND~10040,General Fund Public Works Work Order,5.0,Work Orders/Overhead,0.0
2025,Spending,Spending,2,"Public Works, Transportation & Commerce",PRT,Port,OPR,Operating,NON_PERS_SVCS,Non-Personnel Services,MNTSVCS_EQUIP,Maintenance Services - Equipment,529990,Other Equipment Maintenance,ENT_FUND,Enterprise Funds,ENT_FUND~PRT_SBEACH_HBR,Port-South Beach Harbor Fund,2.0,Annual Projects - Authority Control,0.0
2025,Spending,Spending,2,"Public Works, Transportation & Commerce",DPW,Public Works,CAP,Capital,OH_ALLOCS,Overhead and Allocations,OVERHEAD,Overhead,520290,Division Overhead,CPTL_PRJ,Capital Projects Funds,CPTL_PRJ~15514,Capital Projects X Fund 2020 Earthquake Safety and Emergency Response S2021E,0.0,Unspecified,0.0
2025,Revenue,Revenue,2,"Public Works, Transportation & Commerce",DPW,Public Works,CAP,Capital,INT_INV_INC,Interest & Investment Income,INTEREST,Interest,430150,Interest Earned - Pooled Cash,CPTL_PRJ,Capital Projects Funds,CPTL_PRJ~17070,Capital Projects Street Improvement Fund 2006 Proposition 1B-County-2008,0.0,Unspecified,0.0
2025,Spending,Spending,5,Culture & Recreation,REC,Recreation and Park Commission,OPR,Operating,NON_PERS_SVCS,Non-Personnel Services,PROF_SPEC_SVC,Professional and Specialized Services,527990,Other Professional Services,SP_REV,Special Revenue Funds,SP_REV~11902,Special Revenue Recreation and Parks-Marina-Annual,1.0,Operating,0.0
2025,Revenue,Revenue,6,General Administration & Finance,MYR,Mayor,OPR,Operating,INT_INV_INC,Interest & Investment Income,INTEREST,Interest,430150,Interest Earned - Pooled Cash,SP_REV,Special Revenue Funds,SP_REV~14190,Special Revenue Low-Moderate Income Housing Non-Bond,3.0,Continuing Projects - Authority Control,0.0
2025,Revenue,Revenue,7,General City Responsibilities,GEN,General Fund Unallocated,OPR,Operating,INT_INV_INC,Interest & Investment Income,INTEREST,Interest,430150,Interest Earned - Pooled Cash,SP_REV,Special Revenue Funds,SP_REV~10790,Special Revenue Housing Program Fees,3.0,Continuing Projects - Authority Control,0.0
2025,Spending,Spending,5,Culture & Recreation,ART,Arts Commission,CAPCP,Capital-CPC Funded,MAND_FRING_BEN,Mandatory Fringe Benefits,RETIREMENT,Retirement,513010,Retiree City Miscellaneous,CPTL_PRJ,Capital Projects Funds,CPTL_PRJ~15512,Capital Projects X Fund 2020 Earthquake Safety and Emergency Response S2021B,0.0,Unspecified,0.0
2025,Spending,Spending,2,"Public Works, Transportation & Commerce",DPW,Public Works,CAP,Capital,NON_PERS_SVCS,Non-Personnel Services,PROF_SPEC_SVC,Professional and Specialized Services,527040,Construction Contracts,CPTL_PRJ,Capital Projects Funds,CPTL_PRJ~15420,Capital Projects X Fund 2008 San Francisco General Hospital Improvement S2010A,0.0,Unspecified,0.0
2025,Revenue,Revenue,2,"Public Works, Transportation & Commerce",MTA,Municipal Transportation Agency,RCVY,Disaster Recovery,INTER_REV_FED,Intergovernmental: Federal,FED_DIS_RELIEF,Federal - Disaster Relief,443111,Federal Emergency Management Agency - Federal Share,ENT_FUND,Enterprise Funds,ENT_FUND~SU_STREETS,Sustainable Streets,1.0,Operating,0.0
2025,Spending,Spending,5,Culture & Recreation,REC,Recreation and Park Commission,CAP,Capital,MTL_SUPP,Materials & Supplies,BLDG_CNST_SUP,Building and Construction Supplies,542810,Small Tools and Instruments,SP_REV,Special Revenue Funds,SP_REV~11895,Special Revenue Recreation and Parks Maintenance Fund,3.0,Continuing Projects - Authority Control,0.0
2025,Spending,Spending,1,Public Protection,POL,Police,CAPCP,Capital-CPC Funded,NON_PERS_SVCS,Non-Personnel Services,MNTSVCS_BLDG_STRUC,Maintenance Services - Buildings & Structures,528990,Other Bldg Maint Svcs,GEN_FUND,General Fund,GEN_FUND~10020,General Fund Continuing Authority Control,3.0,Continuing Projects - Authority Control,0.0
2025,Spending,Spending,2,"Public Works, Transportation & Commerce",PUC,Public Utilities Commission,CAP,Capital,MTL_SUPP,Materials & Supplies,SAFETY,Safety,545990,Other Safety Expenses,ENT_FUND,Enterprise Funds,ENT_FUND~SU_STREETS,Sustainable Streets,0.0,Unspecified,0.0
2025,Spending,Spending,5,Culture & Recreation,ART,Arts Commission,MAINT,Maintenance,SALARIES,Salaries,TEMP_MISC,Temporary Miscellaneous Salaries,505010,Temporary Miscellaneous Regular Salaries,GEN_FUND,General Fund,GEN_FUND~10010,General Fund Annual Authority Control,2.0,Annual Projects - Authority Control,0.0
2025,Spending,Spending,2,"Public Works, Transportation & Commerce",PUC,Public Utilities Commission,RCVY,Disaster Recovery,MAND_FRING_BEN,Mandatory Fringe Benefits,OTH_FR_BEN,Other Fringe Benefits,519990,Other Fringe Benefits,ENT_FUND,Enterprise Funds,ENT_FUND~HH_OP_GRNT,Hetchy Operating Grants Fund,0.0,Unspecified,0.0
2025,Revenue,Revenue,1,Public Protection,JUV,Juvenile Probation,OPR,Operating,EXP_RECOVERY,Expenditure Recovery,EXP_REC_SVC_NONAAO,Expenditure Recovery - Services to Non-AAO,487990,Exp Rec-Unallocated Non-AAO Fd,GEN_FUND,General Fund,GEN_FUND~10010,General Fund Annual Authority Control,2.0,Annual Projects - Authority Control,0.0
2025,Revenue,Revenue,3,Human Welfare & Neighborhood Development,DEC,Department of Early Childhood,OPR,Operating,EXP_RECOVERY,Expenditure Recovery,EXP_REC_SVC_AAO_FND,Expenditure Recovery - Services to AAO Fund,486400,Exp Rec Fr CommMental Hlth AAO,SP_REV,Special Revenue Funds,SP_REV~CHLD_FAMLY,Children and Families Fund,3.0,Continuing Projects - Authority Control,0.0
2025,Revenue,Revenue,6,General Administration & Finance,ADM,General Services Agency - City Administrator,CAP,Capital,INT_INV_INC,Interest & Investment Income,INTEREST,Interest,430150,Interest Earned - Pooled Cash,CPTL_PRJ,Capital Projects Funds,CPTL_PRJ~15384,Capital Projects X Fund Certificate of Participation Critical Repairs/Recovery Stimulus,3.0,Continuing Projects - Authority Control,0.0
2025,Revenue,Revenue,6,General Administration & Finance,MYR,Mayor,OPR,Operating,INT_INV_INC,Interest & Investment Income,INTEREST,Interest,430150,Interest Earned - Pooled Cash,SP_REV,Special Revenue Funds,SP_REV~10572,Special Revenue Affordable Housing Community Development Certificate of Participation,0.0,Unspecified,0.0
2025,Spending,Spending,2,"Public Works, Transportation & Commerce",DPW,Public Works,CAP,Capital,OH_ALLOCS,Overhead and Allocations,OVERHEAD,Overhead,520990,Other Overhead Charges,ENT_FUND,Enterprise Funds,ENT_FUND~LHH_CPTL_PRJ,Laguna Honda Hospital-Capital Projects Fund,0.0,Unspecified,0.0
2025,Revenue,Revenue,4,Community Health,DPH,Public Health,RCVY,Disaster Recovery,INTER_REV_FED,Intergovernmental: Federal,FED_DIS_RELIEF,Federal - Disaster Relief,443111,Federal Emergency Management Agency - Federal Share,SP_REV,Special Revenue Funds,SP_REV~10582,Special Revenue Our City Our Home November 2018 Proposition C Homeless Services,3.0,Continuing Projects - Authority Control,0.0
2025,Spending,Spending,2,"Public Works, Transportation & Commerce",DPW,Public Works,CAP,Capital,MTL_SUPP,Materials & Supplies,BLDG_CNST_SUP,Building and Construction Supplies,542510,Painters Supplies,SP_REV,Special Revenue Funds,SP_REV~13080,Special Revenue Library Fund-Continuing,3.0,Continuing Projects - Authority Control,0.0
2025,Spending,Spending,6,General Administration & Finance,TIS,General Services Agency - Technology,CAP,Capital,MTL_SUPP,Materials & Supplies,OTH_MATL_SUPP,Other Materials and Supplies,549990,Other Materials and Supplies,CPTL_PRJ,Capital Projects Funds,CPTL_PRJ~15780,Capital Projects X Fund 2014 Earthquake Safety and Emergency Response S2016D,3.0,Continuing Projects - Authority Control,0.0
2025,Spending,Spending,2,"Public Works, Transportation & Commerce",PUC,Public Utilities Commission,RCVY,Disaster Recovery,SALARIES,Salaries,TEMP_MISC,Temporary Miscellaneous Salaries,505010,Temporary Miscellaneous Regular Salaries,ENT_FUND,Enterprise Funds,ENT_FUND~SFWD_OP,San Francisco Water Department-Operating Fund,1.0,Operating,0.0
2025,Spending,Spending,5,Culture & Recreation,ART,Arts Commission,CAP,Capital,NON_PERS_SVCS,Non-Personnel Services,PROF_SPEC_SVC,Professional and Specialized Services,527990,Other Professional Services,CPTL_PRJ,Capital Projects Funds,CPTL_PRJ~15440,Capital Projects X Fund 2008 San Francisco General Hospital Improvement S2012D,0.0,Unspecified,0.0
2025,Spending,Spending,2,"Public Works, Transportation & Commerce",DPW,Public Works,CAP,Capital,SALARIES,Salaries,OVERTIME,Overtime,511010,Overtime - Scheduled Miscellaneous,CPTL_PRJ,Capital Projects Funds,CPTL_PRJ~17260,Capital Projects Street Improvement Fund 2011 Road Repaving and Streets Fiscal Year-2016E,3.0,Continuing Projects - Authority Control,0.0
2025,Spending,Spending,2,"Public Works, Transportation & Commerce",DPW,Public Works,CAP,Capital,OH_ALLOCS,Overhead and Allocations,OVERHEAD,Overhead,520990,Other Overhead Charges,CPTL_PRJ,Capital Projects Funds,CPTL_PRJ~16940,Capital Projects Recreation and Parks Capital Improvement-Other,6.0,Continuing Projects - Project Control,0.0
2025,Spending,Spending,6,General Administration & Finance,MYR,Mayor,OPR,Operating,NON_PERS_SVCS,Non-Personnel Services,PROF_SPEC_SVC,Professional and Specialized Services,527990,Other Professional Services,GEN_FUND,General Fund,GEN_FUND~10000,General Fund Annual Account Control,1.0,Operating,0.0
2025,Spending,Spending,2,"Public Works, Transportation & Commerce",PRT,Port,ADMIN,Administrative,MTL_SUPP,Materials & Supplies,EQUIP_MNTC_SUP,Equipment Maintenance Supplies,543990,Other Equipment Maint Supplies,ENT_FUND,Enterprise Funds,ENT_FUND~PRT_OP,Port Operating,1.0,Operating,0.0
